"OBJECTID_12","OBJECTID","caption","url","isUrban","latitude","longitude","id","owner","hometown","datetaken","dateupload","tags1","tags2","tags3","tags4","tags5","tags6","tags7","tags8","tags9","tags10","uniqueID","OBJECTID_1","STUSPS","datetime","date","month","hour"
143710,143758," ","https://farm6.staticflickr.com/5761/20522332870_3b38cfdcf7.jpg",0,44.350527,-73.413162,"20522332870","45724078@N05","12996","8/19/2015 11:32","8/19/2015 16:59","flower","sunflower","plant","flowering plant","daisy family","annual plant","field","spring"," "," ",143758,1,"NY",2015-08-19 11:32:00,2015-08-19,8,11
24012,24012," ","https://farm6.staticflickr.com/5656/20708163139_1a21f85bd6.jpg",0,44.179091,-71.758064,"20708163139","90886740@N08","Chapel Hill, NC","7/6/2015 20:59","8/26/2015 10:12","sky","road","overhead power line","infrastructure","electricity","transmission tower","morning","atmosphere","atmosphere of earth","cloud",24012,3,"NH",2015-07-06 20:59:00,2015-07-06,7,20
237668,237677," ","https://farm5.staticflickr.com/4417/37150320131_f4650db09c.jpg",0,44.304952,-68.28302,"37150320131","133282363@N04"," ","9/9/2017 12:38","9/18/2017 0:40","nature","water","vegetation","garden","botanical garden","landscape","leaf","walkway","plant","grass",237677,4,"ME",2017-09-09 12:38:00,2017-09-09,9,12
219199,219105," ","https://farm8.staticflickr.com/7322/9741650042_ebcc195a0d.jpg",0,44.398783,-70.78882,"9741650042","97288792@N02","Portland, ME","9/6/2013 14:41","9/14/2013 12:39","golf course","tree","grass","sky","golf club","landscape","grassland","meadow","land lot","lawn",219105,4,"ME",2013-09-06 14:41:00,2013-09-06,9,14
215565,215554,"Dcim\110gopro\Gopr1052.Jpg","https://farm5.staticflickr.com/4254/35539167385_2217ec6390.jpg",0,44.336547,-71.277975,"35539167385","44126613@N00","Dedham, MA","6/25/2017 16:04","6/26/2017 4:16","outdoor recreation","tree","woody plant","adventure","wilderness","plant","path","adventure racing","jungle","tourism",215554,3,"NH",2017-06-25 16:04:00,2017-06-25,6,16
32142,32149,"Conway, New Hampshire","https://farm9.staticflickr.com/8498/8363692220_4188995ddf.jpg",0,43.985191,-71.119659,"8363692220","40823673@N04"," ","10/8/2012 13:25","1/9/2013 4:30","water","nature","leaf","bridge","river","tree","plant","reflection","watercourse","landscape",32149,3,"NH",2012-10-08 13:25:00,2012-10-08,10,13
271765,271681," ","https://farm6.staticflickr.com/5538/14462334699_4c6cba3915.jpg",0,44.656833,-67.206334,"14462334699","59470058@N05"," ","7/13/2014 7:05","7/14/2014 2:11","vehicle","car","personal protective equipment","fun","recreation","vacation","passenger","travel","adventure","tourism",271681,4,"ME",2014-07-13 07:05:00,2014-07-13,7,7
138964,138973," ","https://farm8.staticflickr.com/7354/15813661854_292279fe89.jpg",0,44.334681,-74.117207,"15813661854","98753410@N00"," ","2/3/2015 8:34","2/3/2015 16:34","snow","red","winter","freezing","tree","geological phenomenon","fun","ski equipment","ice","blizzard",138973,1,"NY",2015-02-03 08:34:00,2015-02-03,2,8
15249,15256," ","https://farm6.staticflickr.com/5599/30053591455_ecdea7e685.jpg",0,43.916174,-71.576225,"30053591455","44126613@N00","Dedham, MA","10/1/2016 10:41","10/2/2016 0:40","outdoor recreation","tree","geological phenomenon","adventure","vacation","hiking","recreation","tourism","rock","travel",15256,3,"NH",2016-10-01 10:41:00,2016-10-01,10,10
220183,222061," ","https://farm2.staticflickr.com/1608/25583582081_8afee47bc6.jpg",0,44.946128,-71.326965,"25583582081","89709145@N08"," ","3/10/2016 11:02","3/10/2016 17:06","helicopter rotor","snow","helicopter","aircraft","rotorcraft","winter","aviation","atmosphere of earth","sky","air travel",222061,3,"NH",2016-03-10 11:02:00,2016-03-10,3,11
62405,62413,"Seen from Wakely Mnt summit Wakely Mountain is part of the Adirondack
Firetower Challenge","https://farm3.staticflickr.com/2893/9317316745_114627066f.jpg",0,43.735813,-74.515337,"9317316745","56473607@N05","Montreal","7/13/2013 9:35","7/19/2013 7:11","sky","cloud","nature","highland","ecosystem","horizon","atmosphere","wilderness","grassland","cumulus",62413,1,"NY",2013-07-13 09:35:00,2013-07-13,7,9
116792,116801," ","https://farm6.staticflickr.com/5324/9337462611_b053ab80b6.jpg",0,44.128479,-74.54437,"9337462611","23903314@N04"," ","7/21/2013 18:07","7/22/2013 1:07","cloud","sky","nature","tree","wilderness","woody plant","water","mountain","river","forest",116801,1,"NY",2013-07-21 18:07:00,2013-07-21,7,18
59283,59291," ","https://farm8.staticflickr.com/7789/28355614555_9ddc79d18e.jpg",0,43.446944,-74.526389,"28355614555","109226633@N04","Binghamton, NY","7/16/2016 8:13","7/17/2016 2:32","land vehicle","road bicycle","cycling","bicycle","cycle sport","day","bicycle racing","vehicle","mountain bike","tree",59291,1,"NY",2016-07-16 08:13:00,2016-07-16,7,8
13861,13869," ","https://farm9.staticflickr.com/8074/29348190571_a84386b01c.jpg",0,43.65304,-71.271507,"29348190571","43631321@N02","Salem","9/3/2016 11:40","9/3/2016 15:40","reflection","sky","water","nature","horizon","sunset","river","waterway","calm","lake",13869,3,"NH",2016-09-03 11:40:00,2016-09-03,9,11
144196,144273,"[adkfarmerdan.com](http://adkfarmerdan.com)","https://farm4.staticflickr.com/3831/13848605494_235557b895.jpg",0,44.34883,-73.412431,"13848605494","45724078@N05","12996","4/13/2014 15:15","4/14/2014 14:22","sky","field","cloud","grassland","tree","prairie","grass family","grass","rural area","soil",144273,1,"NY",2014-04-13 15:15:00,2014-04-13,4,15
256443,256452,"Visit to Middle Path 48 in Bar Harbor, ME... About a month before
completion... Delivery at the end of June","https://farm8.staticflickr.com/7102/7319984472_91ec732182.jpg",0,44.447666,-68.375,"7319984472","97225209@N00","Washington, DC","5/29/2012 15:50","6/2/2012 12:15","table","kitchen","furniture","interior design"," "," "," "," "," "," ",256452,4,"ME",2012-05-29 15:50:00,2012-05-29,5,15
126725,126734,"DCIM\146GOPRO","https://farm8.staticflickr.com/7529/15873687717_e70b48f81d.jpg",0,44.800063,-74.770331,"15873687717","68280454@N04","Brasher Falls","5/27/2014 12:38","12/22/2014 14:53","property","wood","stairs","house","real estate","handrail","window","leisure","recreation","chair",126734,1,"NY",2014-05-27 12:38:00,2014-05-27,5,12
236329,236338," ","https://farm2.staticflickr.com/1489/24328689096_599f975c1c.jpg",0,44.277385,-68.323861,"24328689096","11537264@N00","Norfolk, VA","8/7/2015 19:46","1/13/2016 13:28","sky","tree","reflection","woody plant","dawn","water","dusk","morning","sunset","evening",236338,4,"ME",2015-08-07 19:46:00,2015-08-07,8,19
240613,240622," ","https://farm6.staticflickr.com/5616/30104399714_579abb5100.jpg",0,44.317715,-68.338748,"30104399714","34136590@N02"," ","9/30/2016 0:00","11/2/2016 18:15","wilderness","leaf","vegetation","mountain","tree","nature reserve","ridge","rock","highland","hill",240622,4,"ME",2016-09-30 00:00:00,2016-09-30,9,0
31374,31381," ","https://farm3.staticflickr.com/2920/14382330917_a3b3ce4dd0.jpg",0,44.052625,-71.159112,"14382330917","35553264@N08","New Orleans","6/17/2014 13:19","7/4/2014 1:00","child","pink","face","skin","nose","cheek","girl","fun","mouth","summer",31381,3,"NH",2014-06-17 13:19:00,2014-06-17,6,13
113659,113668," ","https://farm9.staticflickr.com/8299/7785940646_19003ee4cd.jpg",0,44.333372,-75.927565,"7785940646","76579169@N00","Karachi, Khuzdar, Shahdad Kot","8/4/2012 18:04","8/15/2012 3:49","water","sea","sky","body of water","cloud","tourism","vacation","fun","leisure","boating",113668,1,"NY",2012-08-04 18:04:00,2012-08-04,8,18
225552,225561," ","https://farm8.staticflickr.com/7514/28802520661_8bd37d6663.jpg",0,45.068447,-70.314973,"28802520661","92611166@N00"," ","10/12/2014 13:59","8/9/2016 21:35","road","tree","sky","asphalt","leaf","plant","road surface","area","grass","land lot",225561,4,"ME",2014-10-12 13:59:00,2014-10-12,10,13
32173,32180," ","https://farm6.staticflickr.com/5560/14715378243_c1bc4bfd09.jpg",0,43.999533,-71.008727,"14715378243","7424976@N04"," ","7/19/2014 11:00","7/20/2014 2:32","house","home","siding","tree","roof","barn","wood","building","facade","cottage",32180,3,"NH",2014-07-19 11:00:00,2014-07-19,7,11
232047,232056," ","https://farm9.staticflickr.com/8445/7914636180_c8f7c18736.jpg",0,44.202388,-68.620107,"7914636180","99295483@N00"," ","8/17/2012 15:05","9/2/2012 16:37","water","water transportation","boat","sea","boating","watercraft","ocean"," "," "," ",232056,4,"ME",2012-08-17 15:05:00,2012-08-17,8,15
196830,196839," ","https://farm9.staticflickr.com/8115/29189949070_d6a23cc373.jpg",0,44.762986,-72.147003,"29189949070","74133755@N00","Barton, Vermont","8/18/2016 20:57","9/5/2016 17:16","spider","arachnid","invertebrate","arthropod","araneus","orb weaver spider","tangle web spider","insect","european garden spider","araneus cavaticus",196839,2,"VT",2016-08-18 20:57:00,2016-08-18,8,20
107248,107257," ","https://farm6.staticflickr.com/5564/14667534118_e499eff5b8.jpg",0,44.1,-76.37,"14667534118","52442335@N03","Parkersburg, IA","8/7/2014 15:54","8/7/2014 19:54","sky","landmark","grass","tower","cloud","tree","signage","street sign","sign","street light",107257,1,"NY",2014-08-07 15:54:00,2014-08-07,8,15
104083,104092,"Plaque commemorating the place where Theodore Roosevelt learned of President
McKinley's assassination and thus his own ascension to the Presidency.","https://farm8.staticflickr.com/7374/9969708475_d1f25ed127.jpg",0,43.702808,-73.989486,"9969708475","7740740@N02","West Memphis, Arkansas","8/6/2013 17:51","9/27/2013 19:07","commemorative plaque","memorial","signage","history","font","sign"," "," "," "," ",104092,1,"NY",2013-08-06 17:51:00,2013-08-06,8,17
50402,50410,"Another great Christmas with our family and friends upstate. A little bit of
sadness with this once since it was the first without Aunt Marlin, but I think
she would have been happy to know we had as good a time as possible in her
memory. Merry Christmas","https://farm8.staticflickr.com/7466/15925848430_9f56304c21.jpg",0,43.125672,-75.327417,"15925848430","125879493@N07"," ","12/24/2014 17:19","12/26/2014 19:22","mammal","room","furniture","sitting","girl","communication","fun","house","event"," ",50410,1,"NY",2014-12-24 17:19:00,2014-12-24,12,17
28378,28385," ","https://farm9.staticflickr.com/8202/28969119614_0d25437931.jpg",0,44.154805,-71.643831,"28969119614","54573009@N00"," ","9/10/2016 12:51","9/11/2016 0:43","vegetation","mountainous landforms","mountain","wilderness","hill station","highland","hill","ridge","sky","tree",28385,3,"NH",2016-09-10 12:51:00,2016-09-10,9,12
223375,223384," ","https://farm9.staticflickr.com/8694/28377453561_b098f506bc.jpg",0,44.586994,-70.23172,"28377453561","145256594@N02"," ","7/20/2016 20:35","7/21/2016 17:51","car","town","house","property","family car","building","residential area","neighbourhood","luxury vehicle","sky",223384,4,"ME",2016-07-20 20:35:00,2016-07-20,7,20
36944,36951," ","https://farm8.staticflickr.com/7261/7723886756_528c5103cc.jpg",0,44.149833,-71.175334,"7723886756","15338728@N00","Northshore","7/14/2012 0:00","8/6/2012 8:29","road","nature","green","sky","highland","tree","vegetation","ecosystem","infrastructure","leaf",36951,3,"NH",2012-07-14 00:00:00,2012-07-14,7,0
234136,234145,"Owlfood tracking","https://farm9.staticflickr.com/8195/8136236870_d9004344fd.jpg",0,44.303167,-68.902833,"8136236870","44322708@N00","Kansas City","10/29/2012 16:37","10/29/2012 20:37","string instrument","string instrument accessory","musical instrument","guitar","string instrument","musician","microphone","plucked string instruments","bass guitar","guitarist",234145,4,"ME",2012-10-29 16:37:00,2012-10-29,10,16
196207,196216," ","https://farm5.staticflickr.com/4449/23765373578_35083c02b4.jpg",0,44.717494,-72.030198,"23765373578","51405371@N00"," ","10/7/2017 11:37","10/10/2017 16:02","waterway","nature","wilderness","mode of transport","lake","photography","water","loch","panorama","fjord",196216,2,"VT",2017-10-07 11:37:00,2017-10-07,10,11
37881,37898," ","https://farm6.staticflickr.com/5638/30305871153_8c07797e1a.jpg",0,44.27455,-71.587412,"30305871153","34152943@N08"," ","7/9/2016 11:22","11/19/2016 15:54","river","wilderness","vegetation","nature reserve","riparian zone","ecosystem","water resources","bank","watercourse","creek",37898,3,"NH",2016-07-09 11:22:00,2016-07-09,7,11
62278,62286," ","https://farm4.staticflickr.com/3826/9432211202_7cbda8e232.jpg",0,43.467833,-74.247667,"9432211202","66145291@N07"," ","8/3/2013 14:25","8/3/2013 21:26","tree","woody plant","plant","woodland","forest","jungle","old growth forest","rainforest","primate","branch",62286,1,"NY",2013-08-03 14:25:00,2013-08-03,8,14
240224,240233," ","https://farm9.staticflickr.com/8190/8084446828_a7392a715d.jpg",0,44.295938,-68.180998,"8084446828","93406391@N00"," ","10/12/2012 6:32","10/14/2012 0:32","sky","rock","horizon","cloud","shore","sea","coast","dawn","sunrise","morning",240233,4,"ME",2012-10-12 06:32:00,2012-10-12,10,6
232773,232782," ","https://farm5.staticflickr.com/4281/34731168673_df80353cc6.jpg",0,44.232225,-68.345534,"34731168673","54135982@N06"," ","6/21/2017 13:08","6/26/2017 6:06","dandelion","flower","flora","close up","plant","crassocephalum","macro photography","plant stem","sow thistles","grass",232782,4,"ME",2017-06-21 13:08:00,2017-06-21,6,13
16640,16647," ","https://farm4.staticflickr.com/3701/11648541483_52d50b771c.jpg",0,43.783833,-71.517,"11648541483","96716133@N06"," ","8/19/2013 19:20","12/30/2013 15:50","water","vacation","vehicle","fun","boat","reflection","boating","girl","recreation","sky",16647,3,"NH",2013-08-19 19:20:00,2013-08-19,8,19
145685,145542,"Charlotte Town Beach","https://farm1.staticflickr.com/616/22944609382_6830a50a0d.jpg",0,44.33412,-73.28196,"22944609382","52336189@N00"," ","10/7/2015 10:45","11/12/2015 3:51","bird","water","fauna","wildlife","seabird","sea","shorebird","sky","water bird","beak",145542,2,"VT",2015-10-07 10:45:00,2015-10-07,10,10
245429,245438," ","https://farm8.staticflickr.com/7287/27441450250_a231de9120.jpg",0,44.350477,-68.22995,"27441450250","92611166@N00"," ","7/21/2013 11:28","6/17/2016 2:36","dog like mammal","dog","sky","dog breed group","dog breed","mountain","karelian bear dog","hill","border collie","grass",245438,4,"ME",2013-07-21 11:28:00,2013-07-21,7,11
206443,206571,"DCIM\110GOPRO\GOPR2617.JPG","https://farm5.staticflickr.com/4513/37249070112_9c5c23d43d.jpg",0,44.239083,-71.27257,"37249070112","15970544@N08","Dedham, MA","9/23/2017 11:05","9/24/2017 6:29","wilderness","outdoor recreation","adventure","tree","trail","rock","jungle","path","hiking","forest",206571,3,"NH",2017-09-23 11:05:00,2017-09-23,9,11
128842,128851," ","https://farm5.staticflickr.com/4277/35833730565_a9e6560836.jpg",0,44.123566,-73.856192,"35833730565","31192101@N03","Winchester, VA","7/9/2017 13:23","7/10/2017 9:11","rock","wilderness","mountain","vegetation","cliff","highland","sky","bedrock","ridge","escarpment",128851,1,"NY",2017-07-09 13:23:00,2017-07-09,7,13
195815,195824," ","https://farm9.staticflickr.com/8433/7698622176_849eb5b3b6.jpg",0,44.5395,-72.817334,"7698622176","83432896@N06"," ","7/31/2012 14:15","8/2/2012 16:05","people","rock","fun","emotion","outdoor recreation","male","adventure","vacation","smile","tourism",195824,2,"VT",2012-07-31 14:15:00,2012-07-31,7,14
228280,228289," ","https://farm8.staticflickr.com/7391/27631862352_c6724bfee0.jpg",0,45.0535,-70.308334,"27631862352","92611166@N00"," ","3/30/2013 16:51","6/17/2016 19:51","winter","sky","snow","town","city","transport","architecture","downtown","urban area","neighbourhood",228289,4,"ME",2013-03-30 16:51:00,2013-03-30,3,16
196851,196860," ","https://farm8.staticflickr.com/7684/29270931905_65bce7d1f9.jpg",0,44.742161,-72.047723,"29270931905","17177034@N00"," ","6/25/2016 13:02","8/27/2016 18:54","waterfall","water","nature","body of water","nature reserve","wilderness","rock","water feature","tree","leaf",196860,2,"VT",2016-06-25 13:02:00,2016-06-25,6,13
18304,18312," ","https://farm9.staticflickr.com/8310/7926210978_aee07da97a.jpg",0,43.896608,-71.231367,"7926210978","98037770@N00","Standish, Maine","9/3/2012 15:38","9/4/2012 0:56","water","nature","reflection","river","green","body of water","waterway","tree","bank","water resources",18312,3,"NH",2012-09-03 15:38:00,2012-09-03,9,15
114681,114690,"USA: New York, Adirondacks, Massawepie Mire","https://farm5.staticflickr.com/4239/34470339284_1c7a8a4031.jpg",0,44.2315,-74.69308,"34470339284","40621085@N08"," ","6/9/2017 14:32","6/15/2017 0:49","nature reserve","wildlife","fauna","pasture","path","grass","tree","national park","moose","grazing",114690,1,"NY",2017-06-09 14:32:00,2017-06-09,6,14
174864,174873," ","https://farm2.staticflickr.com/1654/24079362309_5c840765f7.jpg",0,44.4653,-72.685,"24079362309","37071605@N06"," ","1/17/2016 18:25","1/17/2016 23:25","winter","tree","snow","sky","woody plant","mountain range","mountainous landforms","skiing","fir","piste",174873,2,"VT",2016-01-17 18:25:00,2016-01-17,1,18
244764,244773," ","https://farm8.staticflickr.com/7309/27453421143_03a0948751.jpg",0,44.31839,-68.192846,"27453421143","74625628@N00","Slippery Rock","6/18/2016 19:08","7/4/2016 2:07","wilderness","vegetation","rock","tree","shrubland","bedrock","grass","mountain","outcrop","landscape",244773,4,"ME",2016-06-18 19:08:00,2016-06-18,6,19
150632,150646,"Ausable Chasm is a sandstone gorge tourist attraction near Keeseville, New
York. The Ausable River runs through it, which then empties into Lake
Champlain. -The gorge is about two miles long, and is a minor tourist
attraction in the Adirondacks region of","https://farm6.staticflickr.com/5579/14061485628_0ee7a79dfa.jpg",0,44.529311,-73.461209,"14061485628","71150518@N04"," ","10/1/2013 14:34","5/23/2014 1:10","water","rock","watercourse","river","stream","landscape","tree"," "," "," ",150646,1,"NY",2013-10-01 14:34:00,2013-10-01,10,14
31206,31213," ","https://farm9.staticflickr.com/8616/16391635045_2f1d778d89.jpg",0,43.960672,-71.274103,"16391635045","25345777@N00","Hopkinton","1/25/2015 12:25","1/28/2015 23:55","footwear","snow","winter","mountainous landforms","mountain","ridge","wilderness","sky","mountain range","hiking",31213,3,"NH",2015-01-25 12:25:00,2015-01-25,1,12
245369,245378," ","https://farm8.staticflickr.com/7328/27205112464_013a6c24c8.jpg",0,44.317013,-68.200234,"27205112464","92611166@N00"," ","8/9/2014 13:05","6/21/2016 15:04","sea","coast","sky","body of water","shore","coastal and oceanic landforms","water","headland","ocean","promontory",245378,4,"ME",2014-08-09 13:05:00,2014-08-09,8,13
52012,52020," ","https://farm9.staticflickr.com/8466/8417928883_77380bec24.jpg",0,43.208037,-75.305088,"8417928883","8235597@N04","Smithtown","1/26/2013 9:52","1/27/2013 2:59","dog like mammal","dog breed group","dog breed","japanese spitz","samoyed","arctic fox","german spitz","arctic","volpino italiano","canadian eskimo dog",52020,1,"NY",2013-01-26 09:52:00,2013-01-26,1,9
229417,229426," ","https://farm8.staticflickr.com/7285/27085012694_dcba58828e.jpg",0,45.072716,-70.299964,"27085012694","92611166@N00"," ","12/13/2014 10:33","6/15/2016 23:15","snow","winter","freezing","geological phenomenon","blizzard","winter storm","tree","frost","sky","dog like mammal",229426,4,"ME",2014-12-13 10:33:00,2014-12-13,12,10
223250,223259,"Rumford Falls - Rumford, ME","https://farm8.staticflickr.com/7232/7287609784_a9d535293d.jpg",0,44.542648,-70.547204,"7287609784","15530177@N05","Elizabeth, PA","5/5/2012 8:58","5/28/2012 16:00","water","river","body of water","rapid","water resources","waterfall","watercourse","tree","fluvial landforms of streams","creek",223259,4,"ME",2012-05-05 08:58:00,2012-05-05,5,8
57871,57879," ","https://farm8.staticflickr.com/7399/13954858086_47abb31274.jpg",0,43.768066,-76.216417,"13954858086","95957882@N00"," ","4/20/2014 18:32","4/23/2014 3:33","dog","dog like mammal","snout","grass"," "," "," "," "," "," ",57879,1,"NY",2014-04-20 18:32:00,2014-04-20,4,18
144389,144475," ","https://farm3.staticflickr.com/2813/9321917049_9d8bdb784d.jpg",0,44.267333,-73.3635,"9321917049","73304438@N00","londontown","7/5/2013 17:22","7/19/2013 23:04","house","shed","home","window","siding","door","outhouse","outdoor structure","porch","wood",144475,1,"NY",2013-07-05 17:22:00,2013-07-05,7,17
9958,9965," ","https://farm2.staticflickr.com/1636/25527209544_3527765814.jpg",0,43.918128,-71.686005,"25527209544","11811903@N07","Nashua NH","3/30/2016 7:41","3/30/2016 11:47","car","motor vehicle","red","vehicle","mode of transport","automotive exterior","automotive design","fire department","emergency","vintage car",9965,3,"NH",2016-03-30 07:41:00,2016-03-30,3,7
276783,276795," ","https://farm8.staticflickr.com/7431/9736700725_9de1719f2e.jpg",0,45.249203,-68.565351,"9736700725","52283044@N00"," ","8/24/2013 12:06","9/14/2013 2:11","event","communication","conversation","house","public relations"," "," "," "," "," ",276795,4,"ME",2013-08-24 12:06:00,2013-08-24,8,12
174317,174326," ","https://farm9.staticflickr.com/8764/28344168556_c98335dd01.jpg",0,44.316666,-72.575,"28344168556","57799684@N00"," ","7/17/2016 20:48","7/18/2016 0:48","water","nature","reflection","water resources","waterway","fauna","bank","river","tree","bayou",174326,2,"VT",2016-07-17 20:48:00,2016-07-17,7,20
233041,233050," ","https://farm6.staticflickr.com/5640/21648541211_394d557340.jpg",0,44.221816,-68.336605,"21648541211","125345414@N07"," ","9/18/2015 18:03","9/23/2015 0:45","lighthouse","tower","sky","property","house","home","building","roof","facade","real estate",233050,4,"ME",2015-09-18 18:03:00,2015-09-18,9,18
102739,102748," ","https://farm9.staticflickr.com/8275/29691765534_84d834dda0.jpg",0,43.455689,-73.337178,"29691765534","15955344@N00"," ","10/14/2016 12:53","10/14/2016 16:53","nature","sky","mountainous landforms","tree","wilderness","path","plant","pasture","grassland","hill",102748,1,"NY",2016-10-14 12:53:00,2016-10-14,10,12
278147,278161," ","https://farm3.staticflickr.com/2838/9447062457_a77dcfc795.jpg",0,45.906397,-68.886434,"9447062457","67194649@N04","Amos","8/4/2013 16:10","8/6/2013 4:32","sky","cloud","horizon","highland","atmosphere","daytime","cumulus","water","loch","sea",278161,4,"ME",2013-08-04 16:10:00,2013-08-04,8,16
265503,265512,"OLYMPUS DIGITAL CAMERA","https://farm4.staticflickr.com/3724/9699428659_42cf9a01ec.jpg",0,44.363966,-68.076214,"9699428659","91248918@N07"," ","9/1/2013 11:32","9/8/2013 15:27","sky","sea","coast","shore","tree","promontory","rock","water","terrain","cloud",265512,4,"ME",2013-09-01 11:32:00,2013-09-01,9,11
195858,195867," ","https://farm8.staticflickr.com/7265/7679878240_22d56c0b35.jpg",0,44.538333,-72.8155,"7679878240","83432896@N06"," ","7/30/2012 14:57","7/31/2012 4:36","nature","mountain","sky","mountainous landforms","rock","wilderness","outdoor recreation","tree","adventure","hiking",195867,2,"VT",2012-07-30 14:57:00,2012-07-30,7,14
103225,103234," ","https://farm9.staticflickr.com/8018/7633822622_97d1cecfe0.jpg",0,43.619167,-73.5455,"7633822622","51248121@N00"," ","7/11/2012 13:14","7/24/2012 1:03","water","boating","vacation","vehicle","boat","fun","water transportation","recreation","personal protective equipment","leisure",103234,1,"NY",2012-07-11 13:14:00,2012-07-11,7,13
150563,150577,"Ausable Chasm is a sandstone gorge tourist attraction near Keeseville, New
York. The Ausable River runs through it, which then empties into Lake
Champlain. -The gorge is about two miles long, and is a minor tourist
attraction in the Adirondacks region of","https://farm3.staticflickr.com/2896/14268474343_ab7944c54b.jpg",0,44.529311,-73.461209,"14268474343","71150518@N04"," ","10/1/2013 13:38","5/23/2014 1:38","nature reserve","rock","bedrock","tree","outcrop","escarpment","geology","state park","old growth forest","formation",150577,1,"NY",2013-10-01 13:38:00,2013-10-01,10,13
275574,275584,"This coyote, with its muzzle showing evidence of its deer kill, was back and
forth to the kill, watching for other predators. None showed up and it had the
meat to itself.","https://farm9.staticflickr.com/8393/8642775623_c7377e60cd.jpg",0,45.542301,-69.545974,"8642775623","25764375@N06"," ","4/12/2013 12:23","4/12/2013 19:15","dog like mammal","wolf","mammal","canis lupus tundrarum","wildlife","saarloos wolfdog","czechoslovakian wolfdog","coyote","wolfdog","fauna",275584,4,"ME",2013-04-12 12:23:00,2013-04-12,4,12
275261,275271," ","https://farm6.staticflickr.com/5524/10373195785_0b5c20c436.jpg",0,45.37552,-69.448614,"10373195785","33647788@N02"," ","10/10/2013 11:28","10/20/2013 3:06","leaf","path","nature","autumn","woodland","trail","tree","wilderness","deciduous","forest",275271,4,"ME",2013-10-10 11:28:00,2013-10-10,10,11
151012,151026," ","https://farm8.staticflickr.com/7037/6785122734_23d09ea756.jpg",0,44.503167,-73.481333,"6785122734","9677563@N02"," ","2/26/2012 7:17","2/26/2012 12:29","red","boy","child","fashion accessory","headgear","product","fun","cool","toddler","t shirt",151026,1,"NY",2012-02-26 07:17:00,2012-02-26,2,7
174943,174952," ","https://farm6.staticflickr.com/5768/22706196562_4f395c2a02.jpg",0,44.311419,-72.502931,"22706196562","42555923@N00"," ","10/14/2015 17:47","11/2/2015 19:07","nature","painting","woodland","leaf","ecosystem","forest","tree","sunlight","morning","autumn",174952,2,"VT",2015-10-14 17:47:00,2015-10-14,10,17
8594,8600," ","https://farm4.staticflickr.com/3869/15021347185_e12f307473.jpg",0,43.643719,-71.77462,"15021347185","46005891@N02","East n.y","8/23/2014 13:55","8/24/2014 16:54","water","bird","fauna","wildlife","sea","ocean","seabird"," "," "," ",8600,3,"NH",2014-08-23 13:55:00,2014-08-23,8,13
205908,206036," ","https://farm5.staticflickr.com/4488/36952427494_52418ff8a2.jpg",0,44.217923,-71.411197,"36952427494","57440551@N03"," ","10/6/2017 10:07","10/13/2017 0:17","track","transport","leaf","rail transport","autumn","tree","path","plant","train","rolling stock",206036,3,"NH",2017-10-06 10:07:00,2017-10-06,10,10
74158,74167," ","https://farm1.staticflickr.com/677/21166054493_2ba52942dc.jpg",0,43.051369,-74.033317,"21166054493","69776090@N02"," ","9/27/2015 17:15","9/28/2015 15:23","tree","plant","outdoor structure","grass","landscape"," "," "," "," "," ",74167,1,"NY",2015-09-27 17:15:00,2015-09-27,9,17
224045,224054," ","https://farm8.staticflickr.com/7324/8732780389_69cae877dc.jpg",0,44.621166,-70.077334,"8732780389","30200369@N08","Land of Motor Vehicles and Manslaughter","12/17/2012 9:47","5/13/2013 0:31","snow","winter","tree","freezing","woody plant","branch","sky","frost","blizzard","winter storm",224054,4,"ME",2012-12-17 09:47:00,2012-12-17,12,9
149392,149249," ","https://farm6.staticflickr.com/5505/10507444004_319c1f1d33.jpg",0,44.34713,-73.105537,"10507444004","87271233@N06"," ","10/26/2013 16:27","10/27/2013 7:15","team sport","sports","football player","player","sport venue","games","soccer player","soccer","ball game","women's football",149249,2,"VT",2013-10-26 16:27:00,2013-10-26,10,16
270855,270771," ","https://farm8.staticflickr.com/7295/8747890318_7bcb436b0b.jpg",0,44.82883,-68.4635,"8747890318","97108788@N00","Fallston, Maryland","5/13/2013 16:55","5/17/2013 14:24","highland","sky","cloud","wilderness","horizon","loch","hill","fell","atmosphere of earth","plain",270771,4,"ME",2013-05-13 16:55:00,2013-05-13,5,16
222841,222846," ","https://farm8.staticflickr.com/7438/9098381743_5ef5d32551.jpg",0,44.834541,-70.708017,"9098381743","97288792@N02","Portland, ME","3/2/2013 8:54","6/21/2013 11:47","sky","winter","snow","cloud","freezing","tree","atmosphere","morning","frost","mountain range",222846,4,"ME",2013-03-02 08:54:00,2013-03-02,3,8
232339,232348," ","https://farm8.staticflickr.com/7429/9109890639_821a2297d9.jpg",0,44.188166,-68.584,"9109890639","48253016@N00","williamsburg","6/17/2013 20:33","6/22/2013 22:20","art","material","product design","font"," "," "," "," "," "," ",232348,4,"ME",2013-06-17 20:33:00,2013-06-17,6,20
36019,36026," ","https://farm4.staticflickr.com/3782/12159721253_fcfa8b83d6.jpg",0,44.156546,-71.181235,"12159721253","24810607@N07","Norwich, Vermont","1/24/2014 7:26","1/26/2014 21:12","skiing","cross country skiing","footwear","nordic skiing","nordic combined","ski","ski cross","winter","race","snow",36026,3,"NH",2014-01-24 07:26:00,2014-01-24,1,7
204238,204247," ","https://farm2.staticflickr.com/1599/26367715185_96f47e4330.jpg",0,44.879291,-72.611381,"26367715185","51405371@N00"," ","4/9/2016 18:32","4/11/2016 12:03","restaurant","event","design","fun","table","cuisine"," "," "," "," ",204247,2,"VT",2016-04-09 18:32:00,2016-04-09,4,18
62464,62472,"[andyarthur.org/tug-hill/pixley-falls-state-park/photos-
pi...](http://andyarthur.org/tug-hill/pixley-falls-state-park/photos-pixley-
falls-state-park-jun-30-2013-part-b-2.html) Pixley Falls State Park on Sunday
Jun 30, 2013. Copyright (c)2013 Andy Arthu","https://farm4.staticflickr.com/3768/9279936692_eb3566536a.jpg",0,43.401675,-75.343375,"9279936692","45846171@N04"," ","6/30/2013 15:13","7/13/2013 21:24","vegetation","nature reserve","nature","ecosystem","watercourse","old growth forest","water","water resources","creek","riparian zone",62472,1,"NY",2013-06-30 15:13:00,2013-06-30,6,15
279652,279669," ","https://farm9.staticflickr.com/8124/8648352885_784198704d.jpg",0,46.76306,-67.819032,"8648352885","71911844@N04"," ","4/13/2013 12:35","4/14/2013 17:42","bird","water","fauna","water bird","duck","seabird","beak","wildlife","waterfowl","ducks geese and swans",279669,4,"ME",2013-04-13 12:35:00,2013-04-13,4,12
207607,209317," ","https://farm8.staticflickr.com/7105/7321896174_5f93462bac.jpg",0,44.247696,-71.337047,"7321896174","13086086@N02","L-town, CA","6/1/2012 13:35","6/2/2012 18:37","highland","sky","chaparral","ridge","ecosystem","mountainous landforms","wilderness","mountain","hill","vegetation",209317,3,"NH",2012-06-01 13:35:00,2012-06-01,6,13
18974,18982," ","https://farm5.staticflickr.com/4583/38730923602_872344ffd0.jpg",0,44.148341,-71.68622,"38730923602","72948589@N00"," ","10/27/2017 10:28","12/1/2017 11:10","water","waterfall","nature","body of water","stream","watercourse","water resources","nature reserve","creek","water feature",18982,3,"NH",2017-10-27 10:28:00,2017-10-27,10,10
243624,243633," ","https://farm9.staticflickr.com/8112/29751956946_ae0799b181.jpg",0,44.332558,-68.266442,"29751956946","96231939@N08"," ","9/14/2016 12:49","9/19/2016 12:10","sky","rock","wilderness","bedrock","mountain","hill","outcrop","ridge","cloud","geology",243633,4,"ME",2016-09-14 12:49:00,2016-09-14,9,12
169516,169525,"SugarBush Weekend","https://farm4.staticflickr.com/3673/8925103041_520df44c25.jpg",0,44.1605,-72.929334,"8925103041","33811642@N00","Lakeville, MA","3/16/2013 14:22","6/2/2013 16:03","footwear","ski","ski pole","skiing","winter","snow","ski equipment","fun","geological phenomenon","nordic skiing",169525,2,"VT",2013-03-16 14:22:00,2013-03-16,3,14
16354,16361," ","https://farm6.staticflickr.com/5578/14926121772_8284969c8c.jpg",0,43.879936,-71.571695,"14926121772","44124282978@N01","Providence, RI  USA","8/15/2014 7:29","8/15/2014 14:39","sky","house","barn","home","cottage","log cabin","rural area","farmhouse","wood","shed",16361,3,"NH",2014-08-15 07:29:00,2014-08-15,8,7
149716,149573,"Another Great Win by the CVU JV-A Ladies. Keep up the great work!","https://farm8.staticflickr.com/7310/10072461315_4106b53354.jpg",0,44.34713,-73.105537,"10072461315","87271233@N06"," ","10/1/2013 16:08","10/3/2013 19:30","blue","team sport","sports","player","football player","games","sport venue","grass","team","ball game",149573,2,"VT",2013-10-01 16:08:00,2013-10-01,10,16
171741,171750," ","https://farm5.staticflickr.com/4498/37588901381_f65d8bb5e7.jpg",0,44.465063,-72.68692,"37588901381","24461402@N05"," ","10/8/2017 20:41","10/9/2017 7:50","fun","girl","family"," "," "," "," "," "," "," ",171750,2,"VT",2017-10-08 20:41:00,2017-10-08,10,20
236540,236549," ","https://farm4.staticflickr.com/3944/15754798062_980126e1ca.jpg",0,44.2797,-68.3256,"15754798062","28876228@N04","Seattle, WA","11/9/2014 18:39","11/10/2014 2:39","water","sea","nature","body of water","coast","shore","sky","reflection","ocean","tree",236549,4,"ME",2014-11-09 18:39:00,2014-11-09,11,18
54400,54408,"Old state road. OLYMPUS DIGITAL CAMERA","https://farm9.staticflickr.com/8457/8022070705_f136e792b9.jpg",0,43.268268,-74.226315,"8022070705","61407498@N08","Saratoga Springs N.Y.","9/23/2012 23:05","9/25/2012 3:36","road","path","lane","infrastructure","trail","asphalt","tree","road surface","land lot","rural area",54408,1,"NY",2012-09-23 23:05:00,2012-09-23,9,23
244752,244761," ","https://farm8.staticflickr.com/7343/28073354605_cab5b1947c.jpg",0,44.339577,-68.177373,"28073354605","46196998@N04","New York","7/3/2016 4:58","7/4/2016 4:32","sky","sun","sunset","sunrise","horizon","afterglow","morning","atmosphere","calm","evening",244761,4,"ME",2016-07-03 04:58:00,2016-07-03,7,4
239492,239501," ","https://farm6.staticflickr.com/5196/14251093888_9828ff226a.jpg",0,44.304894,-68.283612,"14251093888","72318871@N00"," ","6/15/2014 8:42","6/16/2014 17:40","flower","plant","flowering plant","flora","shrub","azalea","rhododendron","alstroemeriaceae"," "," ",239501,4,"ME",2014-06-15 08:42:00,2014-06-15,6,8
19863,19871," ","https://farm1.staticflickr.com/592/31765906954_da6b848171.jpg",0,44.040236,-71.679737,"31765906954","98049585@N00","Ocean City NJ","1/25/2017 18:55","1/30/2017 13:47","snow","light","freezing","ice","winter","fun","water"," "," "," ",19871,3,"NH",2017-01-25 18:55:00,2017-01-25,1,18
120419,120428,"Walking across the bridge over the Raquette River in Colton, the snow falling
made the water look like a night sky. Photo: Heavy","https://farm8.staticflickr.com/7637/16773717612_c3786962a6.jpg",0,44.554056,-74.937787,"16773717612","35978796@N05"," ","3/10/2015 9:14","3/10/2015 13:15","water","sky","atmosphere of earth","atmosphere","space"," "," "," "," "," ",120428,1,"NY",2015-03-10 09:14:00,2015-03-10,3,9
191181,190896," ","https://farm8.staticflickr.com/7105/7276501738_86c70d35d1.jpg",0,44.937974,-73.095441,"7276501738","28555778@N00","Gaithersburg, MD","5/26/2012 13:12","5/27/2012 1:37","sky","airplane","aviation","flight","field","aircraft","atmosphere of earth","takeoff","airliner","grass",190896,2,"VT",2012-05-26 13:12:00,2012-05-26,5,13
208536,206913,"Rick, Malachai & I enjoyed the fair. [Follow
me](http://twitter.com/PickleLadyPhoto) on twitter [Visit
my](http://www.pickleladyphotos.com) Website [Find me on
Facebook](http://www.facebook.com/pages/Pickle-Lady-Creations-
Photography/225191710873905)","https://farm9.staticflickr.com/8214/8431698302_ca8ee68828.jpg",0,44.032852,-70.967658,"8431698302","22386106@N06","Augusta","10/6/2012 12:46","1/31/2013 1:41","red","child","car","skin","day","toddler","boy","sitting","fun","standing",206913,4,"ME",2012-10-06 12:46:00,2012-10-06,10,12
107151,107160," ","https://farm6.staticflickr.com/5761/23456207476_6680eec3b5.jpg",0,44.065,-76.1275,"23456207476","128851092@N08"," ","11/26/2015 16:32","12/3/2015 2:36","nature","snow","sky","atmosphere","freezing","geological phenomenon","light","sunlight","atmosphere of earth","morning",107160,1,"NY",2015-11-26 16:32:00,2015-11-26,11,16
39255,39272,"Processed with VSCO with s2 preset","https://farm2.staticflickr.com/1516/24162766251_53d481acf7.jpg",0,44.256972,-71.440272,"24162766251","11394125@N00","Sydney","1/4/2016 13:58","1/8/2016 6:45","winter","snow","sky","mountain range","freezing","mountain","cloud","alps","panorama","tree",39272,3,"NH",2016-01-04 13:58:00,2016-01-04,1,13
217762,217267," ","https://farm5.staticflickr.com/4298/36104759436_6736d58f14.jpg",0,44.50693,-71.018609,"36104759436","54573009@N00"," ","7/23/2017 15:40","7/25/2017 1:44","path","woodland","ecosystem","nature reserve","forest","tree","vegetation","wilderness","trail","old growth forest",217267,4,"ME",2017-07-23 15:40:00,2017-07-23,7,15
15405,15412," ","https://farm8.staticflickr.com/7403/27908096115_2a90c86e69.jpg",0,43.73013,-71.581824,"27908096115","49503039445@N01","Laconia, NH","6/25/2016 18:22","6/26/2016 1:22","dish","food","cuisine","vegetarian food","asian food","thai food","salad","noodle","southeast asian food","leaf vegetable",15412,3,"NH",2016-06-25 18:22:00,2016-06-25,6,18
103763,103772," ","https://farm9.staticflickr.com/8621/16419882869_f26a976def.jpg",0,43.654751,-73.830414,"16419882869","70999183@N03","Portland Maine","2/21/2015 17:39","2/21/2015 23:01","snow","winter","motor vehicle","tree","freezing","geological phenomenon","vehicle","blizzard","winter storm","ice",103772,1,"NY",2015-02-21 17:39:00,2015-02-21,2,17
209699,208076," ","https://farm1.staticflickr.com/378/20161948838_1f6040bba2.jpg",0,44.216685,-70.581525,"20161948838","99010618@N06"," ","7/11/2015 11:13","8/6/2015 18:23","tree","male","fun","vehicle","leisure","vacation","recreation","girl","travel","plant",208076,4,"ME",2015-07-11 11:13:00,2015-07-11,7,11
58016,58024," ","https://farm9.staticflickr.com/8782/28872400182_4518b836f7.jpg",0,43.946235,-76.118982,"28872400182","15947776@N06"," ","7/5/2014 7:10","8/14/2016 14:33","tree","residential area","nature","plant","town","neighbourhood","sky","woody plant","road","suburb",58024,1,"NY",2014-07-05 07:10:00,2014-07-05,7,7
111581,111590,"On Wellesley Island, NY","https://farm9.staticflickr.com/8446/8004413256_53fa53b54b.jpg",0,44.287897,-76.026034,"8004413256","87411137@N03"," ","7/8/2012 15:36","9/19/2012 22:34","glasses","vision care","eyewear","t shirt","advertising","sunglasses","poster","girl","fun","vehicle",111590,1,"NY",2012-07-08 15:36:00,2012-07-08,7,15
195027,195036," ","https://farm4.staticflickr.com/3714/9374859711_f0ce011c7a.jpg",0,44.588935,-72.790357,"9374859711","10645191@N08"," ","7/27/2012 1:54","7/27/2013 12:32","nature","leisure","fun","outdoor play equipment","tree","adventure","recreation","playground","vacation","pole",195036,2,"VT",2012-07-27 01:54:00,2012-07-27,7,1
129546,129555," ","https://farm1.staticflickr.com/633/31574233066_b07db6ccf6.jpg",0,43.974503,-74.188313,"31574233066","136250138@N06","Ontario, NY","9/3/2016 19:37","12/13/2016 3:34","waterway","water","body of water","reflection","leaf","tree","river","canal","plant","autumn",129555,1,"NY",2016-09-03 19:37:00,2016-09-03,9,19
185581,186361," ","https://farm3.staticflickr.com/2914/14790733165_e0a1a6bbd7.jpg",0,44.698455,-73.37307,"14790733165","26791283@N00"," ","7/5/2014 13:59","7/31/2014 1:54","sailing","sail","sailboat","water transportation","boat","sailing","scow","sea","mast","sloop",186361,1,"NY",2014-07-05 13:59:00,2014-07-05,7,13
211898,211907," ","https://farm1.staticflickr.com/408/18611141674_00db151600.jpg",0,44.261891,-71.198398,"18611141674","54573009@N00"," ","6/27/2015 14:58","6/28/2015 13:37","vegetation","ecosystem","tropical and subtropical coniferous forests","spruce fir forest","wilderness","tree","nature reserve","mountainous landforms","mountain","ridge",211907,3,"NH",2015-06-27 14:58:00,2015-06-27,6,14
196937,196946," ","https://farm9.staticflickr.com/8176/29055920706_b883448301.jpg",0,44.762986,-72.147003,"29055920706","74133755@N00","Barton, Vermont","8/16/2016 20:53","8/19/2016 15:26","moths and butterflies","moth","insect","invertebrate","fauna","pollinator","arthropod","organism","butterfly"," ",196946,2,"VT",2016-08-16 20:53:00,2016-08-16,8,20
103800,103809," ","https://farm6.staticflickr.com/5523/11676716575_4743251757.jpg",0,43.714,-73.8125,"11676716575","48678427@N06","Montreal","1/2/2012 15:41","1/1/2014 0:09","road","motor vehicle","car","lane","snow","highway","infrastructure","windscreen wiper","mode of transport","road trip",103809,1,"NY",2012-01-02 15:41:00,2012-01-02,1,15
233644,233653," ","https://farm9.staticflickr.com/8480/8155754391_d5cdebea15.jpg",0,44.22188,-68.336502,"8155754391","37816678@N03"," ","9/16/2012 15:22","11/4/2012 23:25","sky","tree","woody plant","plant","tower","sea","mountain","terrain","coast","hill station",233653,4,"ME",2012-09-16 15:22:00,2012-09-16,9,15
143458,143473," ","https://farm9.staticflickr.com/8643/30075142732_2a4e41266d.jpg",0,44.350311,-73.413628,"30075142732","45724078@N05","12996","10/7/2016 17:07","10/8/2016 13:19","machine","automotive exterior"," "," "," "," "," "," "," "," ",143473,1,"NY",2016-10-07 17:07:00,2016-10-07,10,17
74843,74852,"OLYMPUS DIGITAL CAMERA","https://farm9.staticflickr.com/8067/8200875741_2cef986444.jpg",0,42.960458,-73.790638,"8200875741","61407498@N08","Saratoga Springs N.Y.","11/13/2012 15:17","11/20/2012 2:16","home","house","property","town","siding","window","real estate","residential area","facade","cottage",74852,1,"NY",2012-11-13 15:17:00,2012-11-13,11,15
188485,186997," ","https://farm4.staticflickr.com/3736/12124365054_c91b41080b.jpg",0,44.698352,-73.099884,"12124365054","10938211@N03","Bay View PEI","1/21/2014 16:43","1/24/2014 22:15","road","sky","winter","snow","cloud","freezing","infrastructure","horizon","morning","highway",186997,2,"VT",2014-01-21 16:43:00,2014-01-21,1,16
60109,60117,"Untitled","https://farm6.staticflickr.com/5823/21090983268_de4c866a68.jpg",0,43.669138,-74.696262,"21090983268","45846171@N04"," ","9/2/2012 20:24","9/9/2015 20:05","sky","reflection","water","sunset","dawn","horizon","lake","sunrise","evening","morning",60117,1,"NY",2012-09-02 20:24:00,2012-09-02,9,20
235257,235266," ","https://farm6.staticflickr.com/5503/9050753072_40f60a4c8a.jpg",0,44.265278,-68.587785,"9050753072","32085622@N00"," ","6/15/2013 9:06","6/15/2013 14:27","plant","flower","flora","flowering plant","iris","spring","meadow","bellflower family","wildflower","grass",235266,4,"ME",2013-06-15 09:06:00,2013-06-15,6,9
13326,13333," ","https://farm8.staticflickr.com/7281/9225855009_fb04b19c94.jpg",0,43.584525,-71.211866,"9225855009","34101606@N08"," ","7/4/2013 9:53","7/7/2013 4:11","car","vehicle","motor vehicle","black and white","mode of transport","automotive tire","tire","automotive wheel system","wheel","automotive design",13333,3,"NH",2013-07-04 09:53:00,2013-07-04,7,9
192602,192611,"Dcim\100gopro","https://farm9.staticflickr.com/8166/7436896802_74f9bbe265.jpg",0,44.982966,-73.105762,"7436896802","35799401@N07","Denver, CO","6/15/2012 11:56","6/25/2012 1:49","sea","water","horizon","sky","body of water","waterway","calm","cloud","ocean","shore",192611,2,"VT",2012-06-15 11:56:00,2012-06-15,6,11
13260,13267," ","https://farm4.staticflickr.com/3721/9417552942_55e1686563.jpg",0,43.583771,-71.212831,"9417552942","34101606@N08"," ","7/24/2013 15:21","8/1/2013 17:09","water","body of water","river","reflection","recreation","water resources","water bird"," "," "," ",13267,3,"NH",2013-07-24 15:21:00,2013-07-24,7,15
48917,48925," ","https://farm9.staticflickr.com/8403/28664886494_6421f71c02.jpg",0,43.337705,-75.113289,"28664886494","75625620@N02"," ","8/23/2016 10:21","8/29/2016 0:39","motocross","nature","soil","motorcycling","off roading","motorsport","racing","endurocross","freestyle motocross","motorcycle racing",48925,1,"NY",2016-08-23 10:21:00,2016-08-23,8,10
209160,207537," ","https://farm9.staticflickr.com/8694/28883297235_95eb5abe21.jpg",0,44.177411,-70.907816,"28883297235","40646519@N00","Manorville, Long Island","7/13/2016 13:29","8/10/2016 3:13","water","sea","body of water","beach","leisure","vacation","fun","coastal and oceanic landforms","ocean","wave",207537,4,"ME",2016-07-13 13:29:00,2016-07-13,7,13
149057,148914," ","https://farm4.staticflickr.com/3734/14098860400_6b32942141.jpg",0,44.326667,-73.002,"14098860400","75674173@N00"," ","3/23/2013 11:03","5/27/2014 20:01","food","vendor","cuisine","street food","market","brunch","taste","marketplace"," "," ",148914,2,"VT",2013-03-23 11:03:00,2013-03-23,3,11
102722,102731," ","https://farm5.staticflickr.com/4176/34521771526_aa43769d2d.jpg",0,43.478888,-73.361112,"34521771526","150228157@N03"," ","4/29/2017 9:16","5/9/2017 22:51","car","motor vehicle","land vehicle","vehicle","family car","transport","automotive exterior","luxury vehicle","driving","city car",102731,1,"NY",2017-04-29 09:16:00,2017-04-29,4,9
12542,12549," ","https://farm8.staticflickr.com/7348/27921263692_d04d0a9e27.jpg",0,43.56022,-71.167648,"27921263692","23295694@N02"," ","7/1/2016 15:54","7/1/2016 19:54","plant","leaf","berry","aquifoliaceae","fruit","tree"," "," "," "," ",12549,3,"NH",2016-07-01 15:54:00,2016-07-01,7,15
35403,35410," ","https://farm1.staticflickr.com/319/19024240380_7ee32fbe7d.jpg",0,44.11573,-71.181909,"19024240380","9161595@N03","Mobile AL, Fletcher NC, Hanover MA","6/27/2015 14:50","6/27/2015 19:29","formation","tunnel","rock","geology","landscape","sky"," "," "," "," ",35410,3,"NH",2015-06-27 14:50:00,2015-06-27,6,14
227095,227104," ","https://farm9.staticflickr.com/8623/27670321454_b5be397462.jpg",0,45.073166,-70.299667,"27670321454","92611166@N00"," ","2/16/2014 20:09","7/13/2016 15:57","room","interior design","furniture","table","food","restaurant","cuisine","house","kitchen","fun",227104,4,"ME",2014-02-16 20:09:00,2014-02-16,2,20
25484,25491,"Dcim\110gopro\Gopr2536.Jpg","https://farm5.staticflickr.com/4362/36760357150_c860e6cff9.jpg",0,44.007811,-71.505853,"36760357150","15970544@N08","Dedham, MA","9/10/2017 15:15","9/11/2017 3:48","mountainous landforms","nature","wilderness","mountain","tree","outdoor recreation","plant","woody plant","hill","sky",25491,3,"NH",2017-09-10 15:15:00,2017-09-10,9,15
227820,227829," ","https://farm8.staticflickr.com/7395/27775164372_d8bdaac50e.jpg",0,45.053666,-70.310167,"27775164372","92611166@N00"," ","5/5/2013 10:55","6/24/2016 13:27","mountainous landforms","snow","sky","winter","mountain","vacation","mountain range","tree","fun","tourism",227829,4,"ME",2013-05-05 10:55:00,2013-05-05,5,10
37058,37065," ","https://farm6.staticflickr.com/5811/21636587645_ddc0a959e1.jpg",0,44.062808,-71.072423,"21636587645","38777099@N00"," ","9/22/2015 14:27","9/22/2015 21:59","tree","leaf","nature","vegetation","green","sky","branch","ecosystem","forest","sunlight",37065,3,"NH",2015-09-22 14:27:00,2015-09-22,9,14
222878,222883," ","https://farm8.staticflickr.com/7454/9057516173_06e01135ab.jpg",0,44.959333,-70.646,"9057516173","60441007@N03"," ","6/12/2013 17:01","6/16/2013 16:37","trout","fish","fish","coho","salmon","cutthroat trout","fishing rod","coastal cutthroat trout","salmon like fish","finger",222883,4,"ME",2013-06-12 17:01:00,2013-06-12,6,17
37700,37717,"Hiking Zealand Falls","https://farm4.staticflickr.com/3730/9012755830_d30d014805.jpg",0,44.195983,-71.492373,"9012755830","62837112@N03","Braintree","6/10/2013 11:58","6/11/2013 2:14","woodland","tree","nature reserve","ecosystem","vegetation","wilderness","water","forest","path","old growth forest",37717,3,"NH",2013-06-10 11:58:00,2013-06-10,6,11
48030,48038," ","https://farm3.staticflickr.com/2911/14021712012_0f69fc3f5c.jpg",0,43.06554,-74.207925,"14021712012","77293861@N06","Ramsgate","4/19/2014 21:06","4/26/2014 22:11","tree","fauna","branch","bird","beak","wood","twig","trunk","wildlife"," ",48038,1,"NY",2014-04-19 21:06:00,2014-04-19,4,21
137300,137309,"Bib heads to the distant summit.","https://farm2.staticflickr.com/1546/26234317405_37db30076b.jpg",0,44.312311,-73.683206,"26234317405","94811196@N08"," ","3/30/2016 13:17","4/4/2016 15:38","ridge","mountainous landforms","wilderness","mountain","path","mountain range","sky","hiking","hill","tree",137309,1,"NY",2016-03-30 13:17:00,2016-03-30,3,13
35945,35952," ","https://farm4.staticflickr.com/3921/14233120458_f2442263e7.jpg",0,44.116733,-71.181137,"14233120458","55224030@N00","Falmouth, ME","6/14/2014 10:48","6/14/2014 14:48","eyewear","person","photograph","facial expression","black and white","glasses","vision care","nose","sunglasses","monochrome photography",35952,3,"NH",2014-06-14 10:48:00,2014-06-14,6,10
213115,213124," ","https://farm8.staticflickr.com/7451/14109244832_b10a04e851.jpg",0,44.270848,-71.303318,"14109244832","13086086@N02","L-town, CA","8/7/2013 1:52","5/5/2014 9:39","black","sky","atmosphere","night","darkness","star","atmosphere of earth","phenomenon","line","space",213124,3,"NH",2013-08-07 01:52:00,2013-08-07,8,1
229200,229209," ","https://farm8.staticflickr.com/7709/27697223425_7d4ebf8dd5.jpg",0,45.088458,-70.276414,"27697223425","92611166@N00"," ","4/1/2015 11:04","6/16/2016 3:19","road","sky","highway","lane","infrastructure","cloud","asphalt","tree","controlled access highway","overhead power line",229209,4,"ME",2015-04-01 11:04:00,2015-04-01,4,11
15406,15413," ","https://farm8.staticflickr.com/7286/27566243130_d549a84404.jpg",0,43.7319,-71.5889,"27566243130","49503039445@N01","Laconia, NH","6/22/2016 13:42","6/22/2016 20:42","dish","food","cuisine","full breakfast","recipe"," "," "," "," "," ",15413,3,"NH",2016-06-22 13:42:00,2016-06-22,6,13
96480,96489," ","https://farm5.staticflickr.com/4478/38014052532_09cbbb01d4.jpg",0,43.098238,-73.593789,"38014052532","62837112@N03","Braintree","10/28/2017 15:50","10/30/2017 18:07","landmark","obelisk","sky","monument","tree","tower","leaf","spire","daytime","memorial",96489,1,"NY",2017-10-28 15:50:00,2017-10-28,10,15
45214,45222,"Near Paris NY","https://farm4.staticflickr.com/3717/9204249528_d96c64a971.jpg",0,42.995796,-75.318403,"9204249528","43895439@N04"," ","7/3/2013 12:43","7/3/2013 20:39","grassland","field","plain","ecosystem","pasture","prairie","sky","crop","farm","grass",45222,1,"NY",2013-07-03 12:43:00,2013-07-03,7,12
222018,221677," ","https://farm8.staticflickr.com/7372/11386844453_9c442dae86.jpg",0,44.574536,-70.867964,"11386844453","11564134@N08","Fairview Heights, IL","10/4/2013 11:13","12/15/2013 17:12","water","stream","nature","body of water","watercourse","rock","creek","stream bed","water resources","plant",221677,4,"ME",2013-10-04 11:13:00,2013-10-04,10,11
278059,278073," ","https://farm8.staticflickr.com/7354/9345251843_dc949179d2.jpg",0,45.842802,-68.999437,"9345251843","75527119@N00"," ","7/21/2013 13:23","7/23/2013 0:09","water","vehicle","outdoor recreation","tree","recreation","race","plant","fun","sports equipment","adventure racing",278073,4,"ME",2013-07-21 13:23:00,2013-07-21,7,13
153630,153639," ","https://farm6.staticflickr.com/5512/31098136365_8e7a4996a7.jpg",0,44.396152,-73.27812,"31098136365","18023881@N05","Glasgow, Scotland","10/21/2016 18:03","11/18/2016 22:48","plant","flower","flora","flowering plant","iris","hymenocallis","terrestrial plant"," "," "," ",153639,2,"VT",2016-10-21 18:03:00,2016-10-21,10,18
274525,274535," ","https://farm9.staticflickr.com/8381/28848000554_a23ffcacb6.jpg",0,45.144466,-70.284214,"28848000554","54573009@N00"," ","9/3/2016 11:44","9/5/2016 12:06","ecosystem","nature reserve","vegetation","path","wilderness","woodland","spruce fir forest","forest","trail","riparian zone",274535,4,"ME",2016-09-03 11:44:00,2016-09-03,9,11
31746,31753," ","https://farm9.staticflickr.com/8116/8695796059_649ce783f9.jpg",0,44.053925,-71.164362,"8695796059","90237600@N00","Siegburg","4/9/2013 17:15","4/30/2013 21:12","wilderness","mountainous landforms","ecosystem","mountain","tree","mountain range","winter","spruce fir forest","geological phenomenon","ridge",31753,3,"NH",2013-04-09 17:15:00,2013-04-09,4,17
244839,244848," ","https://farm8.staticflickr.com/7577/27423344944_f9a5a0feae.jpg",0,44.326786,-68.175187,"27423344944","57329804@N00","Vienna, Austria","6/26/2016 8:44","7/2/2016 13:48","rock","badlands","bedrock","boulder","outcrop","geology","formation","sill","cliff","escarpment",244848,4,"ME",2016-06-26 08:44:00,2016-06-26,6,8
190292,191080,"JohnFitzPatrickLeisen@hotmail.com jackleisen@gmail.com
[twitter.com/jackleisen](https://twitter.com/jackleisen)
[flickr.com/photos/jackleisen](http://flickr.com/photos/jackleisen)
[flickrock.com/jackleisen](http://flickrock.com/jackleisen)
[flickeflu.com","https://farm8.staticflickr.com/7210/7142430889_7dc46e2c94.jpg",0,44.986141,-73.446029,"7142430889","37424391@N07","Carle Place, N.Y.","3/30/2012 14:18","5/4/2012 16:57","water","nature","reflection","tree","leaf","wetland","waterway","bank","vegetation","nature reserve",191080,1,"NY",2012-03-30 14:18:00,2012-03-30,3,14
22287,22248," ","https://farm4.staticflickr.com/3814/19905476321_b84348d2b4.jpg",0,44.14555,-71.774117,"19905476321","90886740@N08","Chapel Hill, NC","7/6/2015 20:38","7/22/2015 0:30","road","tree","nature","green","path","vegetation","leaf","forest","woody plant","woodland",22248,3,"NH",2015-07-06 20:38:00,2015-07-06,7,20
15059,15066," ","https://farm5.staticflickr.com/4220/35395490466_1329670fd0.jpg",0,43.776252,-71.546373,"35395490466","18675021@N00","Budapest, Hungary","6/9/2017 16:03","6/20/2017 23:19","sky","water","reflection","cloud","nature","lake","body of water","loch","water resources","reservoir",15066,3,"NH",2017-06-09 16:03:00,2017-06-09,6,16
274659,274669," ","https://farm1.staticflickr.com/609/22229162396_da34a39407.jpg",0,45.155941,-70.430306,"22229162396","63967426@N07"," ","10/17/2015 15:11","10/17/2015 20:34","architecture","water","structure","house","sky","roof","window"," "," "," ",274669,4,"ME",2015-10-17 15:11:00,2015-10-17,10,15
171383,171392,"View from Spruce Mountain in L.R. Jones State Forest, Vermont","https://farm6.staticflickr.com/5577/15127596552_8fbc607b28.jpg",0,44.234753,-72.355002,"15127596552","125187309@N03"," ","8/28/2014 14:57","9/3/2014 13:38","ecosystem","ridge","wilderness","vegetation","spruce fir forest","tropical and subtropical coniferous forests","nature reserve","highland","mountain","mountainous landforms",171392,2,"VT",2014-08-28 14:57:00,2014-08-28,8,14
243889,243898," ","https://farm9.staticflickr.com/8375/29183959345_67a2798332.jpg",0,44.358547,-68.207053,"29183959345","92611166@N00"," ","8/20/2016 12:19","8/23/2016 18:09","tree","woody plant","plant","grass","glasses","recreation","vacation"," "," "," ",243898,4,"ME",2016-08-20 12:19:00,2016-08-20,8,12
235483,235492," ","https://farm8.staticflickr.com/7416/10481797544_81d8eaa0dc.jpg",0,44.32295,-68.675731,"10481797544","13879794@N04"," ","6/5/2013 12:37","10/25/2013 21:10","wilderness","ecosystem","nature reserve","vegetation","highland","grassland","leaf","lake","mountain","hill",235492,4,"ME",2013-06-05 12:37:00,2013-06-05,6,12
234981,234990,"24 Likes on Instagram 2 Comments on Instagram:
[imperial_court](http://instagram.com/imperial_court): Free Blue!
[horseandrider](http://instagram.com/horseandrider): I love this!","https://farm1.staticflickr.com/717/22944073875_5ebd2c65ae.jpg",0,44.2575,-68.627666,"22944073875","30125594@N08"," ","9/9/2013 15:05","11/11/2015 14:30","water","dog","dog like mammal","dog breed","dog breed group","reflection","snout"," "," "," ",234990,4,"ME",2013-09-09 15:05:00,2013-09-09,9,15
15614,15621," ","https://farm1.staticflickr.com/571/20924227484_ff471c9153.jpg",0,43.71701,-71.538556,"20924227484","49503039445@N01","Laconia, NH","9/19/2015 12:20","9/19/2015 19:20","daube","dish","meat","food","animal source foods","venison","recipe"," "," "," ",15621,3,"NH",2015-09-19 12:20:00,2015-09-19,9,12
39312,39329," ","https://farm2.staticflickr.com/1449/23859010722_0df17fa3ca.jpg",0,44.258536,-71.439414,"23859010722","63967426@N07"," ","12/25/2015 11:43","12/25/2015 18:01","tree","woodland","forest","sky","geological phenomenon","path","plant","rural area","sunlight","landscape",39329,3,"NH",2015-12-25 11:43:00,2015-12-25,12,11
38873,38890," ","https://farm1.staticflickr.com/357/32025112365_f01a0434c0.jpg",0,44.247111,-71.468012,"32025112365","46537245@N00","Fairfax","12/28/2016 15:49","1/1/2017 13:23","snow","winter","sky","cloud","mountainous landforms","freezing","mountain range","geological phenomenon","mountain","piste",38890,3,"NH",2016-12-28 15:49:00,2016-12-28,12,15
179963,183840," ","https://farm6.staticflickr.com/5640/21019416092_e45b59ddec.jpg",0,44.721755,-73.723862,"21019416092","60567679@N06","Montral,Qc","8/22/2015 12:08","9/1/2015 16:15","toy","stuffed toy","plush","snout","material"," "," "," "," "," ",183840,1,"NY",2015-08-22 12:08:00,2015-08-22,8,12
188382,186821," ","https://farm3.staticflickr.com/2929/13918840428_a3e2aeff22.jpg",0,44.629167,-73.249,"13918840428","75674173@N00"," ","10/20/2012 10:06","5/4/2014 16:07","fog","mist","shore","tree","sea","sky","morning","horizon","coast","calm",186821,2,"VT",2012-10-20 10:06:00,2012-10-20,10,10
198466,198475," ","https://farm8.staticflickr.com/7301/27764004766_097030b696.jpg",0,44.762986,-72.147003,"27764004766","74133755@N00","Barton, Vermont","6/14/2016 11:55","6/20/2016 17:37","butterfly","moths and butterflies","insect","brush footed butterfly","invertebrate","pollinator","lycaenid","organism","macro photography","moth",198475,2,"VT",2016-06-14 11:55:00,2016-06-14,6,11
66668,66677," ","https://farm9.staticflickr.com/8235/8394807437_72bda47be4.jpg",0,42.918814,-73.754836,"8394807437","41272702@N02","mechanicville, NY","1/14/2013 14:39","1/19/2013 17:47","tree"," "," "," "," "," "," "," "," "," ",66677,1,"NY",2013-01-14 14:39:00,2013-01-14,1,14
12049,12056," ","https://farm5.staticflickr.com/4362/37075139705_78144bd14e.jpg",0,43.672653,-71.337333,"37075139705","12608328@N08","What does that mean, exactly?","8/18/2017 17:01","9/7/2017 0:58","music","musical instrument","musician","musical instrument accessory","plucked string instruments","human behavior"," "," "," "," ",12056,3,"NH",2017-08-18 17:01:00,2017-08-18,8,17
78409,78418,"Read more about the New Skete German Shepherds
[here](http://www.newskete.org/newsketedogs.html).","https://farm3.staticflickr.com/2860/9508559951_76bca98d4a.jpg",0,43.033645,-73.301064,"9508559951","79434558@N00"," ","8/10/2013 14:16","8/14/2013 16:11","woodland","tree","woody plant","plant","dog breed group","dog like mammal","dog","forest","leaf","wildlife",78418,1,"NY",2013-08-10 14:16:00,2013-08-10,8,14
211740,211749," ","https://farm1.staticflickr.com/418/20257057756_1032744a21.jpg",0,44.270771,-71.303511,"20257057756","13086086@N02","L-town, CA","8/4/2015 5:01","8/4/2015 10:25","sky","cloud","atmosphere","daytime","horizon","atmosphere of earth","morning","dawn","sunrise","calm",211749,3,"NH",2015-08-04 05:01:00,2015-08-04,8,5
7732,7738,"Dcim\110gopro\Gopr0937.Jpg","https://farm5.staticflickr.com/4290/35334341916_b33f302cf6.jpg",0,43.638366,-71.904514,"35334341916","44126613@N00","Dedham, MA","6/17/2017 11:17","6/18/2017 3:32","nature reserve","wilderness","tree","vegetation","path","outdoor recreation","plant","hiking","forest","woodland",7738,3,"NH",2017-06-17 11:17:00,2017-06-17,6,11
14087,14095," ","https://farm9.staticflickr.com/8214/8421763155_7e09ec0ce7.jpg",0,43.622872,-71.296634,"8421763155","21151445@N02"," ","8/29/2012 12:35","1/28/2013 4:06","water","waterway","nature","body of water","sea","water transportation","tree","boat","sky","boating",14095,3,"NH",2012-08-29 12:35:00,2012-08-29,8,12
234401,234410," ","https://farm9.staticflickr.com/8241/8501596452_86aab03589.jpg",0,44.316724,-68.902548,"8501596452","83173260@N00"," ","10/5/2012 15:21","2/23/2013 20:18","nature","leaf","tree","autumn","woody plant","flora","plant","grass","spring","branch",234410,4,"ME",2012-10-05 15:21:00,2012-10-05,10,15
206166,206294," ","https://farm8.staticflickr.com/7532/16165105910_7569ea7b3c.jpg",0,44.237497,-71.350922,"16165105910","83413148@N00","Little Silver, NJ","8/18/2014 9:28","1/24/2015 5:27","highland","mountainous landforms","mountain","cloud","sky","wilderness","ridge","hill","hill station","tree",206294,3,"NH",2014-08-18 09:28:00,2014-08-18,8,9
131243,131252," ","https://farm6.staticflickr.com/5786/21174825398_15729f0ffd.jpg",0,44.212269,-73.874978,"21174825398","19972326@N00"," ","9/5/2015 10:29","9/12/2015 19:33","tree","hand","finger","leaf","plant","grass","soil","girl","jungle","forest",131252,1,"NY",2015-09-05 10:29:00,2015-09-05,9,10
169920,169929,"SugarBush Weekend","https://farm3.staticflickr.com/2836/8925117381_4a5e4091cc.jpg",0,44.177333,-72.902,"8925117381","33811642@N00","Lakeville, MA","3/16/2013 12:46","6/2/2013 16:03","child","boy","fun","toddler","vacation","smile","product","recreation"," "," ",169929,2,"VT",2013-03-16 12:46:00,2013-03-16,3,12
138478,138487," ","https://farm6.staticflickr.com/5446/18875131796_18e0b4154a.jpg",0,44.297008,-74.010749,"18875131796","98753410@N00"," ","6/17/2015 13:53","6/17/2015 20:53","backyard","table","yard","recreation","floor","outdoor structure","wood","outdoor play equipment","grass","tree",138487,1,"NY",2015-06-17 13:53:00,2015-06-17,6,13
18483,18491," ","https://farm2.staticflickr.com/1572/26641701626_8c1b1d98f6.jpg",0,43.9092,-71.0842,"26641701626","61283325@N00","South Portland, Maine","4/26/2016 22:22","4/27/2016 2:22","deer","snow","mammal","wildlife","winter","fauna","reindeer","freezing","sky","antler",18491,3,"NH",2016-04-26 22:22:00,2016-04-26,4,22
238209,238218," ","https://farm9.staticflickr.com/8324/28826412253_3507bafb99.jpg",0,44.27055,-68.303375,"28826412253","29356074@N06"," ","8/27/2016 13:27","9/4/2016 13:00","water","sailing","sailboat","boat","sail","boating","sailing","sea","mast","sloop",238218,4,"ME",2016-08-27 13:27:00,2016-08-27,8,13
103911,103920," ","https://farm4.staticflickr.com/3853/14314714197_ebf49a40d1.jpg",0,43.700086,-73.992491,"14314714197","70999183@N03","Portland Maine","6/24/2014 19:30","6/25/2014 0:11","flower","plant","yellow","flora","flowering plant","wildflower","blanket flowers","spring","daisy family","annual plant",103920,1,"NY",2014-06-24 19:30:00,2014-06-24,6,19
241672,241681," ","https://farm5.staticflickr.com/4414/36917627460_c9f8106f2d.jpg",0,44.322041,-68.261803,"36917627460","90463382@N04"," ","8/31/2017 9:44","9/19/2017 1:16","nature","outdoor recreation","backpacking","wilderness","hiking","adventure","path","walking","tree","recreation",241681,4,"ME",2017-08-31 09:44:00,2017-08-31,8,9
79966,79975," ","https://farm6.staticflickr.com/5821/30072796330_589f9ebbde.jpg",0,43.340616,-73.607933,"30072796330","29498428@N00"," ","9/24/2016 7:49","10/16/2016 20:50","grass","close up","macro photography","organism","plant"," "," "," "," "," ",79975,1,"NY",2016-09-24 07:49:00,2016-09-24,9,7
266700,266709,"The base of a dead tree at the very edge of the sand/soil line of a deserted
stretch of shoreline on the Maine coast. The tree is still rooted and about 50
feet from the high tide line.","https://farm9.staticflickr.com/8305/7999431332_6e19cb45ce.jpg",0,44.415582,-67.89201,"7999431332","24762951@N04"," ","8/30/2012 13:14","9/18/2012 11:38","wood","close up","trunk","formation","tree","geology","rock","driftwood","stock photography","lumber",266709,4,"ME",2012-08-30 13:14:00,2012-08-30,8,13
57524,57532," ","https://farm5.staticflickr.com/4078/35224734860_5a14f01075.jpg",0,43.773722,-76.217262,"35224734860","95957882@N00"," ","6/27/2017 13:09","6/29/2017 15:11","plant","grass","leaf","herb","grass family","shrub","tree"," "," "," ",57532,1,"NY",2017-06-27 13:09:00,2017-06-27,6,13
232155,232164," ","https://farm1.staticflickr.com/508/19877532714_48c736a821.jpg",0,44.237183,-68.559678,"19877532714","56677234@N00"," ","8/5/2015 15:03","8/12/2015 0:11","water","sail","waterway","sailing","sailboat","water transportation","boat","sailing","dinghy sailing","sky",232164,4,"ME",2015-08-05 15:03:00,2015-08-05,8,15
192159,192168," ","https://farm4.staticflickr.com/3797/9020207933_2155ea0fa0.jpg",0,44.981072,-73.102898,"9020207933","35799401@N07","Denver, CO","6/11/2013 16:20","6/12/2013 2:34","people","child","red","skin","facial expression","person","toddler","human hair color","day","smile",192168,2,"VT",2013-06-11 16:20:00,2013-06-11,6,16
272150,272066," ","https://farm8.staticflickr.com/7319/12526935605_d6fdbca9c8.jpg",0,44.815104,-66.950661,"12526935605","89837144@N03","Lubec, Maine","1/24/2014 16:53","2/14/2014 20:50","sea","sky","cloud","shore","horizon","ocean","coastal and oceanic landforms","vacation","coast","daytime",272066,4,"ME",2014-01-24 16:53:00,2014-01-24,1,16
229336,229345," ","https://farm8.staticflickr.com/7383/27419071950_3470e6e681.jpg",0,45.041683,-70.314453,"27419071950","92611166@N00"," ","12/13/2014 11:53","6/16/2016 2:58","ski pole","snow","skiing","mountainous landforms","ski","winter","mountain range","ski touring","geological phenomenon","piste",229345,4,"ME",2014-12-13 11:53:00,2014-12-13,12,11
225939,225948," ","https://farm9.staticflickr.com/8111/28603339286_156f248872.jpg",0,45.056963,-70.307512,"28603339286","92611166@N00"," ","4/20/2014 14:09","7/29/2016 20:05","tree","public space","woody plant","plant","recreation","outdoor recreation","fun","crowd","winter","city",225948,4,"ME",2014-04-20 14:09:00,2014-04-20,4,14
104731,104740,"Railroads on Parade model train museum in the small town of Pottersville, New
York","https://farm9.staticflickr.com/8111/8469441426_293b935ce4.jpg",0,43.725785,-73.826215,"8469441426","28925161@N02"," ","8/17/2012 3:39","2/12/2013 21:55","urban area","track","metropolis","city","rail transport"," "," "," "," "," ",104740,1,"NY",2012-08-17 03:39:00,2012-08-17,8,3
234904,234913,"I took this about three years ago on a moving boat in a bay. It was really odd
that this sailing ship was just out in the middle of the river like that -- I
dunno, I wasn't really expecting there to be a pirate-esque ship out. Maybe I
was missing somethi","https://farm6.staticflickr.com/5462/7059264751_545668b871.jpg",0,44.38571,-68.789176,"7059264751","73552349@N02","Sandy Point","4/8/2012 23:25","4/9/2012 3:25","sky","water","black and white","cloud","sea","monochrome photography","calm","ocean","photography","horizon",234913,4,"ME",2012-04-08 23:25:00,2012-04-08,4,23
238001,238010,"Inside Acadia National Park near Bar Harbor, Maine.","https://farm5.staticflickr.com/4238/35066873930_e515fa5bc7.jpg",0,44.307272,-68.193938,"35066873930","9456601@N03","Harrison Township, MI","6/19/2015 14:52","6/21/2017 21:54","sea","coast","body of water","coastal and oceanic landforms","sky","water","shore","ocean","rock","headland",238010,4,"ME",2015-06-19 14:52:00,2015-06-19,6,14
103065,103074," ","https://farm4.staticflickr.com/3889/14773260879_ee9cba3965.jpg",0,43.608581,-73.517503,"14773260879","30509233@N08"," ","7/18/2014 12:40","8/18/2014 16:19","vegetation","ecosystem","nature reserve","wilderness","tree","path","forest","woodland","old growth forest","plant",103074,1,"NY",2014-07-18 12:40:00,2014-07-18,7,12
24104,24104," ","https://farm1.staticflickr.com/411/19713601529_fd57300de6.jpg",0,44.178058,-71.758737,"19713601529","90886740@N08","Chapel Hill, NC","7/6/2015 20:59","7/22/2015 0:22","road","sky","infrastructure","dawn","atmosphere","horizon","morning","atmosphere of earth","cloud","phenomenon",24104,3,"NH",2015-07-06 20:59:00,2015-07-06,7,20
21248,21209," ","https://farm9.staticflickr.com/8658/27755037163_4ca740f82b.jpg",0,44.100277,-71.665556,"27755037163","67955305@N07"," ","6/27/2016 14:36","7/17/2016 18:24","nature","vegetation","nature reserve","forest","old growth forest","rainforest","watercourse","path","ravine","tree",21209,3,"NH",2016-06-27 14:36:00,2016-06-27,6,14
280027,280045,"At the Daigle Reunion at the K of C Hall in Madawaska.","https://farm4.staticflickr.com/3851/14999598051_456511840a.jpg",0,47.353216,-68.335588,"14999598051","40646519@N00","Manorville, Long Island","8/16/2014 17:34","8/22/2014 21:10","hair","blond","child","human hair color","skin","girl","beauty","hairstyle","fun","eye",280045,4,"ME",2014-08-16 17:34:00,2014-08-16,8,17
57216,57224," ","https://farm5.staticflickr.com/4335/36328585842_833fc09896.jpg",0,43.768105,-76.216684,"36328585842","95957882@N00"," ","8/10/2017 12:40","8/11/2017 8:20","plant","flora","grass","flower","tree","grass family","spring","garden"," "," ",57224,1,"NY",2017-08-10 12:40:00,2017-08-10,8,12
265648,265657,"Acadia National Park - Egg Rock Lighthouse from the Lulu Lobster Boat","https://farm6.staticflickr.com/5550/9506351846_a976c2df3d.jpg",0,44.354081,-68.138161,"9506351846","59139576@N00"," ","8/10/2013 16:11","8/13/2013 23:35","sea","coast","lighthouse","sky","promontory","tower","coastal and oceanic landforms","ocean","shore","cape",265657,4,"ME",2013-08-10 16:11:00,2013-08-10,8,16
137810,137819," ","https://farm6.staticflickr.com/5775/21934542966_8f83b90634.jpg",0,44.419788,-74.17572,"21934542966","58143558@N00"," ","10/4/2015 14:33","10/5/2015 7:03","crop","agriculture","field","vegetation","sky","plant","tree","grass family","grass","food grain",137819,1,"NY",2015-10-04 14:33:00,2015-10-04,10,14
11628,11635," ","https://farm8.staticflickr.com/7300/10239884185_da9137f316.jpg",0,43.635616,-71.312017,"10239884185","21151445@N02"," ","8/27/2013 15:28","10/13/2013 5:56","reflection","waterway","water","river","nature","water resources","body of water","bank","sky","lake",11635,3,"NH",2013-08-27 15:28:00,2013-08-27,8,15
23637,23637," ","https://farm9.staticflickr.com/8227/8363318490_c63e0238c5.jpg",0,44.238456,-71.879211,"8363318490","78218796@N03"," ","1/8/2013 17:01","1/9/2013 1:33","stairs","room","property","house","home","wood","architecture","floor","wall","hardwood",23637,3,"NH",2013-01-08 17:01:00,2013-01-08,1,17
138646,138655," ","https://farm4.staticflickr.com/3947/18708905998_0cbb119df4.jpg",0,44.2571,-73.751123,"18708905998","36920523@N02"," ","5/30/2015 15:58","6/17/2015 17:38","people","social group","photograph","male","community","team","fun","tree","plant","dress",138655,1,"NY",2015-05-30 15:58:00,2015-05-30,5,15
144859,149711,"August 16, 2017 Ausable Chasm Adirondacks Vacation Near Keeseville, New York
Lake Champlain Area - USA Photo by brucetopher (C) Bruce Christopher 2017 All
Rights Reserved _...always learning - critiques welcome._ Tools: Canon 7D  &
iPhone 6s. No use with","https://farm5.staticflickr.com/4438/36351361864_378e2e17bd.jpg",0,44.528439,-73.461713,"36351361864","32814617@N00","Rockport, Massachusetts, USA","8/16/2017 15:16","9/12/2017 15:35","rock","bedrock","outcrop","geology","water","formation","ruins","tree","escarpment","plant",149711,1,"NY",2017-08-16 15:16:00,2017-08-16,8,15
220335,222232,"familly cabin. standing on the top of the secpnd floor porch looking down at
the second cabin and frozen lake.","https://farm4.staticflickr.com/3673/13233351354_718b13aa1c.jpg",0,45.105825,-71.241895,"13233351354","120707257@N06"," ","8/17/2013 20:17","3/18/2014 1:58","nature","sky","black and white","atmosphere","night","reflection","moonlight","monochrome photography","astronomical object","darkness",222232,3,"NH",2013-08-17 20:17:00,2013-08-17,8,20
143661,143686," ","https://farm2.staticflickr.com/1462/24027179720_5ebcfea21d.jpg",0,44.346925,-73.409523,"24027179720","45724078@N05","12996","1/9/2016 12:01","1/11/2016 21:37","water","snow","body of water","winter","river","tree","creek","reflection","fluvial landforms of streams","freezing",143686,1,"NY",2016-01-09 12:01:00,2016-01-09,1,12
15617,15624," ","https://farm6.staticflickr.com/5651/20803266434_8e962f64fd.jpg",0,43.768994,-71.539628,"20803266434","70022966@N04"," ","6/23/2015 20:34","9/15/2015 1:36","water","sky","boats and boating equipment and supplies","lake","boating","vacation","sea","evening","horizon","recreation",15624,3,"NH",2015-06-23 20:34:00,2015-06-23,6,20
233490,233499," ","https://farm8.staticflickr.com/7390/9657582830_b6239432cf.jpg",0,44.229176,-68.313568,"9657582830","20662858@N00"," ","8/25/2013 17:26","9/2/2013 17:58","vegetation","wilderness","mountain","nature reserve","aerial photography","geological phenomenon","grass","geology","landscape","tree",233499,4,"ME",2013-08-25 17:26:00,2013-08-25,8,17
74418,74427," ","https://farm5.staticflickr.com/4163/34433586821_13a99a33dc.jpg",0,42.972222,-73.843056,"34433586821","150228157@N03"," ","4/23/2017 13:22","5/10/2017 0:01","car","motor vehicle","vehicle","jeep","off roading","off road vehicle","jeep wrangler","automotive design","automotive tire","sport utility vehicle",74427,1,"NY",2017-04-23 13:22:00,2017-04-23,4,13
57321,57329," ","https://farm5.staticflickr.com/4342/36247173852_8c53c3be36.jpg",0,43.768352,-76.216828,"36247173852","95957882@N00"," ","8/6/2017 13:26","8/7/2017 1:41","reflection","water","tree","sky","plant","grass","walkway","road surface","outdoor structure","recreation",57329,1,"NY",2017-08-06 13:26:00,2017-08-06,8,13
105675,105684," ","https://farm4.staticflickr.com/3903/19001299655_2646a1aea1.jpg",0,43.737786,-73.452272,"19001299655","8169662@N08"," ","5/8/2015 10:30","6/20/2015 23:52","plant","flora","leaf","flower","herb","spring","soil","grass","wildflower","annual plant",105684,1,"NY",2015-05-08 10:30:00,2015-05-08,5,10
243125,243134," ","https://farm1.staticflickr.com/650/33082613690_d9de01983a.jpg",0,44.359886,-68.188264,"33082613690","16857829@N04","Freehold, NJ","8/28/2016 5:57","3/16/2017 2:14","sky","sunset","sunrise","horizon","sun","sea","afterglow","morning","evening","dawn",243134,4,"ME",2016-08-28 05:57:00,2016-08-28,8,5
12440,12447," ","https://farm9.staticflickr.com/8438/7998067804_e6507c1d52.jpg",0,43.675181,-71.332726,"7998067804","91251856@N00"," ","9/15/2012 18:32","9/18/2012 2:14","man","suit","event","ceremony","dress","interaction","wedding","formal wear","fun","gentleman",12447,3,"NH",2012-09-15 18:32:00,2012-09-15,9,18
116762,116771," ","https://farm6.staticflickr.com/5479/9445164676_4d5f883341.jpg",0,44.512166,-74.8845,"9445164676","14872398@N00"," ","8/5/2013 5:59","8/5/2013 15:05","fauna","wildlife","tail","snout","beak"," "," "," "," "," ",116771,1,"NY",2013-08-05 05:59:00,2013-08-05,8,5
191756,191765," ","https://farm6.staticflickr.com/5536/14576430905_20e5890fdf.jpg",0,44.979397,-73.103467,"14576430905","35799401@N07","Denver, CO","6/7/2014 13:37","7/5/2014 3:26","public space","child","playground","day","play","fun","leisure","outdoor play equipment","recreation","sports",191765,2,"VT",2014-06-07 13:37:00,2014-06-07,6,13
7278,7284," ","https://farm6.staticflickr.com/5627/30794836711_1c1c589805.jpg",0,43.622222,-72.140833,"30794836711","80135389@N06"," ","11/9/2016 11:40","11/9/2016 19:40","t shirt","chin","neck","forehead","cheek","cool","facial hair","mouth","product","jaw",7284,3,"NH",2016-11-09 11:40:00,2016-11-09,11,11
272351,272267," ","https://farm8.staticflickr.com/7369/11767045526_a7514a60f0.jpg",0,44.815669,-66.951614,"11767045526","13413521@N07"," ","10/1/2013 17:39","1/5/2014 3:21","green","grass","tree","standing","plant","recreation","lawn"," "," "," ",272267,4,"ME",2013-10-01 17:39:00,2013-10-01,10,17
38564,38581," ","https://farm1.staticflickr.com/646/22010262043_389d845582.jpg",0,44.206755,-71.403131,"22010262043","40575230@N05","Goomburra on the Darling Downs","10/5/2015 12:16","10/31/2015 9:09","nature","water","leaf","vegetation","autumn","plant","tree","stream","creek","watercourse",38581,3,"NH",2015-10-05 12:16:00,2015-10-05,10,12
209702,208079," ","https://farm1.staticflickr.com/526/20161948698_5cba4c66de.jpg",0,44.216685,-70.581525,"20161948698","99010618@N06"," ","7/11/2015 11:13","8/6/2015 18:23","social group","male","community","fun","recreation","car","vacation","tree","competition event","plant",208079,4,"ME",2015-07-11 11:13:00,2015-07-11,7,11
224210,224219," ","https://farm8.staticflickr.com/7048/27118188964_cb73cbc2bb.jpg",0,44.792166,-70.128167,"27118188964","92611166@N00"," ","4/12/2013 18:37","6/17/2016 16:25","road","motor vehicle","lane","car","highway","road trip","infrastructure","asphalt","mode of transport","snow",224219,4,"ME",2013-04-12 18:37:00,2013-04-12,4,18
25647,25654," ","https://farm4.staticflickr.com/3820/33071349601_4e3f3f6f73.jpg",0,44.050833,-71.63,"33071349601","119532283@N02","Menston","2/17/2017 13:06","3/2/2017 3:13","snow","winter","sky","mountainous landforms","mountain range","mountain","wilderness","ridge","tree","piste",25654,3,"NH",2017-02-17 13:06:00,2017-02-17,2,13
64223,64231,"""The Vischer Ferry store has once again become a gathering place for the
community."" Clifton Park town historian John Scherer
[vischerferrygeneralstore.com/history/](http://vischerferrygeneralstore.com/history/++)
The VF General Store: good coffee/ fri","https://farm2.staticflickr.com/1564/24234734640_1d6da8e0ae.jpg",0,42.797607,-73.829006,"24234734640","64964567@N00","Pennington, NJ","1/8/2016 11:28","1/22/2016 2:28","interior design","restaurant","caf","window"," "," "," "," "," "," ",64231,1,"NY",2016-01-08 11:28:00,2016-01-08,1,11
206989,208699," ","https://farm8.staticflickr.com/7354/27040506530_e325a8d8f0.jpg",0,44.242313,-71.345603,"27040506530","17177034@N00"," ","6/6/2015 13:54","5/29/2016 0:18","highland","mountainous landforms","ridge","mountain","wilderness","fell","hill","sky","cloud","hill station",208699,3,"NH",2015-06-06 13:54:00,2015-06-06,6,13
105551,105560,"Tongue Mountain Range Trails","https://farm6.staticflickr.com/5541/10408777315_7a01fd0bf5.jpg",0,43.661216,-73.54522,"10408777315","26383131@N00","Bogota","10/20/2013 15:28","10/21/2013 19:28","nature","nature reserve","leaf","woodland","tree","path","autumn","forest","trail","deciduous",105560,1,"NY",2013-10-20 15:28:00,2013-10-20,10,15
8943,8950,"A part of the FYSEP experience includes team building activities. Project
Adventure Low teaches small groups to work together and complete a team
challenge course with problem-solving initiatives. It provides an opportunity
to have fun, challenge yoursel","https://farm4.staticflickr.com/3838/14961247060_659bc15ece.jpg",0,43.721707,-72.260985,"14961247060","33190334@N06","Dartmouth College, Hanover, NH, USA","9/3/2014 1:22","9/5/2014 15:57","green","mammal","vertebrate","tree","plant","crowd","fun","recreation","girl","grass",8950,3,"NH",2014-09-03 01:22:00,2014-09-03,9,1
209008,207385," ","https://farm4.staticflickr.com/3885/14895479116_91bc2f6a19.jpg",0,44.115505,-70.929245,"14895479116","21482874@N06","Westbrook","10/12/2013 15:23","8/14/2014 17:57","land vehicle","tree","vertebrate","plant","vehicle","horse and buggy","carriage","horse","house","recreation",207385,4,"ME",2013-10-12 15:23:00,2013-10-12,10,15
29616,29623," ","https://farm9.staticflickr.com/8121/29137590333_89977f2c7e.jpg",0,44.162544,-71.391912,"29137590333","44126613@N00","Dedham, MA","9/17/2016 14:42","9/18/2016 13:05","rock","geological phenomenon","terrain","mountain","geology","ridge","sky","sunlight","cliff","escarpment",29623,3,"NH",2016-09-17 14:42:00,2016-09-17,9,14
15102,15109," ","https://farm5.staticflickr.com/4220/34105462094_83fb454ae0.jpg",0,43.787897,-71.550117,"34105462094","54573009@N00"," ","5/27/2017 10:17","5/28/2017 16:51","path","nature reserve","ecosystem","wilderness","vegetation","trail","tree","outdoor recreation","woodland","jungle",15109,3,"NH",2017-05-27 10:17:00,2017-05-27,5,10
222349,222332," ","https://farm5.staticflickr.com/4319/35332329403_0fd9a9e009.jpg",0,45.009308,-71.051389,"35332329403","65918567@N06","Houston, Texas","7/22/2017 14:18","7/24/2017 20:19","road","wilderness","path","mode of transport","car","world rally championship","rallying","asphalt","sky","tree",222332,4,"ME",2017-07-22 14:18:00,2017-07-22,7,14
212426,212435,"Just me sitting on the southern edge of the summit overlooking undercast and
overcast skies.","https://farm9.staticflickr.com/8655/15867155817_b9f8695e4e.jpg",0,44.269745,-71.304622,"15867155817","13086086@N02","L-town, CA","12/5/2014 17:09","12/18/2014 23:19","sky","mountainous landforms","snow","cloud","winter","freezing","arctic","mountain","ridge","glacial landform",212435,3,"NH",2014-12-05 17:09:00,2014-12-05,12,17
28974,28981," ","https://farm4.staticflickr.com/3870/14984030735_ff658aed3a.jpg",0,44.115436,-71.579371,"14984030735","30542755@N00","Portland ME","7/26/2014 0:00","8/20/2014 22:21","water resources","body of water","nature reserve","watercourse","stream","creek","river","stream bed","riparian zone","arroyo",28981,3,"NH",2014-07-26 00:00:00,2014-07-26,7,0
198134,198143," ","https://farm8.staticflickr.com/7126/27374519503_c164b6cc1b.jpg",0,44.762986,-72.147003,"27374519503","74133755@N00","Barton, Vermont","6/25/2016 22:40","6/29/2016 22:48","moths and butterflies","moth","insect","invertebrate","butterfly","pollinator","arthropod","bombycidae"," "," ",198143,2,"VT",2016-06-25 22:40:00,2016-06-25,6,22
231339,231348," ","https://farm1.staticflickr.com/692/23530498289_20b563444c.jpg",0,44.154329,-68.668928,"23530498289","17686063@N07","Los Angeles","11/27/2014 16:05","12/22/2015 2:22","snow","winter","water","sky","freezing","loch","reflection","shore","tree","cloud",231348,4,"ME",2014-11-27 16:05:00,2014-11-27,11,16
241285,241294,"Out of Acadia Night time Excursion to Jordan Pond with Nick Page - Note, time
is 11:18 PM","https://farm5.staticflickr.com/4445/38160956862_c8c9237475.jpg",0,44.322166,-68.25445,"38160956862","24706120@N05"," ","10/3/2017 23:18","11/5/2017 18:12","sky","nature","atmosphere","night","water","loch","wilderness","highland","lake","river",241294,4,"ME",2017-10-03 23:18:00,2017-10-03,10,23
52054,52062," ","https://farm9.staticflickr.com/8046/8351926313_806b38d332.jpg",0,43.218333,-75.330166,"8351926313","55816781@N00"," ","12/29/2012 9:30","1/6/2013 7:31","black","cat","floor","small to medium sized cats","flooring","cat like mammal","black cat","dog breed group","tile","hardwood",52062,1,"NY",2012-12-29 09:30:00,2012-12-29,12,9
75032,75041," ","https://farm9.staticflickr.com/8649/15746639237_72b985e32c.jpg",0,42.9412,-73.7051,"15746639237","55016532@N04"," ","11/28/2013 12:59","12/2/2014 19:03","cat","small to medium sized cats","whiskers","cat like mammal","dog breed group","kitten","tail","domestic short haired cat","floor","paw",75041,1,"NY",2013-11-28 12:59:00,2013-11-28,11,12
220413,219812," ","https://farm8.staticflickr.com/7191/6859846017_444d557dfc.jpg",0,44.470181,-70.88005,"6859846017","65063089@N03"," ","2/11/2012 15:49","2/12/2012 1:55","piste","snow","mountainous landforms","mountain range","winter","sky","geological phenomenon","ski","mountain","winter sport",219812,4,"ME",2012-02-11 15:49:00,2012-02-11,2,15
171642,171651," ","https://farm5.staticflickr.com/4446/23872582768_b29ae6ce7b.jpg",0,44.319919,-72.886737,"23872582768","31827372@N00"," ","10/15/2017 8:53","10/16/2017 3:28","trunk","tree","wood","grass","plant"," "," "," "," "," ",171651,2,"VT",2017-10-15 08:53:00,2017-10-15,10,8
56495,56503," ","https://farm4.staticflickr.com/3809/13416373463_5e3545c370.jpg",0,43.548625,-75.941826,"13416373463","54080023@N05"," ","2/4/2014 14:08","3/26/2014 1:21","snow","winter","tree","freezing","woodland","forest","branch","ice","wood","plant",56503,1,"NY",2014-02-04 14:08:00,2014-02-04,2,14
13410,13417," ","https://farm6.staticflickr.com/5325/9011161878_ac4d41b2b7.jpg",0,43.588,-71.2,"9011161878","27304983@N08"," ","6/10/2013 14:56","6/10/2013 21:56","water","water resources","reflection","geology","rock","pond","grass","watercourse"," "," ",13417,3,"NH",2013-06-10 14:56:00,2013-06-10,6,14
27652,27659," ","https://farm6.staticflickr.com/5512/11059798573_e10e02f8e9.jpg",0,43.981111,-71.390556,"11059798573","29576911@N06","West Coxsackie, NY","8/17/2013 12:11","11/26/2013 2:09","tree","wilderness","plant","path","outdoor recreation","trail","hiking","adventure","vacation","recreation",27659,3,"NH",2013-08-17 12:11:00,2013-08-17,8,12
9026,9033," ","https://farm9.staticflickr.com/8155/7437508626_4999d1f812.jpg",0,43.719564,-72.267415,"7437508626","39041467@N00"," ","6/23/2012 3:02","6/25/2012 3:41","car","public space","vehicle","community","recreation","sports","road","pedestrian","city","tree",9033,3,"NH",2012-06-23 03:02:00,2012-06-23,6,3
62459,62467,"[andyarthur.org/tug-hill/pixley-falls-state-park/photos-
pi...](http://andyarthur.org/tug-hill/pixley-falls-state-park/photos-pixley-
falls-state-park-jun-30-2013-part-b-2.html) Pixley Falls State Park on Sunday
Jun 30, 2013. Copyright (c)2013 Andy Arthu","https://farm8.staticflickr.com/7290/9277170503_a29796e050.jpg",0,43.433122,-75.328023,"9277170503","45846171@N04"," ","6/30/2013 15:39","7/13/2013 21:27","vegetation","ecosystem","tree","nature reserve","leaf","sky","grass","highland","forest","hill station",62467,1,"NY",2013-06-30 15:39:00,2013-06-30,6,15
216420,216429," ","https://farm9.staticflickr.com/8367/8501333047_96caf9f06e.jpg",0,44.426156,-71.49589,"8501333047","10856322@N06"," ","7/8/2012 12:37","2/24/2013 2:35","public space","plant","tree","car","outdoor structure","city","vehicle","recreation"," "," ",216429,3,"NH",2012-07-08 12:37:00,2012-07-08,7,12
50012,50020," ","https://farm1.staticflickr.com/751/20888505542_a1e38742ed.jpg",0,43.128588,-74.976223,"20888505542","113398616@N05"," ","8/26/2015 6:14","8/26/2015 13:14","blue","crystal","mineral","organism","gemstone","crystallography","computer wallpaper","diamond","water","marine biology",50020,1,"NY",2015-08-26 06:14:00,2015-08-26,8,6
121794,121803," ","https://farm6.staticflickr.com/5578/14696011888_c48af87999.jpg",0,44.70995,-74.987464,"14696011888","54806507@N00","Rockton, IL","7/26/2014 14:47","8/11/2014 3:07","infant","child","skin","yellow","human hair color","toddler","cheek","leg","sitting","hand",121803,1,"NY",2014-07-26 14:47:00,2014-07-26,7,14
225899,225908," ","https://farm9.staticflickr.com/8082/28018659104_a8976457b6.jpg",0,45.057013,-70.307359,"28018659104","92611166@N00"," ","4/20/2014 14:17","7/29/2016 20:05","public space","winter","tree","crowd","city","town","urban area","car","snow","plant",225908,4,"ME",2014-04-20 14:17:00,2014-04-20,4,14
150849,150863," ","https://farm4.staticflickr.com/3731/9321108290_81fd37e2d0.jpg",0,44.460166,-73.506167,"9321108290","26660003@N07"," ","7/19/2013 7:02","7/19/2013 11:03","reflection","water","sky","black and white","nature","monochrome photography","cloud","horizon","lake","calm",150863,1,"NY",2013-07-19 07:02:00,2013-07-19,7,7
185707,186707,"Rafting In Ausable Chasm Gorge. Ausable Chasm Ny State 2013.","https://farm3.staticflickr.com/2906/14247544721_811aa5ff34.jpg",0,44.536102,-73.463913,"14247544721","71150518@N04"," ","10/1/2013 15:26","5/23/2014 12:01","waterway","water","reflection","body of water","river","nature reserve","tree","bank","lake","pond",186707,1,"NY",2013-10-01 15:26:00,2013-10-01,10,15
76683,76692," ","https://farm9.staticflickr.com/8152/7241326602_182793300a.jpg",0,43.055043,-73.801903,"7241326602","7557620@N06"," ","5/19/2012 12:49","5/21/2012 13:15","car","land vehicle","motor vehicle","vehicle","steering wheel","steering part","automotive design","center console","automotive exterior","performance car",76692,1,"NY",2012-05-19 12:49:00,2012-05-19,5,12
236760,236769,"Bass Harbor near Bernard, Maine","https://farm8.staticflickr.com/7434/10005003113_4a9a26ae81.jpg",0,44.239894,-68.3521,"10005003113","21196647@N02"," ","9/5/2013 12:33","9/29/2013 18:58","waterway","water","water transportation","boat","watercraft","boating","harbor","fishing vessel","ferry","channel",236769,4,"ME",2013-09-05 12:33:00,2013-09-05,9,12
195272,195281," ","https://farm9.staticflickr.com/8262/8640760209_6e8545ea13.jpg",0,44.74053,-72.748997,"8640760209","9402626@N07","Annandale, VA","4/10/2013 19:12","4/12/2013 0:11","winter","tree","snow","sky","woody plant","freezing","cloud","morning","plant","branch",195281,2,"VT",2013-04-10 19:12:00,2013-04-10,4,19
25402,25409," ","https://farm5.staticflickr.com/4595/38732762194_1445c946fb.jpg",0,44.001552,-71.535484,"38732762194","17177034@N00"," ","6/24/2017 14:08","1/2/2018 1:55","ridge","chaparral","mountain","highland","mountainous landforms","wilderness","vegetation","hill","nature reserve","mount scenery",25409,3,"NH",2017-06-24 14:08:00,2017-06-24,6,14
172371,172380," ","https://farm1.staticflickr.com/648/32370473652_2248eb5891.jpg",0,44.488461,-72.736656,"32370473652","10938211@N03","Bay View PEI","1/25/2017 12:21","1/25/2017 19:31","snow","winter","dog like mammal","dog","freezing","sky","ice","tree","dog breed group","blizzard",172380,2,"VT",2017-01-25 12:21:00,2017-01-25,1,12
58158,58166,"A day between sister ???? #lovesweden,
[www.vasamuseet.se/meanwhile](http://www.vasamuseet.se/meanwhile)","https://farm6.staticflickr.com/5805/23887975515_ae6827de59.jpg",0,43.834526,-75.761718,"23887975515","100597270@N04"," ","12/21/2015 14:51","12/21/2015 13:51","facial expression","glasses","smile","fun","emotion","friendship","vision care","event","girl","laughter",58166,1,"NY",2015-12-21 14:51:00,2015-12-21,12,14
225580,225589," ","https://farm9.staticflickr.com/8656/28260823164_44e0dee7c9.jpg",0,45.039702,-70.317903,"28260823164","92611166@N00"," ","10/12/2014 15:20","8/9/2016 21:35","tree","soil","sky","landscape","grass"," "," "," "," "," ",225589,4,"ME",2014-10-12 15:20:00,2014-10-12,10,15
197515,197524," ","https://farm8.staticflickr.com/7490/28628858175_cc514e6657.jpg",0,44.762986,-72.147003,"28628858175","74133755@N00","Barton, Vermont","7/26/2016 16:31","7/29/2016 12:37","yellow","close up","macro photography","organism","insect","stock photography","invertebrate"," "," "," ",197524,2,"VT",2016-07-26 16:31:00,2016-07-26,7,16
277854,277868," ","https://farm1.staticflickr.com/372/18664425576_df903dbb95.jpg",0,45.904397,-68.921578,"18664425576","16935127@N04","Dixfield, ME","6/6/2015 13:14","6/11/2015 1:31","sky","highland","cloud","horizon","atmosphere","daytime","mount scenery","fell","hill","atmosphere of earth",277868,4,"ME",2015-06-06 13:14:00,2015-06-06,6,13
73963,73972," ","https://farm9.staticflickr.com/8054/8077786926_923ce29152.jpg",0,42.947603,-73.922967,"8077786926","28084105@N03"," ","10/11/2012 10:22","10/11/2012 19:13","plant","soil","grass family","grass","agriculture","child","straw","tree","crop","commodity",73972,1,"NY",2012-10-11 10:22:00,2012-10-11,10,10
205163,205172,"Ellie, eMily and Mika","https://farm4.staticflickr.com/3892/14836791579_cab6ea5bb2.jpg",0,44.972814,-72.886752,"14836791579","44455355@N00","Waltham, Mass.","7/22/2014 16:34","8/24/2014 20:15","water","girl","fun","vacation","leg","summer","water feature","tree","grass","child",205172,2,"VT",2014-07-22 16:34:00,2014-07-22,7,16
153887,153896,"Holarctic; possibly introduced from Eurasia (Bradley and Buchanan, 2012).
Cliff above beach, Lake Champlain, Shelburne Farms, Shelburne, VT 7/17/16","https://farm9.staticflickr.com/8273/29693559203_e1d687cd05.jpg",0,44.392078,-73.277721,"29693559203","48232993@N00"," ","7/17/2016 12:36","10/14/2016 19:08","spider","arachnid","invertebrate","orb weaver spider","araneus","arthropod","european garden spider","macro photography","fauna","insect",153896,2,"VT",2016-07-17 12:36:00,2016-07-17,7,12
116299,116308,"Me, riding the railbike.","https://farm6.staticflickr.com/5567/14909242081_9b9fa29699.jpg",0,44.225112,-74.314527,"14909242081","63051795@N00"," ","8/13/2014 19:15","8/14/2014 2:15","track","path","nature reserve","rail transport","trail","thoroughfare","grass","forest","tree","grass family",116308,1,"NY",2014-08-13 19:15:00,2014-08-13,8,19
244343,244352," ","https://farm9.staticflickr.com/8212/28868912730_1a842ff698.jpg",0,44.362852,-68.210556,"28868912730","92611166@N00"," ","8/15/2016 12:52","8/22/2016 14:18","rock","path","tree","boulder","trail","forest","geology","woodland","outcrop","bedrock",244352,4,"ME",2016-08-15 12:52:00,2016-08-15,8,12
192649,192658,"Dcim\100gopro","https://farm9.staticflickr.com/8015/7436806284_11f015ec6b.jpg",0,44.98308,-73.105548,"7436806284","35799401@N07","Denver, CO","6/13/2012 15:48","6/25/2012 1:34","water","sea","sky","boats and boating equipment and supplies","vacation","boating","boat","ocean","leisure","recreation",192658,2,"VT",2012-06-13 15:48:00,2012-06-13,6,15
126808,126817,"Meanwhile, somewhere in the Adirondacks...","https://farm9.staticflickr.com/8541/8610528384_f04327f368.jpg",0,44.724844,-74.541893,"8610528384","41894173617@N01"," ","4/1/2013 11:40","4/1/2013 15:40","wilderness","rock","tree","woodland","forest","boulder","wood","geology","plant","trail",126817,1,"NY",2013-04-01 11:40:00,2013-04-01,4,11
114533,114542," ","https://farm5.staticflickr.com/4375/36631379196_077e5aeb60.jpg",0,44.340157,-75.056898,"36631379196","62701837@N06"," ","8/21/2012 17:54","8/19/2017 23:20","water","waterfall","nature","stream","body of water","watercourse","creek","water resources","river","nature reserve",114542,1,"NY",2012-08-21 17:54:00,2012-08-21,8,17
208375,206752," ","https://farm8.staticflickr.com/7557/15650793728_04ed8e3d52.jpg",0,44.034622,-70.959984,"15650793728","103573645@N04"," ","10/19/2014 7:40","11/20/2014 21:05","product","arm","child","infant","toddler","bedtime","girl","childbirth","trunk","mother",206752,4,"ME",2014-10-19 07:40:00,2014-10-19,10,7
216372,216381," ","https://farm9.staticflickr.com/8522/8501366535_89fb82e8de.jpg",0,44.426156,-71.49589,"8501366535","10856322@N06"," ","7/8/2012 12:42","2/24/2013 2:35","landmark","amusement park","tourist attraction","tree","city","recreation","metropolis","fair"," "," ",216381,3,"NH",2012-07-08 12:42:00,2012-07-08,7,12
139045,139054,"August","https://farm8.staticflickr.com/7548/16047987168_5f644fc8d4.jpg",0,44.472118,-74.173743,"16047987168","23001748@N00","Canton, New York mostly","6/29/2013 17:10","1/9/2015 4:57","flower","wildflower","orange","poppy","poppy family","petal","flora","close up","coquelicot","macro photography",139054,1,"NY",2013-06-29 17:10:00,2013-06-29,6,17
48222,48230," ","https://farm3.staticflickr.com/2848/10735255694_fdbc6ae8e6.jpg",0,43.06554,-74.207925,"10735255694","77293861@N06","Ramsgate","11/1/2013 19:55","11/8/2013 4:15","leaf","nature","woodland","path","tree","deciduous","autumn","wilderness","forest","plant",48230,1,"NY",2013-11-01 19:55:00,2013-11-01,11,19
18434,18442,"Steven and Ariella rowing a rowboat at Purity Springs.","https://farm6.staticflickr.com/5527/30728426381_f4cd20ee2a.jpg",0,43.862561,-71.089548,"30728426381","26573031@N05"," ","10/10/2016 13:17","11/6/2016 15:44","outdoor recreation","water","recreation","fun","vehicle","vacation","personal protective equipment","boat","personal flotation device","adventure",18442,3,"NH",2016-10-10 13:17:00,2016-10-10,10,13
193060,193069," ","https://farm1.staticflickr.com/334/32349828571_a9f871f00e.jpg",0,44.535436,-72.778345,"32349828571","26526176@N00"," ","1/18/2017 13:36","1/23/2017 1:32","ski pole","snow","skiing","ski","mountainous landforms","piste","mountain range","winter","cloud","glacial landform",193069,2,"VT",2017-01-18 13:36:00,2017-01-18,1,13
12952,12959," ","https://farm1.staticflickr.com/290/19532044082_32109ce47c.jpg",0,43.578805,-71.205525,"19532044082","34101606@N08"," ","7/4/2015 21:48","7/9/2015 2:04","fireworks","sky","event","night","atmosphere of earth","reflection","darkness","public event","fte","evening",12959,3,"NH",2015-07-04 21:48:00,2015-07-04,7,21
239881,239890," ","https://farm4.staticflickr.com/3704/9382218698_87f8edc71b.jpg",0,44.307236,-68.190078,"9382218698","59787340@N00","Philadelphia, Pennsylvania  USA","7/24/2013 13:02","7/28/2013 2:26","sea","wave","body of water","ocean","water","shore","coastal and oceanic landforms","wind wave","coast","rock",239890,4,"ME",2013-07-24 13:02:00,2013-07-24,7,13
107766,107775," ","https://farm6.staticflickr.com/5748/22008213749_1f5b7501c8.jpg",0,44.235905,-76.086753,"22008213749","44126314@N07"," ","10/15/2015 11:39","10/15/2015 15:45","plant","flora","flower","herb","subshrub","groundcover","flowering plant"," "," "," ",107775,1,"NY",2015-10-15 11:39:00,2015-10-15,10,11
114279,114288," ","https://farm9.staticflickr.com/8775/28187836106_75d627355e.jpg",0,44.446541,-75.805634,"28187836106","21985042@N07","Orchard Park, NY","7/5/2016 12:25","7/10/2016 18:24","water","waterway","water transportation","sea","boat","boating","sailing","coastal and oceanic landforms","vacation","leisure",114288,1,"NY",2016-07-05 12:25:00,2016-07-05,7,12
279473,279490,"Vern Condon family photos (Jason's father)","https://farm9.staticflickr.com/8108/8566578819_8a66bb2d2d.jpg",0,46.618833,-67.935,"8566578819","52283044@N00"," ","11/23/2012 13:12","3/18/2013 2:47","people","photograph","white","standing","black and white","vintage clothing","monochrome photography","snapshot","photography","family",279490,4,"ME",2012-11-23 13:12:00,2012-11-23,11,13
243349,243358,"Acadia National Park, Maine October 4, 2016","https://farm6.staticflickr.com/5456/30015105174_a2499bcdc1.jpg",0,44.352013,-68.22365,"30015105174","35660941@N02","San Diego, CA","10/4/2016 6:31","10/29/2016 20:16","horizon","sunset","sky","sea","sunrise","sun","calm","ocean","morning","dawn",243358,4,"ME",2016-10-04 06:31:00,2016-10-04,10,6
275927,275937," ","https://farm9.staticflickr.com/8321/7926958450_c12f7df75d.jpg",0,45.500602,-69.5755,"7926958450","33075084@N03"," ","9/2/2012 13:55","9/4/2012 2:51","highland","sky","loch","lake","cloud","water","reservoir","tree","water resources","hill",275937,4,"ME",2012-09-02 13:55:00,2012-09-02,9,13
150401,150415," ","https://farm4.staticflickr.com/3871/15334499952_7b05762fef.jpg",0,44.53094,-73.461821,"15334499952","64781900@N00","Hemel Hempstead","9/8/2014 12:21","9/23/2014 20:28","water","nature","rock","stream","tree","river","watercourse","cliff","escarpment","terrain",150415,1,"NY",2014-09-08 12:21:00,2014-09-08,9,12
10211,10218," ","https://farm8.staticflickr.com/7301/10547092704_3d56773640.jpg",0,43.795188,-71.815628,"10547092704","35375643@N00"," ","10/28/2013 15:29","10/29/2013 1:11","siding","house","property","home","window","wall","building","facade","roof","wood",10218,3,"NH",2013-10-28 15:29:00,2013-10-28,10,15
213104,213113," ","https://farm3.staticflickr.com/2925/14155968773_b6508b17a3.jpg",0,44.270909,-71.303597,"14155968773","13086086@N02","L-town, CA","5/8/2014 2:14","5/8/2014 7:37","nature","aurora","sky","atmosphere","atmosphere of earth","phenomenon","night","landscape","outer space","arctic",213113,3,"NH",2014-05-08 02:14:00,2014-05-08,5,2
195138,195147,"One Pete is usually enough.","https://farm8.staticflickr.com/7445/8798366597_f64f130eb4.jpg",0,44.554301,-72.796901,"8798366597","40445678@N00"," ","5/18/2013 13:10","5/24/2013 1:23","rock climbing","rock","bouldering","outdoor recreation","climbing","adventure","recreation","tree","plant","sports",195147,2,"VT",2013-05-18 13:10:00,2013-05-18,5,13
134352,134361,"D&H Tunnel on the north side of Port Henry, NY. After trains got larger, they
found it easier to create a right-of-way on the shore of Lake Champlain, than
enlarge the tunnel. The property owner is trying to fill in the approach cut
to the tunnel. But wh","https://farm1.staticflickr.com/626/23039684913_8934d918ca.jpg",0,44.053616,-73.454223,"23039684913","63051795@N00"," ","5/18/2014 8:50","12/11/2015 4:54","vegetation","nature reserve","ecosystem","tree","geological phenomenon","woodland","forest","path","plant","biome",134361,1,"NY",2014-05-18 08:50:00,2014-05-18,5,8
143946,144016,"Sailboat on Lake Champlain, with Vermont in the distance; south of Essex, New
York","https://farm4.staticflickr.com/3877/14873397864_65e5645960.jpg",0,44.272547,-73.350039,"14873397864","82256568@N03"," ","8/2/2014 9:47","8/10/2014 12:59","loch","water","waterway","sky","calm","sea","boat","lake","lake district","horizon",144016,1,"NY",2014-08-02 09:47:00,2014-08-02,8,9
111283,111292," ","https://farm8.staticflickr.com/7521/28740418780_fa7525c516.jpg",0,44.286805,-76.026939,"28740418780","44126314@N07"," ","8/4/2016 17:15","8/16/2016 16:48","flower","plant","sunflower","flora","daisy family","flowering plant","plant stem"," "," "," ",111292,1,"NY",2016-08-04 17:15:00,2016-08-04,8,17
102767,102776," ","https://farm1.staticflickr.com/360/20445091895_cef1baaf48.jpg",0,43.400558,-73.569909,"20445091895","99290939@N03"," ","8/7/2015 14:12","8/10/2015 2:39","cloud","sky","tree","woody plant","leaf","daytime","forest","meteorological phenomenon","branch","phenomenon",102776,1,"NY",2015-08-07 14:12:00,2015-08-07,8,14
36170,36177," ","https://farm8.staticflickr.com/7419/10893438116_c0a5a3624e.jpg",0,44.070647,-71.171312,"10893438116","99661217@N03"," ","7/7/2013 6:47","11/16/2013 23:19","water","body of water","waterfall","watercourse","stream","water feature","water resources","rock","creek","tree",36177,3,"NH",2013-07-07 06:47:00,2013-07-07,7,6
276501,276513," ","https://farm4.staticflickr.com/3951/15328049919_4647d39a71.jpg",0,45.236736,-68.653953,"15328049919","97108788@N00","Fallston, Maryland","10/10/2014 16:40","10/12/2014 13:52","bridge","sky","waterway","cloud","arch bridge","truss bridge","leaf","river","reflection","tree",276513,4,"ME",2014-10-10 16:40:00,2014-10-10,10,16
58948,58956," ","https://farm9.staticflickr.com/8825/28674649650_ef60c73340.jpg",0,43.903458,-74.560845,"28674649650","143802280@N07"," ","8/9/2016 10:35","8/13/2016 20:00","water","vacation","vehicle","fun","boat","girl","leisure","recreation","sea","sky",58956,1,"NY",2016-08-09 10:35:00,2016-08-09,8,10
116358,116367,"The rain finally broke and the stars start to come out as we camp on Rock Pond
in Adirondack State Park, New York. The glow is from the moonrise.","https://farm3.staticflickr.com/2920/14717082002_b197ece3e3.jpg",0,43.98753,-74.647206,"14717082002","91304910@N00","Mississauga","7/13/2014 22:10","7/22/2014 14:23","reflection","sky","water","nature","cloud","horizon","atmosphere","calm","dusk","loch",116367,1,"NY",2014-07-13 22:10:00,2014-07-13,7,22
36147,36154,"Glen, NH Back to New Hampshire autumn photos... I liked this little pond that
I stumbled across.","https://farm8.staticflickr.com/7337/11049812454_bff7860906.jpg",0,44.12714,-71.1916,"11049812454","21109241@N00","Zanesville, OH","10/6/2013 6:05","11/25/2013 14:35","reflection","nature","leaf","autumn","water","temperate broadleaf and mixed forest","ecosystem","vegetation","tree","wilderness",36154,3,"NH",2013-10-06 06:05:00,2013-10-06,10,6
212259,212268," ","https://farm9.staticflickr.com/8620/16203104633_621729fb39.jpg",0,44.239711,-71.272988,"16203104633","25913978@N05","Durham, NH","3/11/2015 18:54","3/15/2015 15:16","sky","cloud","highland","mountainous landforms","mountain","tree","hill","phenomenon","terrain","morning",212268,3,"NH",2015-03-11 18:54:00,2015-03-11,3,18
39049,39066," ","https://farm5.staticflickr.com/4202/34528774310_eb47541c7e.jpg",0,44.256983,-71.438453,"34528774310","52906672@N00","Bronx, NY","5/21/2017 17:21","5/27/2017 2:02","photograph","mountainous landforms","vacation","beauty","sky","tree","girl","tourism","travel","fun",39066,3,"NH",2017-05-21 17:21:00,2017-05-21,5,17
115074,115083,"A couple more panorama views at the Wild Center in Tupper Lake, New York. This
is a 7 shot photostitch in Photoshop Elements.","https://farm8.staticflickr.com/7483/29272049021_8b4624ae78.jpg",0,44.219653,-74.434926,"29272049021","74845195@N07"," ","8/23/2016 12:00","8/31/2016 1:34","ecosystem","vegetation","sky","wilderness","nature reserve","field","tree","grass family","grass","grassland",115083,1,"NY",2016-08-23 12:00:00,2016-08-23,8,12
128209,128218,"between chateaugay and malone a haphazaard hot dog stand and i say say AH!","https://farm8.staticflickr.com/7344/9038343986_483ab164c7.jpg",0,44.857,-74.261334,"9038343986","69408207@N03"," ","6/13/2013 11:40","6/14/2013 0:00","structure","landmark","sport venue","sky","race track","race","car","stadium","flag"," ",128218,1,"NY",2013-06-13 11:40:00,2013-06-13,6,11
279775,279792,"St. John River from St. John, Maine looking into St. Franois de Madawaska,
New Brunswick","https://farm8.staticflickr.com/7245/7050817633_8b06ecf981.jpg",0,47.237024,-68.706861,"7050817633","39456348@N08"," ","2/12/2012 13:02","4/6/2012 14:59","sky","water","nature","reflection","cloud","green","river","tree","wetland","bank",279792,4,"ME",2012-02-12 13:02:00,2012-02-12,2,13
116074,116083,"Looking out at Long Lake, while fetching a pail of water.","https://farm4.staticflickr.com/3947/15354265217_c8277ba79f.jpg",0,44.041777,-74.348664,"15354265217","12834796@N00","Inwood, NY","10/10/2014 11:27","10/15/2014 6:12","water","nature","body of water","river","leaf","nature reserve","tree","bank","lake","creek",116083,1,"NY",2014-10-10 11:27:00,2014-10-10,10,11
74818,74827,"Blue Heron on Ballston Lake","https://farm9.staticflickr.com/8506/8494074168_4e2a185087.jpg",0,42.954286,-73.849303,"8494074168","55742549@N05"," ","9/14/2012 16:54","2/21/2013 1:41","reflection","water","bird","fauna","leaf","ecosystem","wildlife","beak","bank","wetland",74827,1,"NY",2012-09-14 16:54:00,2012-09-14,9,16
234007,234016," ","https://farm6.staticflickr.com/5660/23605454692_50c321a8a4.jpg",0,44.177283,-68.239945,"23605454692","73101728@N00","New Orleans, LA","7/2/2015 13:54","12/13/2015 6:05","sea","water","ocean","wave","sky","coastal and oceanic landforms","seabird","wind wave","horizon","calm",234016,4,"ME",2015-07-02 13:54:00,2015-07-02,7,13
206529,208239," ","https://farm8.staticflickr.com/7372/11330181936_3c718878f7.jpg",0,44.287293,-71.5452,"11330181936","88823436@N00"," ","10/2/2013 14:25","12/11/2013 22:45","flower","yellow","plant","flora","sunflower","leaf","daisy family","spring"," "," ",208239,3,"NH",2013-10-02 14:25:00,2013-10-02,10,14
240788,240797,"The ferns turned a rich golden hue","https://farm6.staticflickr.com/5644/23763535769_27bf59b4b2.jpg",0,44.313388,-68.336839,"23763535769","62637674@N00","Atlanta, Georgia","10/16/2015 10:58","1/2/2016 19:13","vegetation","grass family","grass","ferns and horsetails","organism","larch","phragmites","grain","fern","seaweed",240797,4,"ME",2015-10-16 10:58:00,2015-10-16,10,10
184467,184285," ","https://farm5.staticflickr.com/4180/33915506694_7ef9b30eef.jpg",0,44.736944,-73.294445,"33915506694","11388974@N02"," ","5/18/2017 11:02","5/19/2017 17:55","vegetation","woodland","ecosystem","nature","nature reserve","forest","tree","temperate broadleaf and mixed forest","deciduous","wilderness",184285,2,"VT",2017-05-18 11:02:00,2017-05-18,5,11
223390,223399," ","https://farm1.staticflickr.com/470/19528628018_7e60981fc4.jpg",0,44.587297,-70.245914,"19528628018","119720516@N06"," ","7/15/2015 7:46","7/15/2015 12:26","grave","cemetery","headstone","grass","memorial","stele"," "," "," "," ",223399,4,"ME",2015-07-15 07:46:00,2015-07-15,7,7
61697,61705," ","https://farm4.staticflickr.com/3671/9886848544_59dcf683e5.jpg",0,43.520113,-74.33392,"9886848544","46868682@N04","upstate new york","9/15/2013 10:35","9/23/2013 0:59","plant","flora","leaf","vegetation","flower","grass","grass family","spring","wildflower","terrestrial plant",61705,1,"NY",2013-09-15 10:35:00,2013-09-15,9,10
60064,60072,"David Koester waiting for a bite on Limekiln Lake. Photo: Gary Lee, Inlet, NY","https://farm1.staticflickr.com/713/20578048049_33a3474878.jpg",0,43.714883,-74.795758,"20578048049","35978796@N05"," ","8/21/2015 13:26","8/21/2015 17:26","water","waterway","rainbow","loch","cloud","sky","reservoir","river","lake","meteorological phenomenon",60072,1,"NY",2015-08-21 13:26:00,2015-08-21,8,13
269224,269233,"Chainsaw Ray Murphy's Chainsaw Sawyer Artist Show, Hancock ME","https://farm4.staticflickr.com/3696/20014953756_2afd35face.jpg",0,44.539513,-68.319221,"20014953756","7904868@N07"," ","7/24/2015 19:00","7/27/2015 2:20","wood","tree","recreation"," "," "," "," "," "," "," ",269233,4,"ME",2015-07-24 19:00:00,2015-07-24,7,19
221370,220967," ","https://farm5.staticflickr.com/4302/36011068851_e49148d269.jpg",0,44.607275,-70.89812,"36011068851","54573009@N00"," ","7/22/2017 13:24","7/25/2017 1:39","wilderness","ridge","mountain","mountainous landforms","vegetation","ecosystem","nature reserve","tree","highland","mount scenery",220967,4,"ME",2017-07-22 13:24:00,2017-07-22,7,13
106332,106341," ","https://farm8.staticflickr.com/7599/27434766614_456fcf5a8f.jpg",0,43.841421,-73.388382,"27434766614","15265115@N06"," ","6/2/2016 11:50","7/3/2016 1:59","sky","car","cloud","highland","transport","tree","road","atmosphere of earth","rural area","field",106341,1,"NY",2016-06-02 11:50:00,2016-06-02,6,11
184621,184476," ","https://farm9.staticflickr.com/8579/29941594870_0b711c9508.jpg",0,44.766678,-73.313655,"29941594870","14617204@N06"," ","10/6/2016 13:53","10/10/2016 14:57","tree","black and white","woody plant","monochrome photography","photography","plant","monochrome","branch","water","grass",184476,2,"VT",2016-10-06 13:53:00,2016-10-06,10,13
57382,57390," ","https://farm5.staticflickr.com/4297/35964913891_2d2649789d.jpg",0,43.768222,-76.216484,"35964913891","95957882@N00"," ","7/22/2017 16:25","7/23/2017 2:28","flower","plant","yellow","flora","wildflower","flowering plant","daisy family","annual plant","spring","grass",57390,1,"NY",2017-07-22 16:25:00,2017-07-22,7,16
116859,116868," ","https://farm4.staticflickr.com/3818/9270673481_916394cc25.jpg",0,44.230502,-74.336119,"9270673481","63596029@N00","DeKalb Jct., NY","7/12/2013 18:45","7/12/2013 23:45","water","reflection","nature","body of water","tree","lake","sky","leaf","river","plant",116868,1,"NY",2013-07-12 18:45:00,2013-07-12,7,18
169876,169885," ","https://farm3.staticflickr.com/2828/11629399315_0895597474.jpg",0,44.177536,-72.902337,"11629399315","96463101@N00","Salt Lake City, UT","12/28/2013 14:02","12/29/2013 18:57","snow","winter","water","freezing","sky","tree","river","morning","reflection","ice",169885,2,"VT",2013-12-28 14:02:00,2013-12-28,12,14
49739,49747,"Both the combine and the transporter are emptying into the trailer of this
truck. That's a lot of corn.","https://farm6.staticflickr.com/5744/22447194169_eec634908d.jpg",0,43.076066,-75.372583,"22447194169","16096977@N05"," ","11/6/2015 19:23","11/7/2015 3:23","transport","motor vehicle","vehicle","rail transport","truck","tree","road","asphalt","train","public utility",49747,1,"NY",2015-11-06 19:23:00,2015-11-06,11,19
238522,238531," ","https://farm8.staticflickr.com/7378/27189093690_c75617ed4f.jpg",0,44.311535,-68.189048,"27189093690","94881114@N04"," ","5/25/2016 13:30","6/5/2016 0:42","coast","shore","body of water","sea","coastal and oceanic landforms","water","wilderness","promontory","sky","ocean",238531,4,"ME",2016-05-25 13:30:00,2016-05-25,5,13
45759,45767,"Fort Herkimer Cemetery.","https://farm5.staticflickr.com/4209/35633269822_ce950070b4.jpg",0,43.018247,-74.954481,"35633269822","37493972@N00"," ","7/6/2017 12:14","7/8/2017 20:00","grave","grass","headstone","cemetery","flag","memorial","lawn","tree"," "," ",45767,1,"NY",2017-07-06 12:14:00,2017-07-06,7,12
199143,199152,"Victory Basin WMA Victory, VT","https://farm1.staticflickr.com/508/19261430890_0d81718332.jpg",0,44.534183,-71.799043,"19261430890","36786744@N04"," ","6/29/2015 13:25","7/5/2015 22:49","tree","branch","trunk","twig","wood","wildlife","plant"," "," "," ",199152,2,"VT",2015-06-29 13:25:00,2015-06-29,6,13
20647,20608," ","https://farm6.staticflickr.com/5470/30202720100_b5bd000c54.jpg",0,44.141838,-71.681309,"30202720100","15970544@N08","Dedham, MA","10/22/2016 14:08","10/23/2016 2:24","tree","plant","recreation","technology"," "," "," "," "," "," ",20608,3,"NH",2016-10-22 14:08:00,2016-10-22,10,14
58564,58572," ","https://farm5.staticflickr.com/4208/35000604556_1fa8c558dd.jpg",0,43.871366,-74.451573,"35000604556","87268711@N00","Rome, NY","6/1/2017 19:25","6/1/2017 23:31","deer","mammal","fauna","wildlife","antler","reindeer","snout","stock photography"," "," ",58572,1,"NY",2017-06-01 19:25:00,2017-06-01,6,19
226419,226428," ","https://farm9.staticflickr.com/8789/28286447175_d5a53eec2a.jpg",0,45.053833,-70.310167,"28286447175","92611166@N00"," ","2/15/2014 10:18","7/13/2016 15:55","sunglasses","car","helmet","eyewear","winter","headgear","snow","fun","vehicle","personal protective equipment",226428,4,"ME",2014-02-15 10:18:00,2014-02-15,2,10
221203,220604," ","https://farm8.staticflickr.com/7086/7390441056_477112f979.jpg",0,44.469921,-70.297565,"7390441056","30542755@N00","Portland ME","6/15/2012 10:29","6/18/2012 0:33","land vehicle","bicycle","cycling","tree","vehicle","woody plant","bicycle racing","road","endurance sports","plant",220604,4,"ME",2012-06-15 10:29:00,2012-06-15,6,10
280388,280406," ","https://farm4.staticflickr.com/3914/14804769189_cd29566691.jpg",0,47.156958,-67.935338,"14804769189","40646519@N00","Manorville, Long Island","8/14/2014 16:09","8/21/2014 17:35","car","town","road","neighbourhood","residential area","lane","urban area","city","downtown","street",280406,4,"ME",2014-08-14 16:09:00,2014-08-14,8,16
228747,228756," ","https://farm8.staticflickr.com/7289/27452915220_25193510b7.jpg",0,45.033666,-70.3005,"27452915220","92611166@N00"," ","4/14/2013 13:30","6/17/2016 17:03","snow","winter","tree","freezing","woody plant","sky","blizzard","frost","winter storm","geological phenomenon",228756,4,"ME",2013-04-14 13:30:00,2013-04-14,4,13
115448,115457," ","https://farm1.staticflickr.com/604/21729919299_1a72be6247.jpg",0,44.203005,-74.825059,"21729919299","44126314@N07"," ","9/20/2015 9:57","10/3/2015 17:44","rock","water","boulder","pebble","landscape","material","stream","tree","grass"," ",115457,1,"NY",2015-09-20 09:57:00,2015-09-20,9,9
74012,74021,"SONY DSC","https://farm1.staticflickr.com/746/22598556746_921263fcef.jpg",0,43.054417,-74.188184,"22598556746","91790917@N07","Pittsburgh, PA","10/30/2015 17:26","10/31/2015 3:10","sport venue","sports","volleyball","volleyball","team sport","volleyball net","volleyball player","ball game","games","ball over a net games",74021,1,"NY",2015-10-30 17:26:00,2015-10-30,10,17
76813,76822," ","https://farm5.staticflickr.com/4496/38044151081_5a9f27d086.jpg",0,43.003911,-73.608734,"38044151081","62837112@N03","Braintree","10/27/2017 16:29","10/30/2017 17:19","ecosystem","nature reserve","vegetation","sky","wilderness","wetland","shrubland","prairie","loch","grassland",76822,1,"NY",2017-10-27 16:29:00,2017-10-27,10,16
170180,170189," ","https://farm4.staticflickr.com/3881/14689825941_9e8b6d2758.jpg",0,44.184183,-72.835792,"14689825941","57055086@N08"," ","9/28/2013 12:34","7/19/2014 19:25","drink","window"," "," "," "," "," "," "," "," ",170189,2,"VT",2013-09-28 12:34:00,2013-09-28,9,12
103380,103389," ","https://farm5.staticflickr.com/4267/34710160372_7ac17ed779.jpg",0,43.867997,-73.983978,"34710160372","34457549@N08","Melbourne Beach, Florida","5/18/2017 16:48","5/24/2017 22:58","waterway","water","reflection","nature","sky","lake","body of water","loch","cloud","river",103389,1,"NY",2017-05-18 16:48:00,2017-05-18,5,16
174294,174303,"Come to the Stoweflake Hot Air Balloon Festival and let your spirit soar as
more than 25 hot-air balloons fill the sky.
[stoweballoonfestival.com/](http://stoweballoonfestival.com/) ++ ++ ++ ++ ++
image by Photo George copyrighted: 2016 GCheatle all rig","https://farm9.staticflickr.com/8782/28453448155_5eef7c2c0e.jpg",0,44.478795,-72.711479,"28453448155","64964567@N00","Pennington, NJ","7/8/2016 19:21","7/21/2016 15:31","hot air ballooning","hot air balloon","balloon","sky","atmosphere of earth","daytime","leisure","tourism","summer","fun",174303,2,"VT",2016-07-08 19:21:00,2016-07-08,7,19
192380,192389,"Olympus digital camera","https://farm8.staticflickr.com/7246/7438701360_1fc0c3c404.jpg",0,44.980863,-73.103123,"7438701360","35799401@N07","Denver, CO","6/12/2012 17:18","6/25/2012 8:15","glasses","child","facial expression","skin","vision care","smile","emotion","eye","girl","human behavior",192389,2,"VT",2012-06-12 17:18:00,2012-06-12,6,17
206580,208290,"Day 3 of the family trip to New Hampshire wrapped up the company outing, and
took us to Dalton, NH, and the borrowed vacation home of a friend. Other than
doing some grocery shopping and picking up some pizza for dinner, we spent the
bulk of the day just","https://farm9.staticflickr.com/8284/7722006046_3bc36d1c00.jpg",0,44.374317,-71.682728,"7722006046","40761412@N00","New Bedford, MA","7/29/2012 18:21","8/6/2012 1:53","sky","nature","cloud","grassland","field","grass","hill","photography","rural area","meadow",208290,3,"NH",2012-07-29 18:21:00,2012-07-29,7,18
49474,49482," ","https://farm2.staticflickr.com/1476/26176198414_c951689d4a.jpg",0,43.186797,-75.400406,"26176198414","74301381@N06","Rome, New York","4/28/2016 12:03","5/2/2016 23:07","wood","material","macro photography"," "," "," "," "," "," "," ",49482,1,"NY",2016-04-28 12:03:00,2016-04-28,4,12
145340,145197," ","https://farm8.staticflickr.com/7265/7562355062_ac6b1e2d35.jpg",0,44.306913,-73.246257,"7562355062","69106501@N06"," ","7/3/2012 13:32","7/13/2012 15:30","flower","flora","plant","grass","wildflower","pollinator","tree","spring","moths and butterflies","branch",145197,2,"VT",2012-07-03 13:32:00,2012-07-03,7,13
172901,172910," ","https://farm6.staticflickr.com/5493/30707021671_b2fd01e106.jpg",0,44.512663,-72.766037,"30707021671","99936744@N03"," ","10/19/2016 17:09","11/5/2016 17:02","sky","nature","leaf","mountainous landforms","wilderness","hill","tree","highland","grassland","mountain",172910,2,"VT",2016-10-19 17:09:00,2016-10-19,10,17
106855,106864," ","https://farm8.staticflickr.com/7098/13935800501_d66402d4b8.jpg",0,43.922966,-73.44902,"13935800501","115598848@N06"," ","4/20/2014 12:25","4/21/2014 2:02","face","person","facial expression","head","smile","forehead","chin","hairstyle","emotion","selfie",106864,1,"NY",2014-04-20 12:25:00,2014-04-20,4,12
106416,106425," ","https://farm1.staticflickr.com/680/21720102543_cbbc0e6e2f.jpg",0,43.841961,-73.388462,"21720102543","36838376@N08"," ","10/21/2015 6:17","10/20/2015 21:17","sky","nature","plant","tree","green","woody plant","grass","photography","light","cloud",106425,1,"NY",2015-10-21 06:17:00,2015-10-21,10,6
59867,59875," ","https://farm8.staticflickr.com/7736/26293748983_0f74258a97.jpg",0,43.72663,-74.924181,"26293748983","56824329@N05"," ","5/8/2016 13:47","5/8/2016 20:47","face","people","woman","facial expression","glasses","person","smile","emotion","beauty","fun",59875,1,"NY",2016-05-08 13:47:00,2016-05-08,5,13
147603,147460," ","https://farm9.staticflickr.com/8031/8066152307_51de0d2dcc.jpg",0,44.384529,-73.260419,"8066152307","25964739@N00","Cleveland, Ohio","10/6/2012 15:09","10/8/2012 9:14","house","home","property","estate","neighbourhood","residential area","mansion","building","architecture","real estate",147460,2,"VT",2012-10-06 15:09:00,2012-10-06,10,15
275247,275257," ","https://farm3.staticflickr.com/2809/10373208944_cfb818c092.jpg",0,45.50127,-69.576898,"10373208944","33647788@N02"," ","10/11/2013 13:46","10/20/2013 3:08","leaf","ecosystem","path","woodland","tree","autumn","deciduous","nature reserve","trail","temperate broadleaf and mixed forest",275257,4,"ME",2013-10-11 13:46:00,2013-10-11,10,13
274208,274218," ","https://farm3.staticflickr.com/2834/34207834506_4c85684231.jpg",0,45.16798,-69.385492,"34207834506","66062373@N02"," ","4/24/2017 8:34","4/24/2017 20:05","text","font","brand"," "," "," "," "," "," "," ",274218,4,"ME",2017-04-24 08:34:00,2017-04-24,4,8
61245,61253," ","https://farm6.staticflickr.com/5105/14025987554_e72450e00a.jpg",0,43.396307,-74.85981,"14025987554","77293861@N06","Ramsgate","4/21/2014 21:31","4/26/2014 23:11","text","wood"," "," "," "," "," "," "," "," ",61253,1,"NY",2014-04-21 21:31:00,2014-04-21,4,21
35136,35143,"Round trip on the Conway Scenic Railroad from North Conway to Fabyan's station
at Bretton Woods. A Russell snow plow located at the Bartlett Roundhouse
sidings.","https://farm6.staticflickr.com/5776/22761001916_b51cd7fafd.jpg",0,44.076725,-71.28112,"22761001916","50260216@N08"," ","9/15/2015 15:57","11/4/2015 18:57","transport","rail transport","vehicle","track","rolling stock","train","motor vehicle","tree","locomotive","plant",35143,3,"NH",2015-09-15 15:57:00,2015-09-15,9,15
104589,104598," ","https://farm9.staticflickr.com/8517/8587018935_dedf27438b.jpg",0,43.680833,-74.0175,"8587018935","65805667@N07"," ","12/29/2012 11:03","3/25/2013 0:43","snow","piste","winter","geological phenomenon","freezing","winter sport","terrain","tree","skiing","snowboard",104598,1,"NY",2012-12-29 11:03:00,2012-12-29,12,11
232587,232596," ","https://farm5.staticflickr.com/4360/36409533531_25fa539b39.jpg",0,44.229344,-68.313217,"36409533531","12276024@N04"," ","8/7/2017 9:32","8/13/2017 18:38","shore","coast","sky","coastal and oceanic landforms","rock","wood","water","sea","bay","inlet",232596,4,"ME",2017-08-07 09:32:00,2017-08-07,8,9
199474,199483,"Rasputitsa 2015","https://farm9.staticflickr.com/8786/16969928090_20b8836fe3.jpg",0,44.642319,-71.922073,"16969928090","127548798@N06"," ","4/10/2015 15:48","4/15/2015 14:26","car","motor vehicle","snow","winter","vehicle","tree","automotive tire","tire","fun","recreation",199483,2,"VT",2015-04-10 15:48:00,2015-04-10,4,15
103888,103897,"Adirondack Park. Town of Schroon, Essex County, NY.","https://farm4.staticflickr.com/3900/14577964106_51fd424b63.jpg",0,43.797429,-73.802225,"14577964106","37374959@N07"," ","7/6/2014 6:28","7/8/2014 1:42","reflection","water","nature","sky","wetland","tree","evening","cloud","morning","swamp",103897,1,"NY",2014-07-06 06:28:00,2014-07-06,7,6
192976,192985," ","https://farm5.staticflickr.com/4327/36001293911_8ac005d2bc.jpg",0,44.542077,-72.816828,"36001293911","77069436@N00"," ","7/18/2017 14:13","7/24/2017 17:18","sky","cloud","mountainous landforms","nature","mountain","mountain range","hill","hill station","tree","mount scenery",192985,2,"VT",2017-07-18 14:13:00,2017-07-18,7,14
273759,273768," ","https://farm9.staticflickr.com/8447/7934300988_af90bb82b3.jpg",0,45.122172,-70.599198,"7934300988","37162306@N00"," ","9/3/2012 11:05","9/5/2012 2:53","tree","nature reserve","forest","woodland","old growth forest","plant","jungle","trunk","rainforest","trail",273768,4,"ME",2012-09-03 11:05:00,2012-09-03,9,11
195508,195517,"Morning on Ritterbush Pond","https://farm9.staticflickr.com/8055/8150842056_14dd5e5567.jpg",0,44.746489,-72.599372,"8150842056","70940023@N07"," ","9/27/2012 7:06","11/3/2012 15:53","nature","ecosystem","leaf","wilderness","autumn","vegetation","tree","forest","temperate broadleaf and mixed forest","morning",195517,2,"VT",2012-09-27 07:06:00,2012-09-27,9,7
9624,9631," ","https://farm8.staticflickr.com/7164/6809457583_95c3b525bd.jpg",0,43.753143,-72.132528,"6809457583","17177034@N00"," ","1/29/2012 13:54","2/3/2012 0:53","tree","woody plant","snow","birch","trunk","winter","freezing","woodland","wood","branch",9631,3,"NH",2012-01-29 13:54:00,2012-01-29,1,13
129398,129407," ","https://farm1.staticflickr.com/323/31667584260_70a18705d8.jpg",0,44.079319,-73.666914,"31667584260","148245800@N03"," ","5/28/2013 12:47","1/2/2017 4:54","green","nature","nature reserve","street sign","sign","signage","tree","traffic sign","grass","road",129407,1,"NY",2013-05-28 12:47:00,2013-05-28,5,12
169313,169322," ","https://farm6.staticflickr.com/5539/9543903685_7c8af71704.jpg",0,44.128297,-72.870431,"9543903685","25883430@N03"," ","8/9/2013 17:44","8/19/2013 11:36","sky","nature","mountainous landforms","tree","leisure","cloud","mountain","plant","tourism","photography",169322,2,"VT",2013-08-09 17:44:00,2013-08-09,8,17
211129,211138," ","https://farm6.staticflickr.com/5665/23297205209_fb14d2c8b6.jpg",0,44.304183,-71.316659,"23297205209","90741567@N03"," ","12/5/2015 11:37","12/11/2015 2:30","snow","sky","mountainous landforms","winter","mountain","freezing","nunatak","arctic","fell","mountain range",211138,3,"NH",2015-12-05 11:37:00,2015-12-05,12,11
98338,98347," ","https://farm6.staticflickr.com/5811/31239957146_861320cb6f.jpg",0,43.418943,-73.706613,"31239957146","145781285@N03","Boston, MA","3/24/2016 9:43","11/27/2016 16:35","water","bird","water bird","river","duck","ducks geese and swans","waterfowl","wildlife","beak","wave",98347,1,"NY",2016-03-24 09:43:00,2016-03-24,3,9
241469,241478," ","https://farm5.staticflickr.com/4463/37484943821_1c7183aa53.jpg",0,44.355172,-68.25567,"37484943821","96231939@N08"," ","9/23/2017 16:55","10/4/2017 2:26","lake","wilderness","nature reserve","water","reservoir","loch","sky","water resources","reflection","tarn",241478,4,"ME",2017-09-23 16:55:00,2017-09-23,9,16
264602,264611,"Out of Acadia Sunset Excursion to Schoodic Point with Juan Pons - Moonrise and
Little Moose Island","https://farm5.staticflickr.com/4454/38160950532_9302fc88db.jpg",0,44.338633,-68.053217,"38160950532","24706120@N05"," ","10/3/2017 19:00","11/5/2017 18:12","sky","nature","horizon","moonlight","night","sea","atmosphere","water","reflection","dusk",264611,4,"ME",2017-10-03 19:00:00,2017-10-03,10,19
171657,171666," ","https://farm5.staticflickr.com/4512/37426186480_202c355f9b.jpg",0,44.482272,-72.624353,"37426186480","38993937@N05"," ","10/10/2017 14:28","10/14/2017 4:30","tree","woody plant","trunk","plant","woodland","branch","rock","deciduous","forest","texture",171666,2,"VT",2017-10-10 14:28:00,2017-10-10,10,14
204826,204835," ","https://farm8.staticflickr.com/7328/9228485253_b1aa956844.jpg",0,44.899666,-72.644637,"9228485253","31827372@N00"," ","7/6/2013 8:08","7/7/2013 13:28","sky","architecture","building","daytime","structure","roof","house","facade","angle","daylighting",204835,2,"VT",2013-07-06 08:08:00,2013-07-06,7,8
21875,21836," ","https://farm1.staticflickr.com/766/23383626916_44bc4e7c48.jpg",0,44.023325,-71.831325,"23383626916","25345777@N00","Hopkinton","11/29/2015 12:17","11/30/2015 1:34","mountainous landforms","outdoor recreation","backpacking","rock","mountain","wilderness","ridge","hiking","adventure","mountaineering",21836,3,"NH",2015-11-29 12:17:00,2015-11-29,11,12
45516,45524," ","https://farm8.staticflickr.com/7211/7295480494_4a8c1060a7.jpg",0,43.003906,-75.191192,"7295480494","78708970@N05","Central/Upsate New York","5/29/2012 8:12","5/29/2012 15:47","living room","room","property","house","home","interior design","window","real estate","wood","flooring",45524,1,"NY",2012-05-29 08:12:00,2012-05-29,5,8
114065,114074," ","https://farm1.staticflickr.com/527/19848903390_970529cecb.jpg",0,44.338486,-75.716689,"19848903390","44126314@N07"," ","7/26/2015 13:35","7/26/2015 22:41","vegetation","ecosystem","nature reserve","forest","tree","woodland","rainforest","jungle","old growth forest","path",114074,1,"NY",2015-07-26 13:35:00,2015-07-26,7,13
219290,219216," ","https://farm4.staticflickr.com/3755/9590217295_c8a94ae511.jpg",0,44.322159,-70.590097,"9590217295","64158078@N05"," ","8/24/2013 10:30","8/25/2013 16:55","house","property","home","cottage","estate","farmhouse","real estate","land lot","grass","tree",219216,4,"ME",2013-08-24 10:30:00,2013-08-24,8,10
191603,191612," ","https://farm3.staticflickr.com/2920/14573420121_e5738e49ab.jpg",0,44.980305,-73.106295,"14573420121","35799401@N07","Denver, CO","6/9/2014 16:42","7/5/2014 4:40","water","red","sunglasses","glasses","pink","vacation","fun","leisure","girl","tree",191612,2,"VT",2014-06-09 16:42:00,2014-06-09,6,16
243274,243283," ","https://farm6.staticflickr.com/5459/30714006811_e9abb6293f.jpg",0,44.322686,-68.254098,"30714006811","38136781@N03"," ","9/2/2016 12:38","11/6/2016 0:18","highland","loch","nature","lake","water","sky","cloud","wilderness","mountain","fjord",243283,4,"ME",2016-09-02 12:38:00,2016-09-02,9,12
222907,222912,"A close up shot near the boat launch area on Rangeley Lake in Maine","https://farm8.staticflickr.com/7114/8163219083_c1db341fa8.jpg",0,44.934759,-70.706967,"8163219083","8412758@N04","Stoneham, MA","9/27/2012 13:35","11/7/2012 5:57","water","nature","body of water","rock","sky","shore","sea","tree","coast","loch",222912,4,"ME",2012-09-27 13:35:00,2012-09-27,9,13
77904,77913," ","https://farm6.staticflickr.com/5542/10798745665_07357320e1.jpg",0,43.012025,-73.648898,"10798745665","29596200@N00","Caracas, Venezuela","11/10/2013 21:02","11/11/2013 13:29","sky","cloud","highland","black and white","loch","monochrome photography","tree","photography","water","monochrome",77913,1,"NY",2013-11-10 21:02:00,2013-11-10,11,21
48068,48076," ","https://farm3.staticflickr.com/2910/14020372622_b378b02242.jpg",0,43.06554,-74.207925,"14020372622","77293861@N06","Ramsgate","4/18/2014 20:32","4/26/2014 20:07","structure","architecture","urban area","branch","tree","roof","building","scaffolding","tourist attraction","facade",48076,1,"NY",2014-04-18 20:32:00,2014-04-18,4,20
66844,66853," ","https://farm9.staticflickr.com/8306/7959612874_b2680dfba3.jpg",0,42.869166,-73.876389,"7959612874","48791506@N07"," ","9/8/2012 19:19","9/9/2012 2:39","sky","rainbow","atmosphere","cloud","evening","meteorological phenomenon","morning","phenomenon","tree","dawn",66853,1,"NY",2012-09-08 19:19:00,2012-09-08,9,19
18407,18415,"This image is one of a series of ""raw"" images I took for my time lapse of the
Aurora over Chocorua.","https://farm8.staticflickr.com/7270/7583783546_fac3d62bf9.jpg",0,43.89656,-71.23149,"7583783546","13086086@N02","L-town, CA","7/14/2012 22:36","7/16/2012 17:11","black","sky","night","atmosphere","darkness","geological phenomenon","atmosphere of earth","phenomenon","horizon","dawn",18415,3,"NH",2012-07-14 22:36:00,2012-07-14,7,22
224145,224154," ","https://farm8.staticflickr.com/7605/28147499606_895af2bbd9.jpg",0,44.679908,-70.450531,"28147499606","37098859@N00"," ","7/3/2016 16:24","7/9/2016 2:37","land vehicle","path","tree","bicycle","plant","vertebrate","trail","road bicycle","vehicle","sports equipment",224154,4,"ME",2016-07-03 16:24:00,2016-07-03,7,16
190361,191149,"[youtu.be/7B3Cx43v3A0](http://youtu.be/7B3Cx43v3A0)","https://farm6.staticflickr.com/5200/6906435856_b5dc7672b9.jpg",0,44.986141,-73.446029,"6906435856","37424391@N07","Carle Place, N.Y.","4/6/2012 10:10","4/7/2012 3:38","bird","fauna","ecosystem","bird of prey","eagle","beak","accipitriformes","hawk","wildlife","buzzard",191149,1,"NY",2012-04-06 10:10:00,2012-04-06,4,10
145238,145095,"I recently bought a used 80-200 two ring version, and was terrified that it
was broken when I turned on my camera and neither the AF or metering worked.
However, after some digging, I found that this was the problem. The plastic
strip that holds the ball","https://farm6.staticflickr.com/5464/8843805496_13f61530ab.jpg",0,44.271333,-73.194334,"8843805496","60014332@N08","Burlington, Vermont","5/17/2013 18:45","5/26/2013 17:07","close up","font","wheel"," "," "," "," "," "," "," ",145095,2,"VT",2013-05-17 18:45:00,2013-05-17,5,18
197164,197173," ","https://farm9.staticflickr.com/8612/28881816675_dd4cde2a45.jpg",0,44.763611,-72.186666,"28881816675","96668047@N03"," ","8/9/2016 18:29","8/10/2016 1:29","black and white","fauna","monochrome photography","photography","bird","beak","monochrome","wildlife","galliformes","still life photography",197173,2,"VT",2016-08-09 18:29:00,2016-08-09,8,18
198482,198491," ","https://farm8.staticflickr.com/7242/27723080341_8d9e6544b0.jpg",0,44.762986,-72.147003,"27723080341","74133755@N00","Barton, Vermont","6/14/2016 6:34","6/20/2016 17:37","insect","moths and butterflies","moth","invertebrate","arthropod","pollinator","pest","butterfly"," "," ",198491,2,"VT",2016-06-14 06:34:00,2016-06-14,6,6
48811,48819," ","https://farm9.staticflickr.com/8286/28999182440_8578658081.jpg",0,43.337677,-75.113242,"28999182440","75625620@N02"," ","8/23/2016 10:21","8/29/2016 0:40","motocross","motorcycle","motorcycling","soil","woody plant","motorsport","tree","racing","off roading","motorcycle racing",48819,1,"NY",2016-08-23 10:21:00,2016-08-23,8,10
219240,219156,"Steering around some rough water","https://farm6.staticflickr.com/5449/9691915713_5d2edec9a3.jpg",0,44.407655,-70.901048,"9691915713","8405842@N02"," ","9/3/2013 15:05","9/7/2013 16:43","waterway","kayak","nature","boat","water","kayaking","sea kayak","boats and boating equipment and supplies","canoe","river",219156,4,"ME",2013-09-03 15:05:00,2013-09-03,9,15
59982,59990," ","https://farm6.staticflickr.com/5782/21980663382_49c215e7f3.jpg",0,43.7238,-74.899462,"21980663382","74301381@N06","Rome, New York","10/5/2015 9:59","10/6/2015 12:27","reflection","sky","water","loch","nature","lake","cloud","reservoir","wilderness","highland",59990,1,"NY",2015-10-05 09:59:00,2015-10-05,10,9
192048,192057,"Olympus digital camera","https://farm4.staticflickr.com/3723/9054741776_8f7c425503.jpg",0,44.980161,-73.106398,"9054741776","35799401@N07","Denver, CO","6/13/2013 17:28","6/16/2013 0:54","face","yellow","nose","chin","cheek","smile","lip","girl","glasses","fun",192057,2,"VT",2013-06-13 17:28:00,2013-06-13,6,17
205117,205126,"Eye-Fi","https://farm8.staticflickr.com/7067/6856310371_5d23e1defd.jpg",0,44.9326,-72.478945,"6856310371","24676190@N06"," ","2/11/2012 15:06","2/11/2012 13:13","bird","fauna","snow","beak","winter","wood","tree","wildlife","woodpecker","piciformes",205126,2,"VT",2012-02-11 15:06:00,2012-02-11,2,15
265271,265280,"This image were taken as part of Brent Ander's Astro-Landscape Photography
Workshop at CERC. Dense clouds prevented us from doing taking pictures of the
Milkyway so we worked on other forms of night photography and light painting.","https://farm8.staticflickr.com/7666/17247978152_fa944ff830.jpg",0,44.335638,-68.061281,"17247978152","51450749@N06","Trumbull, Connecticut","8/22/2014 20:58","4/23/2015 23:44","wall","darkness","light","wood","brick","night","window","alley","door","house",265280,4,"ME",2014-08-22 20:58:00,2014-08-22,8,20
41632,42126," ","https://farm2.staticflickr.com/1671/26353240862_5d9c947ee3.jpg",0,43.114219,-75.588242,"26353240862","99982003@N07"," ","4/7/2016 20:37","4/15/2016 16:30","concert","rock concert","stage","entertainment","performance","guitarist","darkness","performing arts","singing","drummer",42126,1,"NY",2016-04-07 20:37:00,2016-04-07,4,20
105209,105218," ","https://farm4.staticflickr.com/3848/14976420266_b10918ffbd.jpg",0,43.698627,-73.503824,"14976420266","30509233@N08"," ","7/14/2014 11:53","8/22/2014 14:31","target archery","bow and arrow","outdoor recreation","shoulder","archery","tree","grass","recreation","fun","plant",105218,1,"NY",2014-07-14 11:53:00,2014-07-14,7,11
173925,173934," ","https://farm9.staticflickr.com/8404/29262344086_19a253efde.jpg",0,44.518119,-72.824325,"29262344086","31827372@N00"," ","8/28/2016 12:37","8/28/2016 19:34","nature","wilderness","rock","nature reserve","tree","path","forest","woodland","trail","geology",173934,2,"VT",2016-08-28 12:37:00,2016-08-28,8,12
59815,59823,"[patrickjoust](http://www.patrickjoust.com/) |
[flickr](https://www.flickr.com/photos/patrickjoust/) |
[tumblr](http://patrickjoust.tumblr.com/) |
[facebook](https://www.facebook.com/pages/Patrick-Joust-
Photography/645241562187391) |
[books](http://www.","https://farm6.staticflickr.com/5697/23203495943_6106c03d09.jpg",0,43.783682,-74.281482,"23203495943","20905078@N04","Oroville, CA","6/1/2015 0:00","12/18/2015 17:00","home","house","window","darkness","lighting","night","door","facade","interior design"," ",59823,1,"NY",2015-06-01 00:00:00,2015-06-01,6,0
199260,199269,"Jeudevine Falls Wedding | Hardwick, VT","https://farm6.staticflickr.com/5679/20580163371_e7c50ef7e2.jpg",0,44.5485,-72.371879,"20580163371","67590881@N04","Keene, NH","8/1/2015 14:58","8/14/2015 18:02","flower","woman","bride","lady","flower arranging","plant","girl","ceremony","wedding","dress",199269,2,"VT",2015-08-01 14:58:00,2015-08-01,8,14
98145,98154," ","https://farm1.staticflickr.com/312/31668069380_20ef07319e.jpg",0,43.562261,-73.732562,"31668069380","148245800@N03"," ","5/31/2013 12:08","1/2/2017 5:17","road","car","highway","plant","tree","nature","sky","woody plant","mountainous landforms","infrastructure",98154,1,"NY",2013-05-31 12:08:00,2013-05-31,5,12
103583,103592,"OLYMPUS DIGITAL CAMERA ................... Frontier ghost town.......","https://farm2.staticflickr.com/1687/24428147093_71face5fd6.jpg",0,43.943634,-73.734977,"24428147093","61407498@N08","Saratoga Springs N.Y.","2/15/2016 11:22","2/16/2016 0:25","snow","winter","sugar house","home","house","shack","log cabin","shed","barn","signage",103592,1,"NY",2016-02-15 11:22:00,2016-02-15,2,11
74839,74848,"OLYMPUS DIGITAL CAMERA","https://farm9.staticflickr.com/8479/8200883417_f4fb9ac6ba.jpg",0,42.948946,-73.790659,"8200883417","61407498@N08","Saratoga Springs N.Y.","11/13/2012 15:13","11/20/2012 2:16","home","house","property","residential area","tree","town","suburb","neighbourhood","real estate","cottage",74848,1,"NY",2012-11-13 15:13:00,2012-11-13,11,15
207767,209477," ","https://farm5.staticflickr.com/4466/37549539152_2768c1dd27.jpg",0,44.25721,-71.252946,"37549539152","13086086@N02","L-town, CA","10/8/2017 19:25","10/8/2017 23:25","sky","leaf","cloud","tree","highland","woody plant","mountainous landforms","autumn","mountain","road",209477,3,"NH",2017-10-08 19:25:00,2017-10-08,10,19
25949,25956," ","https://farm9.staticflickr.com/8435/28685146395_e3e53686e3.jpg",0,44.054233,-71.626756,"28685146395","52906672@N00","Bronx, NY","7/31/2016 14:38","8/1/2016 0:18","sky","black","night","atmosphere","darkness","tree","light","black and white","atmosphere of earth","phenomenon",25956,3,"NH",2016-07-31 14:38:00,2016-07-31,7,14
273195,273112,"Stars, Eastport, Maine","https://farm3.staticflickr.com/2856/9943187584_d82b8c10f4.jpg",0,44.892743,-66.995691,"9943187584","98285795@N03"," ","9/6/2013 23:38","9/26/2013 2:09","black","sky","atmosphere","night","galaxy","astronomical object","star","atmosphere of earth","darkness","universe",273112,4,"ME",2013-09-06 23:38:00,2013-09-06,9,23
221991,221650,"NENSA Eastern Cup 2014 Rumford, ME","https://farm8.staticflickr.com/7455/12057935946_4920bd11e7.jpg",0,44.576486,-70.614262,"12057935946","32750264@N02"," ","1/18/2014 12:53","1/20/2014 21:10","ski pole","skiing","ski","cross country skiing","nordic combined","ski equipment","nordic skiing","ski cross","alpine skiing","race",221650,4,"ME",2014-01-18 12:53:00,2014-01-18,1,12
80009,80018," ","https://farm9.staticflickr.com/8410/29594789024_04e7122cfb.jpg",0,43.340616,-73.607933,"29594789024","29498428@N00"," ","9/24/2016 7:09","10/10/2016 0:22","hot air ballooning","hot air balloon","sky","atmosphere of earth","daytime","balloon","air sports","parachuting"," "," ",80018,1,"NY",2016-09-24 07:09:00,2016-09-24,9,7
30075,30082," ","https://farm9.staticflickr.com/8575/16846914905_a4d94ae522.jpg",0,44.155602,-71.367759,"16846914905","78429138@N06"," ","3/10/2015 8:48","3/17/2015 19:22","freezing","winter","snow","waterfall","ice","water","icicle","water feature","formation","tree",30082,3,"NH",2015-03-10 08:48:00,2015-03-10,3,8
171154,171163," ","https://farm5.staticflickr.com/4295/35862612472_16794d56c0.jpg",0,44.223575,-72.529992,"35862612472","133341432@N02"," ","7/19/2017 9:36","7/19/2017 22:54","plant","green","tree","nature","woody plant","yellow","outdoor recreation","vertebrate","day","recreation",171163,2,"VT",2017-07-19 09:36:00,2017-07-19,7,9
130984,130993," ","https://farm6.staticflickr.com/5725/22473649085_6d9264bdb6.jpg",0,44.113747,-73.850814,"22473649085","28879778@N00","Newark, NY","10/24/2015 13:34","10/25/2015 21:47","wilderness","tree","forest","woodland","trail","rock","adventure","backpacking","vehicle","plant",130993,1,"NY",2015-10-24 13:34:00,2015-10-24,10,13
15676,15683," ","https://farm6.staticflickr.com/5683/20355767470_647c42d930.jpg",0,43.730022,-71.581725,"20355767470","82117239@N00","Center Harbor","7/29/2015 19:53","8/13/2015 16:46","dish","food","cuisine","leaf vegetable","recipe","asian food"," "," "," "," ",15683,3,"NH",2015-07-29 19:53:00,2015-07-29,7,19
114135,114144," ","https://farm3.staticflickr.com/2815/9356401248_5f6ecf0097.jpg",0,44.3766,-75.859758,"9356401248","24702366@N00"," ","7/20/2013 16:00","7/24/2013 2:34","sky","cloud","tree","water","nature","body of water","woody plant","sea","horizon","daytime",114144,1,"NY",2013-07-20 16:00:00,2013-07-20,7,16
172024,172033," ","https://farm5.staticflickr.com/4325/35849379700_85052c7b58.jpg",0,44.311419,-72.502931,"35849379700","42555923@N00"," ","10/14/2015 17:47","7/29/2017 14:23","nature","painting","woodland","yellow","tree","forest","leaf","sky","sunlight","morning",172033,2,"VT",2015-10-14 17:47:00,2015-10-14,10,17
243367,243376,"Acadia National Park, Maine","https://farm6.staticflickr.com/5555/30493920592_db431ace7b.jpg",0,44.352941,-68.224475,"30493920592","35660941@N02","San Diego, CA","10/3/2016 14:42","10/28/2016 3:08","highland","sky","cloud","loch","wilderness","coast","mountain","tree","leaf","hill",243376,4,"ME",2016-10-03 14:42:00,2016-10-03,10,14
225300,225309," ","https://farm3.staticflickr.com/2903/33094195214_3b95f8358a.jpg",0,45.053819,-70.3086,"33094195214","92611166@N00"," ","4/9/2017 14:43","4/9/2017 18:43","skiing","ski pole","ski","ski touring","cross country skiing","nordic skiing","mountain range","ski mountaineering","winter","snow",225309,4,"ME",2017-04-09 14:43:00,2017-04-09,4,14
272642,272558,"Hamilton Cove Preserve Hike","https://farm9.staticflickr.com/8017/7491549598_11b9dccf40.jpg",0,44.787671,-67.01333,"7491549598","76985374@N00"," ","6/25/2012 15:58","7/3/2012 2:26","nature","green","plant","grass","tree","male","fun","recreation","water","vacation",272558,4,"ME",2012-06-25 15:58:00,2012-06-25,6,15
209511,207888," ","https://farm4.staticflickr.com/3810/20163378679_992eac2669.jpg",0,44.215947,-70.579186,"20163378679","99010618@N06"," ","7/11/2015 8:00","8/6/2015 18:20","water","water transportation","endurance sports","oar","waterway","boats and boating equipment and supplies","outdoor recreation","leisure","water sport","fun",207888,4,"ME",2015-07-11 08:00:00,2015-07-11,7,8
116285,116294," ","https://farm4.staticflickr.com/3895/15148144051_ee9b010234.jpg",0,44.201498,-74.470858,"15148144051","87116007@N02"," ","8/29/2014 17:02","9/5/2014 22:26","reflection","water","wetland","marsh","bog","swamp","bank","sky","water resources","grass",116294,1,"NY",2014-08-29 17:02:00,2014-08-29,8,17
222423,222407," ","https://farm5.staticflickr.com/4177/34324663592_aa9583f64e.jpg",0,44.906502,-70.726562,"34324663592","67221575@N00"," ","4/27/2017 11:55","5/6/2017 11:53","sky","cloud","highland","panorama","mountain","photography","geological phenomenon","hill","phenomenon","mountain range",222407,4,"ME",2017-04-27 11:55:00,2017-04-27,4,11
19382,19390," ","https://farm5.staticflickr.com/4493/37618372431_32e9558853.jpg",0,44.116352,-71.681617,"37618372431","51405371@N00"," ","10/7/2017 9:45","10/10/2017 15:53","road","sky","highway","lane","car","cloud","highland","mountainous landforms","infrastructure","controlled access highway",19390,3,"NH",2017-10-07 09:45:00,2017-10-07,10,9
231466,231475," ","https://farm4.staticflickr.com/3941/15548045242_b225c286a4.jpg",0,44.153638,-68.691948,"15548045242","70221037@N00","Springfield MA","10/7/2014 16:25","10/16/2014 5:13","sky","sea","cloud","shore","water","coast","coastal and oceanic landforms","horizon","ocean","loch",231475,4,"ME",2014-10-07 16:25:00,2014-10-07,10,16
28086,28093,"DCIM\110GOPRO\GOPR2604.JPG","https://farm5.staticflickr.com/4426/37081313896_f0ee89e985.jpg",0,44.119372,-71.588006,"37081313896","15970544@N08","Dedham, MA","9/16/2017 11:11","9/17/2017 2:42","water","body of water","stream","wilderness","river","watercourse","nature reserve","water resources","outdoor recreation","creek",28093,3,"NH",2017-09-16 11:11:00,2017-09-16,9,11
49052,49060," ","https://farm9.staticflickr.com/8341/29277713335_c6669dca17.jpg",0,43.337327,-75.112973,"29277713335","75625620@N02"," ","8/22/2016 15:01","8/28/2016 5:54","motocross","racing","motorcycling","motorcycle racing","motorsport","endurocross","freestyle motocross","off roading","enduro","extreme sport",49060,1,"NY",2016-08-22 15:01:00,2016-08-22,8,15
113190,113199," ","https://farm8.staticflickr.com/7331/9355600015_39abe65be4.jpg",0,44.35113,-75.914298,"9355600015","10416863@N00","Athens of  Ouzobourdistan aka Greece, official EU (re)member state","10/1/2012 0:00","7/24/2013 10:46","cloud","sky","waterway","nature","loch","water","water transportation","sea","lake","water resources",113199,1,"NY",2012-10-01 00:00:00,2012-10-01,10,0
113133,113142," ","https://farm8.staticflickr.com/7429/9518103241_5f426e93f9.jpg",0,44.34983,-75.919039,"9518103241","31963397@N04","Morristown NJ","8/10/2013 19:45","8/15/2013 23:50","waterway","water transportation","property","lake","home","river","water","real estate","loch","coast",113142,1,"NY",2013-08-10 19:45:00,2013-08-10,8,19
227106,227115," ","https://farm9.staticflickr.com/8773/27670318624_df3c08a4a5.jpg",0,45.044,-70.326667,"27670318624","92611166@N00"," ","2/17/2014 12:58","7/13/2016 15:57","snow","winter","sky","mountainous landforms","mountain","cloud","tree","freezing","mountain range","landscape",227115,4,"ME",2014-02-17 12:58:00,2014-02-17,2,12
218995,218778," ","https://farm4.staticflickr.com/3952/15540315946_b75bc05b3f.jpg",0,44.4904,-70.887511,"15540315946","53754214@N00","Wharton, NJ","10/18/2014 10:57","10/18/2014 14:57","sky","leaf","highland","autumn","tree","cloud","mountainous landforms","mountain","wilderness","atmosphere",218778,4,"ME",2014-10-18 10:57:00,2014-10-18,10,10
238167,238176," ","https://farm9.staticflickr.com/8072/30007399712_f412ea7649.jpg",0,44.307191,-68.18942,"30007399712","71631929@N00"," ","6/16/2016 14:23","10/5/2016 0:39","bird","fauna","seabird","water","beak","sky","sea","gull","wildlife","coast",238176,4,"ME",2016-06-16 14:23:00,2016-06-16,6,14
114423,114432,"OLYMPUS DIGITAL CAMERA","https://farm5.staticflickr.com/4493/36989938580_d261292b4a.jpg",0,44.113636,-74.634628,"36989938580","46868682@N04","upstate new york","9/17/2017 14:03","9/22/2017 14:47","reflection","waterway","wilderness","water","river","nature reserve","tree","lake","creek","bayou",114432,1,"NY",2017-09-17 14:03:00,2017-09-17,9,14
225622,225631," ","https://farm9.staticflickr.com/8418/28260815944_2a2ccf1fac.jpg",0,45.040324,-70.31765,"28260815944","92611166@N00"," ","10/12/2014 15:40","8/9/2016 21:35","wilderness","sky","highland","hill","ridge","mountain","fell","morning","tree","plain",225631,4,"ME",2014-10-12 15:40:00,2014-10-12,10,15
77987,77996," ","https://farm6.staticflickr.com/5312/7428322774_1beff9bcdb.jpg",0,43.000862,-73.744013,"7428322774","86385587@N00","Taunton, Somerset","6/23/2012 18:30","6/23/2012 22:30","reflection","water","nature","waterway","body of water","river","tree","bayou","lake","wetland",77996,1,"NY",2012-06-23 18:30:00,2012-06-23,6,18
215932,215921,"Presidential Traverse, Aug 16-18 2013. After a particularly steep and rocky
descent off Mt Adams, the legs and knees were really starting to feel it. The
first glimpse of Madison Spring Hut was a cause for minor celebration!","https://farm4.staticflickr.com/3704/9605110558_73216d431c.jpg",0,44.326385,-71.287552,"9605110558","26127335@N02","Sydney","8/17/2013 14:40","8/27/2013 2:10","ridge","mountain","highland","mountainous landforms","wilderness","mount scenery","chaparral","fell","sky","vegetation",215921,3,"NH",2013-08-17 14:40:00,2013-08-17,8,14
78068,78077," ","https://farm3.staticflickr.com/2826/32526079354_59c20d8c62.jpg",0,42.954759,-73.570717,"32526079354","48891180@N00"," ","3/10/2017 16:33","3/11/2017 3:27","leaf","plant","wood","soil","deciduous"," "," "," "," "," ",78077,1,"NY",2017-03-10 16:33:00,2017-03-10,3,16
132518,132527," ","https://farm8.staticflickr.com/7167/13689902035_c337cc18db.jpg",0,44.168152,-73.811942,"13689902035","31192101@N03","Winchester, VA","4/6/2014 9:28","4/7/2014 10:14","snow","winter","nature","tree","ecosystem","spruce fir forest","wilderness","forest","woodland","sky",132527,1,"NY",2014-04-06 09:28:00,2014-04-06,4,9
235909,235918," ","https://farm9.staticflickr.com/8415/28558351313_da98558064.jpg",0,44.301719,-68.314592,"28558351313","92611166@N00"," ","8/17/2016 11:48","8/23/2016 12:32","rock","bedrock","geology","soil","fault","road surface","grass","texture","outcrop","stone wall",235918,4,"ME",2016-08-17 11:48:00,2016-08-17,8,11
265440,265449," ","https://farm4.staticflickr.com/3694/10237339434_ff5d486918.jpg",0,44.371844,-68.090923,"10237339434","9783122@N07","Brookville","10/7/2013 10:27","10/13/2013 2:31","waterway","water","body of water","loch","coastal and oceanic landforms","sea","boat","coast","sky","ocean",265449,4,"ME",2013-10-07 10:27:00,2013-10-07,10,10
103363,103372,"Arch Rock from the back - not much room to squeeze through.","https://farm5.staticflickr.com/4383/36333946545_b08cfbdf5c.jpg",0,43.74725,-73.853713,"36333946545","22462989@N05","Belfast","7/14/2017 16:13","8/2/2017 15:33","rock","cave","formation","geology","tree","ruins"," "," "," "," ",103372,1,"NY",2017-07-14 16:13:00,2017-07-14,7,16
236607,236616," ","https://farm6.staticflickr.com/5565/14985097588_798863f9f9.jpg",0,44.275202,-68.313264,"14985097588","28291305@N03"," ","8/22/2014 20:55","9/7/2014 21:25","food","dish","seafood","meal","cuisine","junk food","fast food","animal source foods","lunch","sandwich",236616,4,"ME",2014-08-22 20:55:00,2014-08-22,8,20
245331,245340," ","https://farm8.staticflickr.com/7453/27205118814_b5dc666876.jpg",0,44.342647,-68.179498,"27205118814","92611166@N00"," ","8/9/2014 12:18","6/21/2016 15:04","reflection","nature","wilderness","water","nature reserve","sky","loch","vegetation","highland","wetland",245340,4,"ME",2014-08-09 12:18:00,2014-08-09,8,12
126353,126362," ","https://farm1.staticflickr.com/768/20544793342_12d78a2652.jpg",0,44.734,-74.286264,"20544793342","58143558@N00"," ","8/12/2015 13:32","8/14/2015 0:41","red","pink","furniture","chair","wood","outdoor furniture","table","product design"," "," ",126362,1,"NY",2015-08-12 13:32:00,2015-08-12,8,13
278895,278912," ","https://farm4.staticflickr.com/3812/9593698807_3a42576a9c.jpg",0,46.150732,-67.849953,"9593698807","14727114@N03"," ","8/24/2013 16:24","8/26/2013 1:59","vertebrate","plant","outdoor recreation","tree","grass","recreation","fun","middle ages"," "," ",278912,4,"ME",2013-08-24 16:24:00,2013-08-24,8,16
186399,188081," ","https://farm3.staticflickr.com/2868/9226089382_d5a78ef24a.jpg",0,44.564166,-73.453834,"9226089382","77736032@N00","Gales Ferry CT","7/1/2013 17:07","7/6/2013 20:07","property","grass","house","yard","tree","backyard","garden","estate","land lot","outdoor structure",188081,1,"NY",2013-07-01 17:07:00,2013-07-01,7,17
12769,12776," ","https://farm6.staticflickr.com/5818/30456869944_4a8bff3bd1.jpg",0,43.583919,-71.212906,"30456869944","59899143@N00","Philly","11/27/2016 13:24","11/27/2016 18:16","sky","loch","cloud","sea","water","waterway","horizon","lake","river","reservoir",12776,3,"NH",2016-11-27 13:24:00,2016-11-27,11,13
169009,169018," ","https://farm4.staticflickr.com/3877/33193232076_a42e053a36.jpg",0,44.154519,-72.903376,"33193232076","14436156@N00","Canton, CT","2/11/2017 9:33","3/4/2017 1:07","snow","footwear","winter","skiing","tree","nordic skiing","cross country skiing","path","geological phenomenon","winter sport",169018,2,"VT",2017-02-11 09:33:00,2017-02-11,2,9
188214,186583," ","https://farm4.staticflickr.com/3795/14099530077_aa27a22992.jpg",0,44.622333,-73.276333,"14099530077","75674173@N00"," ","9/26/2013 7:45","5/27/2014 21:33","fog","mist","morning","atmosphere","sky","haze","drizzle","land lot","phenomenon","hill station",186583,2,"VT",2013-09-26 07:45:00,2013-09-26,9,7
99473,99482," ","https://farm6.staticflickr.com/5789/20683509595_023b0b6e55.jpg",0,43.3772,-73.6136,"20683509595","15955344@N00"," ","8/18/2015 12:26","8/18/2015 16:26","mettwurst","meat","sausage","bratwurst","kielbasa","loukaniko","italian sausage","sujuk","charcuterie","chorizo",99482,1,"NY",2015-08-18 12:26:00,2015-08-18,8,12
215512,215501,"King Ravine Trail Interested in using my photos? Please see [this note in my
profile](https://www.flickr.com/people/logicalrealist/).","https://farm8.staticflickr.com/7299/26722086790_8afbb9384a.jpg",0,44.335728,-71.296108,"26722086790","83413148@N00","Little Silver, NJ","8/20/2015 6:44","5/13/2016 21:24","waterfall","water","nature","watercourse","body of water","stream","water resources","nature reserve","creek","wilderness",215501,3,"NH",2015-08-20 06:44:00,2015-08-20,8,6
98296,98305," ","https://farm6.staticflickr.com/5572/31240075246_724883d9c9.jpg",0,43.418943,-73.706613,"31240075246","145781285@N03","Boston, MA","3/16/2016 14:59","11/27/2016 16:35","water","lake","nature","tree","woody plant","loch","sky","winter","snow","leaf",98305,1,"NY",2016-03-16 14:59:00,2016-03-16,3,14
39821,39838," ","https://farm9.staticflickr.com/8396/8615525916_9f5991ab8f.jpg",0,44.25773,-71.439444,"8615525916","32693718@N07","Lancaster, Pennsylvania","9/16/2012 0:00","4/3/2013 2:01","room","furniture","table","dining room","home","interior design","flooring","kitchen","window","cabinetry",39838,3,"NH",2012-09-16 00:00:00,2012-09-16,9,0
200138,200147," ","https://farm4.staticflickr.com/3923/14635352417_d6fa872bb7.jpg",0,44.806488,-72.208406,"14635352417","74133755@N00","Barton, Vermont","6/10/2014 16:56","8/3/2014 22:00","bird","fauna","beak","blackbird","grass","wildlife","american crow","grass family","perching bird","cuculiformes",200147,2,"VT",2014-06-10 16:56:00,2014-06-10,6,16
232392,232401," ","https://farm9.staticflickr.com/8286/7747566726_35d860601a.jpg",0,44.237466,-68.558678,"7747566726","35685343@N00"," ","7/23/2012 11:20","8/9/2012 17:36","boat","sea kayak","kayak","water","oar","water transportation","boats and boating equipment and supplies","sea","watercraft","kayaking",232401,4,"ME",2012-07-23 11:20:00,2012-07-23,7,11
276050,276062,"Had a wonderful adventure up in the Northwoods of Maine, west area of
Moosehead Lake. Spent many hours watching & interacting with the local
wildlife. Found many will participants to photograph.","https://farm6.staticflickr.com/5633/21961717469_0799ee44f3.jpg",0,45.748495,-69.798181,"21961717469","8800191@N04","Willington","10/13/2015 19:23","10/13/2015 23:24","bird","duck","beak","mallard","fauna","ducks geese and swans","water bird","ecosystem","wildlife","waterfowl",276062,4,"ME",2015-10-13 19:23:00,2015-10-13,10,19
143667,143692," ","https://farm2.staticflickr.com/1466/23694533454_6ccf37315b.jpg",0,44.345366,-73.412414,"23694533454","45724078@N05","12996","1/9/2016 12:23","1/11/2016 21:36","snow","water","winter","tree","river","freezing","bank","geological phenomenon","ice","reflection",143692,1,"NY",2016-01-09 12:23:00,2016-01-09,1,12
259617,259626," ","https://farm8.staticflickr.com/7387/27696924605_cd16c7a400.jpg",0,44.40735,-68.244239,"27696924605","92611166@N00"," ","7/30/2015 11:11","6/16/2016 3:39","tree","nature","ecosystem","vegetation","woody plant","sky","forest","woodland","leaf","plant",259626,4,"ME",2015-07-30 11:11:00,2015-07-30,7,11
129087,129096," ","https://farm4.staticflickr.com/3667/33131463331_c4a0ed1601.jpg",0,44.087805,-74.1202,"33131463331","141413392@N07","Malden, MA","8/27/2016 11:45","3/5/2017 9:30","face","man","tree","person","woody plant","head","male","forehead","chin","facial hair",129096,1,"NY",2016-08-27 11:45:00,2016-08-27,8,11
241598,241607," ","https://farm5.staticflickr.com/4352/36917782010_ed4b8c7112.jpg",0,44.352272,-68.207825,"36917782010","90463382@N04"," ","8/28/2017 9:40","9/19/2017 1:15","rock","outdoor recreation","geological phenomenon","rock climbing","geology","recreation","climbing","tree","boulder","adventure",241607,4,"ME",2017-08-28 09:40:00,2017-08-28,8,9
19213,19221,"DCIM\110GOPRO\GOPR3057.JPG","https://farm5.staticflickr.com/4464/37446235500_37ae2ed1a4.jpg",0,44.073886,-71.925642,"37446235500","44126613@N00","Dedham, MA","10/14/2017 14:46","10/15/2017 4:36","wilderness","mountain","ridge","mountainous landforms","vegetation","leaf","tree","chaparral","path","autumn",19221,3,"NH",2017-10-14 14:46:00,2017-10-14,10,14
32785,32792," ","https://farm9.staticflickr.com/8661/28841468171_67b3481668.jpg",0,44.052819,-71.129998,"28841468171","70655643@N00"," ","8/11/2016 14:16","8/11/2016 18:37","transport","locomotive","track","rail transport","train","vehicle","motor vehicle","rolling stock","mode of transport","public transport",32792,3,"NH",2016-08-11 14:16:00,2016-08-11,8,14
58954,58962," ","https://farm9.staticflickr.com/8202/28959989675_2f6b0d3a11.jpg",0,43.906425,-74.547067,"28959989675","143802280@N07"," ","8/9/2016 11:33","8/13/2016 20:00","plant","ferns and horsetails","vegetation","leaf","fern","vascular plant","tree","terrestrial plant","grass","evergreen",58962,1,"NY",2016-08-09 11:33:00,2016-08-09,8,11
241771,241780," ","https://farm5.staticflickr.com/4378/37293158915_6faa530247.jpg",0,44.353338,-68.223389,"37293158915","133282363@N04"," ","9/8/2017 6:12","9/18/2017 0:14","sky","horizon","sea","shore","coast","headland","sunset","morning","dawn","calm",241780,4,"ME",2017-09-08 06:12:00,2017-09-08,9,6
18193,18201," ","https://farm3.staticflickr.com/2840/9229122281_2e1412cd59.jpg",0,43.928333,-71.229,"9229122281","92262338@N00"," ","7/1/2012 18:35","7/7/2013 15:04","furniture","couch","room","product","bed","floor","flooring","chair","table"," ",18201,3,"NH",2012-07-01 18:35:00,2012-07-01,7,18
245026,245035," ","https://farm8.staticflickr.com/7200/27809118921_1eb898496d.jpg",0,44.3525,-68.2225,"27809118921","92611166@N00"," ","7/21/2013 13:20","6/25/2016 20:15","sky","coast","sea","promontory","headland","highland","cape","cloud","horizon","bay",245035,4,"ME",2013-07-21 13:20:00,2013-07-21,7,13
36281,36288,"Olympus digital camera","https://farm8.staticflickr.com/7355/10495621383_f313560fd0.jpg",0,44.116369,-71.18235,"10495621383","35799401@N07","Denver, CO","10/13/2013 10:31","10/26/2013 16:30","skin","child","nose","beauty","girl","cheek","eye","close up","infant","mother",36288,3,"NH",2013-10-13 10:31:00,2013-10-13,10,10
191082,190797," ","https://farm4.staticflickr.com/3827/9438757144_0c718fa398.jpg",0,44.904285,-73.254798,"9438757144","99845375@N04"," ","8/3/2013 0:06","8/4/2013 18:48","car","tree","vehicle","vertebrate","plant","water","outdoor recreation","recreation","fun","hobby",190797,2,"VT",2013-08-03 00:06:00,2013-08-03,8,0
258750,258759," ","https://farm8.staticflickr.com/7733/27273516463_e691e10493.jpg",0,44.399499,-68.199,"27273516463","92611166@N00"," ","7/22/2013 17:20","6/25/2016 20:17","sea","water","waterway","loch","boat","sea kayak","kayak","sky","boating","ocean",258759,4,"ME",2013-07-22 17:20:00,2013-07-22,7,17
222171,221880,"Grafton Notch State Park, Grafton, Maine. Saw lots of Hobblebush blooming
while up in Grafton Notch at Screw Auger Falls.","https://farm8.staticflickr.com/7387/8725293665_26ae78a3aa.jpg",0,44.571485,-70.903465,"8725293665","21043193@N06"," ","5/9/2013 16:42","5/10/2013 14:57","white","plant","flower","flora","spring","blossom","viburnum","flowering plant","branch","twig",221880,4,"ME",2013-05-09 16:42:00,2013-05-09,5,16
195973,195982," ","https://farm8.staticflickr.com/7126/7539882676_d86f1c3dcf.jpg",0,44.588833,-72.785167,"7539882676","60572297@N03"," ","7/4/2012 17:06","7/10/2012 1:38","people","photograph","facial expression","green","person","social group","mammal","smile","child","vertebrate",195982,2,"VT",2012-07-04 17:06:00,2012-07-04,7,17
9660,9667," ","https://farm9.staticflickr.com/8116/8660826454_69f585f211.jpg",0,43.901448,-72.14168,"8660826454","94846415@N07"," ","4/17/2013 18:25","4/18/2013 13:51","sky","nature","tree","woody plant","atmosphere","darkness","night","light","morning","atmosphere of earth",9667,3,"NH",2013-04-17 18:25:00,2013-04-17,4,18
278106,278120,"Katahdin is part of NE111, NE100, NE4000","https://farm8.staticflickr.com/7290/9943255925_f0c3e14ccc.jpg",0,45.906302,-68.906248,"9943255925","56473607@N05","Montreal","9/15/2013 10:04","9/26/2013 1:54","mountain","mountainous landforms","sky","ridge","wilderness","mountain range","rock","highland","arte","fell",278120,4,"ME",2013-09-15 10:04:00,2013-09-15,9,10
21534,21495," ","https://farm8.staticflickr.com/7285/27465215903_7fc382910e.jpg",0,44.084255,-71.684159,"27465215903","129507451@N02"," ","7/3/2016 18:51","7/4/2016 12:07","sky","cloud","mountainous landforms","highland","cumulus","mountain","mount scenery","hill","daytime","horizon",21495,3,"NH",2016-07-03 18:51:00,2016-07-03,7,18
37349,37366,"DCIM\110GOPRO\GOPR2224.JPG","https://farm5.staticflickr.com/4394/35995152914_c79daaab48.jpg",0,44.216702,-71.531648,"35995152914","15970544@N08","Dedham, MA","8/24/2017 4:23","8/27/2017 2:09","path","wilderness","trail","nature reserve","forest","woodland","adventure","tree","jungle","biome",37366,3,"NH",2017-08-24 04:23:00,2017-08-24,8,4
138332,138341," ","https://farm4.staticflickr.com/3693/19927303470_9a23987e53.jpg",0,44.353609,-73.861648,"19927303470","98753410@N00"," ","7/29/2015 6:43","7/29/2015 13:43","text","advertising","font","brand","sky"," "," "," "," "," ",138341,1,"NY",2015-07-29 06:43:00,2015-07-29,7,6
129401,129410,"Warm, bluebird day atop Allen.","https://farm6.staticflickr.com/5639/31197358036_34a00110a7.jpg",0,44.070936,-73.939748,"31197358036","94811196@N08"," ","11/19/2016 10:59","11/25/2016 14:20","mountainous landforms","tree","sky","mountain","wilderness","woody plant","mountain range","plant","national park","branch",129410,1,"NY",2016-11-19 10:59:00,2016-11-19,11,10
16327,16334," ","https://farm4.staticflickr.com/3908/15107340092_6315f96635.jpg",0,43.723636,-71.456853,"15107340092","22882695@N00"," ","8/30/2014 19:56","9/1/2014 17:00","sky","water","loch","reflection","nature","lake","body of water","waterway","river","calm",16334,3,"NH",2014-08-30 19:56:00,2014-08-30,8,19
200087,200096,"Old Grave at Westlook Cemetery Glover, Vt","https://farm6.staticflickr.com/5563/15003568315_68bb29db89.jpg",0,44.688121,-72.191741,"15003568315","34674104@N02"," ","8/15/2014 12:17","8/22/2014 23:23","grave","cemetery","headstone","grass","memorial"," "," "," "," "," ",200096,2,"VT",2014-08-15 12:17:00,2014-08-15,8,12
170587,170596," ","https://farm8.staticflickr.com/7122/7530135112_3e34242641.jpg",0,44.183833,-72.837,"7530135112","87533642@N00"," ","7/8/2012 6:51","7/8/2012 10:51","crowd","road","infrastructure","race","recreation","sports","street","running","fun","morning",170596,2,"VT",2012-07-08 06:51:00,2012-07-08,7,6
46040,46048,"Uploaded via [ift.tt/1dlJLB2](http://ift.tt/1dlJLB2)","https://farm6.staticflickr.com/5625/23022802986_ba0dacf10c.jpg",0,43.016275,-74.805064,"23022802986","92162316@N07"," ","10/1/2015 18:56","11/16/2015 0:05","sky","cloud","sunset","infrastructure","road","dawn","sunrise","dusk","evening","afterglow",46048,1,"NY",2015-10-01 18:56:00,2015-10-01,10,18
240251,240260," ","https://farm9.staticflickr.com/8041/8053910369_e22e03f33c.jpg",0,44.307108,-68.192505,"8053910369","34136590@N02"," ","10/2/2012 11:00","10/4/2012 16:19","sea","sky","coast","shore","body of water","ocean","beach","coastal and oceanic landforms","horizon","water",240260,4,"ME",2012-10-02 11:00:00,2012-10-02,10,11
97378,97387," ","https://farm5.staticflickr.com/4354/36579256234_8fbb849dc5.jpg",0,43.262862,-73.585674,"36579256234","95263361@N07"," ","9/23/2017 14:15","9/24/2017 17:12","nature","plant","grass","tree","outdoor recreation","leaf","lawn","rural area","landscape","recreation",97387,1,"NY",2017-09-23 14:15:00,2017-09-23,9,14
98453,98462," ","https://farm6.staticflickr.com/5443/31161419001_4b730dfd26.jpg",0,43.418943,-73.706613,"31161419001","145781285@N03","Boston, MA","3/8/2016 17:42","11/27/2016 16:36","snow","water","winter","freezing","ice","arctic","fun","sea","sky","recreation",98462,1,"NY",2016-03-08 17:42:00,2016-03-08,3,17
65969,65978," ","https://farm6.staticflickr.com/5608/15584247062_e6cce02055.jpg",0,42.868867,-73.822541,"15584247062","99290939@N03"," ","10/19/2014 20:44","10/20/2014 14:18","blue","purple","entertainment","violet","light","event","stage","performance","fun","concert",65978,1,"NY",2014-10-19 20:44:00,2014-10-19,10,20
245355,245364," ","https://farm8.staticflickr.com/7454/27205878493_7e31b7f79e.jpg",0,44.340355,-68.17675,"27205878493","92611166@N00"," ","8/9/2014 12:32","6/21/2016 15:04","dog","dog like mammal","dog breed","dog breed group","sky","karelian bear dog","rock","border collie","coast","beach",245364,4,"ME",2014-08-09 12:32:00,2014-08-09,8,12
20564,20525,"The Bath Bridge is of the Warren Truss design. What is now a pedestrian only
bridge, was built in 1928 and crosses the Wild Ammonoosuc River","https://farm6.staticflickr.com/5815/30529784060_180b02676f.jpg",0,44.15266,-71.975104,"30529784060","14643312@N02"," ","9/23/2016 14:07","11/7/2016 4:26","structure","tree","shed","outdoor structure","house","shack","plant"," "," "," ",20525,3,"NH",2016-09-23 14:07:00,2016-09-23,9,14
115234,115243," ","https://farm2.staticflickr.com/1567/25616566036_1053ecbece.jpg",0,44.204752,-74.588059,"25616566036","7854041@N08"," ","2/21/2016 15:16","3/9/2016 13:43","winter","snow","tree","freezing","tower","observation tower","sky","frost","ice"," ",115243,1,"NY",2016-02-21 15:16:00,2016-02-21,2,15
62196,62204," ","https://farm6.staticflickr.com/5345/9481347629_861ab97b70.jpg",0,43.458822,-74.22812,"9481347629","74916883@N00"," ","7/31/2013 18:31","8/11/2013 3:23","plant","leaf","tree","shrub"," "," "," "," "," "," ",62204,1,"NY",2013-07-31 18:31:00,2013-07-31,7,18
174592,174601," ","https://farm2.staticflickr.com/1464/24295856380_fc1ea43ebf.jpg",0,44.531005,-72.781106,"24295856380","26526176@N00"," ","1/21/2016 16:10","1/24/2016 22:45","restaurant","food court","interior design","caf","coffeehouse","lobby","cafeteria"," "," "," ",174601,2,"VT",2016-01-21 16:10:00,2016-01-21,1,16
148453,148310," ","https://farm6.staticflickr.com/5791/22573803585_e5da6d6e9e.jpg",0,44.372275,-73.013066,"22573803585","37626266@N07"," ","9/19/2015 6:45","10/29/2015 14:12","sky","red sky at morning","afterglow","dawn","sunrise","sunset","cloud","morning","evening","atmosphere",148310,2,"VT",2015-09-19 06:45:00,2015-09-19,9,6
192062,192071,"Dcim\100gopro","https://farm4.staticflickr.com/3720/9052500985_cd21cf75ef.jpg",0,44.980205,-73.106439,"9052500985","35799401@N07","Denver, CO","6/13/2013 15:56","6/16/2013 0:52","finger","hand","arm","nail","cool","fun","girl","thumb","child","play",192071,2,"VT",2013-06-13 15:56:00,2013-06-13,6,15
105677,105686," ","https://farm4.staticflickr.com/3833/18813594098_bf794bb400.jpg",0,43.737786,-73.452272,"18813594098","8169662@N08"," ","5/8/2015 10:37","6/20/2015 23:50","plant","flora","leaf","spring","tree","shrub"," "," "," "," ",105686,1,"NY",2015-05-08 10:37:00,2015-05-08,5,10
258821,258830," ","https://farm8.staticflickr.com/7549/27850847926_3ca395f85d.jpg",0,44.400666,-68.200167,"27850847926","92611166@N00"," ","7/22/2013 17:14","6/25/2016 20:17","waterway","coastal and oceanic landforms","sea","water","sky","ocean","horizon","loch","shore","calm",258830,4,"ME",2013-07-22 17:14:00,2013-07-22,7,17
222600,222602,"River Otter photographed at Kennebago Lake, ME on 26 May 2015.","https://farm8.staticflickr.com/7783/18165197142_f6a3ef3a33.jpg",0,45.107763,-70.758306,"18165197142","39177293@N03"," ","5/26/2015 5:55","5/27/2015 18:50","fauna","water","bird","sky","sea","calm","ocean","coastal and oceanic landforms","wildlife"," ",222602,4,"ME",2015-05-26 05:55:00,2015-05-26,5,5
222002,221661,"NENSA Eastern Cup 2014 Rumford, ME","https://farm4.staticflickr.com/3758/12057459894_1464d5970b.jpg",0,44.576486,-70.614262,"12057459894","32750264@N02"," ","1/18/2014 11:39","1/20/2014 21:10","ski pole","skiing","ski","cross country skiing","ski cross","ski equipment","nordic combined","headgear","winter sport","race",221661,4,"ME",2014-01-18 11:39:00,2014-01-18,1,11
58222,58230," ","https://farm4.staticflickr.com/3765/12204582745_0e1f6b0cfd.jpg",0,43.73355,-75.565689,"12204582745","102564132@N04"," ","1/23/2014 14:04","1/29/2014 13:00","snow","snowmobile","mode of transport","vehicle","winter","racing","car","ice","water","tree",58230,1,"NY",2014-01-23 14:04:00,2014-01-23,1,14
218839,218593," ","https://farm1.staticflickr.com/657/21144064156_0cdc302edd.jpg",0,44.407525,-70.857575,"21144064156","8558461@N08"," ","8/8/2015 17:01","9/5/2015 19:29","technology","floor","product"," "," "," "," "," "," "," ",218593,4,"ME",2015-08-08 17:01:00,2015-08-08,8,17
197995,198004," ","https://farm8.staticflickr.com/7699/27849354330_b3dd9264b2.jpg",0,44.762986,-72.147003,"27849354330","74133755@N00","Barton, Vermont","7/4/2016 23:23","7/6/2016 15:33","insect","pest","invertebrate","membrane winged insect","fauna","arthropod","organism","fly","wasp","parasite",198004,2,"VT",2016-07-04 23:23:00,2016-07-04,7,23
78355,78364," ","https://farm1.staticflickr.com/621/23041300170_8fc0505878.jpg",0,43.04066,-73.403457,"23041300170","15955344@N00"," ","11/26/2015 21:51","11/27/2015 2:51","food","cuisine","restaurant","interior design"," "," "," "," "," "," ",78364,1,"NY",2015-11-26 21:51:00,2015-11-26,11,21
197835,197844," ","https://farm9.staticflickr.com/8633/28162518572_6b731254bb.jpg",0,44.762986,-72.147003,"28162518572","74133755@N00","Barton, Vermont","7/11/2016 14:37","7/12/2016 16:19","flower","flowering plant","plant","flora","milkweed","herbaceous plant","shrub"," "," "," ",197844,2,"VT",2016-07-11 14:37:00,2016-07-11,7,14
44560,40059,"Glen Ellis Falls Trail near Pinkham Notch in the White Mountains of New
Hampshire,","https://farm6.staticflickr.com/5779/30195899603_a0914b08a8.jpg",0,44.243947,-71.252613,"30195899603","9456601@N03","Harrison Township, MI","6/17/2015 16:07","11/7/2016 4:42","rock","tree","vegetation","wilderness","cliff","nature reserve","bedrock","escarpment","outcrop","geology",40059,3,"NH",2015-06-17 16:07:00,2015-06-17,6,16
231091,231100," ","https://farm6.staticflickr.com/5615/15517637146_9246973dfe.jpg",0,44.840336,-69.406984,"15517637146","45637686@N00"," ","10/14/2014 13:55","10/15/2014 10:20","grass","path","soil","land lot","walkway","landscape","yard","outdoor structure","tree","driveway",231100,4,"ME",2014-10-14 13:55:00,2014-10-14,10,13
236305,236314," ","https://farm6.staticflickr.com/5653/21423197710_358e360a80.jpg",0,44.310811,-68.344978,"21423197710","96231939@N08"," ","9/16/2015 13:52","9/22/2015 0:24","sky","observation tower","tree","tower"," "," "," "," "," "," ",236314,4,"ME",2015-09-16 13:52:00,2015-09-16,9,13
44735,40234," ","https://farm5.staticflickr.com/4276/34188559744_ec62d8805b.jpg",0,44.242936,-71.144959,"34188559744","34704716@N03"," ","5/30/2017 19:42","6/1/2017 14:08","tree","plant","nature","woody plant","outdoor recreation","recreation","fun","winter","soil","adventure",40234,3,"NH",2017-05-30 19:42:00,2017-05-30,5,19
198273,198282," ","https://farm8.staticflickr.com/7349/27938190935_ba4e2d9ed4.jpg",0,44.762986,-72.147003,"27938190935","74133755@N00","Barton, Vermont","6/21/2016 22:54","6/27/2016 14:26","insect","invertebrate","arthropod","pest","organism","membrane winged insect","moths and butterflies","moth","pollinator","bombycidae",198282,2,"VT",2016-06-21 22:54:00,2016-06-21,6,22
239852,239861," ","https://farm8.staticflickr.com/7358/9500134357_6a41983b06.jpg",0,44.268283,-68.305289,"9500134357","86001309@N00","Philadelphia, PA","8/6/2013 8:19","8/13/2013 13:06","mug","cup","cup","coffee cup","tableware","drinkware","ceramic","product","porcelain","font",239861,4,"ME",2013-08-06 08:19:00,2013-08-06,8,8
276990,277002," ","https://farm9.staticflickr.com/8169/7993539993_a649f30b27.jpg",0,45.541,-69.037667,"7993539993","27303817@N08"," ","9/11/2012 13:57","9/16/2012 21:44","path","nature","nature reserve","woodland","tree","trail","bridge","forest","walkway","plant",277002,4,"ME",2012-09-11 13:57:00,2012-09-11,9,13
38784,38801," ","https://farm4.staticflickr.com/3686/13809331705_6fae94aba3.jpg",0,44.2265,-71.418,"13809331705","122784854@N05"," ","10/14/2013 9:39","4/13/2014 0:31","road","sky","highway","cloud","infrastructure","lane","atmosphere","road trip","highland","controlled access highway",38801,3,"NH",2013-10-14 09:39:00,2013-10-14,10,9
130886,130895,"Ice ripples. Lost of ice above 3500 feet.","https://farm6.staticflickr.com/5796/23050672053_54d63f7eef.jpg",0,44.162425,-74.169314,"23050672053","94811196@N08"," ","12/9/2015 12:36","12/11/2015 16:12","footwear","winter","snow","water","wilderness","tree","freezing","woody plant","hiking","geological phenomenon",130895,1,"NY",2015-12-09 12:36:00,2015-12-09,12,12
219275,219198,"At North Peak walking south along Three Mile Trail to Barker Mountain, Sunday
River","https://farm3.staticflickr.com/2887/9695047698_be027e1dcc.jpg",0,44.468227,-70.87867,"9695047698","8405842@N02"," ","9/1/2013 9:28","9/7/2013 16:28","path","nature","wilderness","outdoor recreation","nature reserve","hiking","tree","backpacking","adventure","trail",219198,4,"ME",2013-09-01 09:28:00,2013-09-01,9,9
54675,54683,"The colorful hammock can be shared by two.","https://farm1.staticflickr.com/120/294806243_4ace057dfb.jpg",0,43.140627,-74.500479,"294806243","91409138@N00"," ","5/1/2013 0:00","11/11/2006 22:47","vacation","fun","leisure","sitting","leg","girl","recreation","product"," "," ",54683,1,"NY",2013-05-01 00:00:00,2013-05-01,5,0
11138,11145," ","https://farm2.staticflickr.com/1631/26106094136_80182be40f.jpg",0,43.693585,-71.629829,"26106094136","11811903@N07","Nashua NH","3/30/2016 7:45","3/30/2016 11:47","property","building","real estate","facade","parking lot"," "," "," "," "," ",11145,3,"NH",2016-03-30 07:45:00,2016-03-30,3,7
193411,193420," ","https://farm2.staticflickr.com/1672/26312028290_65203cbfdf.jpg",0,44.561517,-72.758631,"26312028290","85741940@N03"," ","2/28/2015 10:17","4/23/2016 1:02","sky","snow","winter","mountainous landforms","mountain range","mountain","tree","cloud","piste","wilderness",193420,2,"VT",2015-02-28 10:17:00,2015-02-28,2,10
149378,149235," ","https://farm6.staticflickr.com/5539/10507791846_2894c31dc9.jpg",0,44.34713,-73.105537,"10507791846","87271233@N06"," ","10/26/2013 16:34","10/27/2013 7:50","sports","team sport","sport venue","games","player","team","ball game","women's football","soccer player","competition",149235,2,"VT",2013-10-26 16:34:00,2013-10-26,10,16
228041,228050," ","https://farm8.staticflickr.com/7550/27727409671_76c9a77deb.jpg",0,45.093272,-70.254853,"27727409671","92611166@N00"," ","7/6/2014 11:58","6/20/2016 21:41","bicycle","land vehicle","cycle sport","road bicycle","mountain bike","cycling","cross country cycling","path","mountain biking","mountain bike racing",228050,4,"ME",2014-07-06 11:58:00,2014-07-06,7,11
60856,60864," ","https://farm4.staticflickr.com/3925/15052818020_e8db0967b0.jpg",0,43.756185,-74.793505,"15052818020","77457939@N04"," ","9/13/2014 10:38","9/14/2014 20:11","water transportation","boat","vehicle","kayak","water","outdoor recreation","watercraft","leisure","sea kayak","kayaking",60864,1,"NY",2014-09-13 10:38:00,2014-09-13,9,10
107494,107503," ","https://farm5.staticflickr.com/4171/33719816384_6804bac9e9.jpg",0,44.235633,-76.087181,"33719816384","44126314@N07"," ","5/9/2017 14:53","5/9/2017 22:22","plant","flower","flora","annual plant","wildflower","pink family","anemone"," "," "," ",107503,1,"NY",2017-05-09 14:53:00,2017-05-09,5,14
232395,232404," ","https://farm9.staticflickr.com/8291/7747543176_9473f3725d.jpg",0,44.237669,-68.559814,"7747543176","35685343@N00"," ","7/23/2012 11:25","8/9/2012 17:36","boat","kayak","sea kayak","water transportation","water","oar","boats and boating equipment and supplies","vehicle","watercraft","kayaking",232404,4,"ME",2012-07-23 11:25:00,2012-07-23,7,11
240380,240389," ","https://farm9.staticflickr.com/8024/7674618088_018848a6a1.jpg",0,44.311527,-68.188909,"7674618088","66754687@N00","Yarmouth, ME","7/25/2012 13:07","7/30/2012 6:08","water","fun","sea","vacation","rock","cliff","jumping","leisure","coast","tourism",240389,4,"ME",2012-07-25 13:07:00,2012-07-25,7,13
274783,274793,"[Elephant Mountain B-52
Crash](http://en.wikipedia.org/wiki/1963_Elephant_Mountain_B-52_crash)","https://farm8.staticflickr.com/7730/17631284143_4c5700fe0e.jpg",0,45.526405,-69.433692,"17631284143","97108788@N00","Fallston, Maryland","5/29/2015 15:31","5/30/2015 3:08","woodland","forest","nature reserve","tree","motor vehicle","grass","jungle","plant","old growth forest","plant community",274793,4,"ME",2015-05-29 15:31:00,2015-05-29,5,15
270269,270185," ","https://farm3.staticflickr.com/2893/10777889893_dfe8c0133c.jpg",0,44.886705,-69.250781,"10777889893","93083291@N07"," ","11/8/2013 10:57","11/10/2013 14:04","bird","snipe","water bird","fauna","shorebird","duck","beak","ducks geese and swans","wildlife","organism",270185,4,"ME",2013-11-08 10:57:00,2013-11-08,11,10
205905,206033,"**White Mtn Hut Trip - Day 2;** _Crawford Path Trail_ **At the top of Pierce,
looking North** Hike from Mizpah to Lakes of the Clouds hut, over Pierce
(4287'), Eisenhower (4755'), Franklin (4972') and Monroe (5299'). About 4.5+
miles with 2250' of gain a","https://farm5.staticflickr.com/4483/37480592750_2dfec2f3f8.jpg",0,44.22693,-71.365675,"37480592750","13789708@N04","Worcester, MA","8/7/2017 8:59","10/16/2017 18:14","rock","nature reserve","vegetation","wilderness","mountain","geological phenomenon","hill station","highland","outcrop","escarpment",206033,3,"NH",2017-08-07 08:59:00,2017-08-07,8,8
170170,170179," ","https://farm6.staticflickr.com/5576/15130666951_e052c16a43.jpg",0,44.195069,-72.784998,"15130666951","23997564@N08"," ","9/3/2014 17:20","9/4/2014 1:54","yellow","brown","wallet","leather","material","product design","brand","product","caramel color"," ",170179,2,"VT",2014-09-03 17:20:00,2014-09-03,9,17
